author,fans_count,content,created_time,updated_time,comment_count,voteup_count,url
知乎用户,1745,如果有水军，那我能高兴地笑出来，毕竟这些人只是拿钱办事，说明在没给钱的情况下，他们脑子是正常的、他们很可能还是爱国的。我最怕的是有一群人，没人给他们钱，也没人夸他们怂恿他们，但他们就是非常积极地去为讽刺国家而努力，积极地去为我们的敌人辩解而努力，这种人你都不知道他图啥？图刺激？还是图自己作为唯一知情人、唯一揭露人的快感？还是觉得不随大流盲目爱国有特别的爽点？这些人连水军都算不上，你要是去批评他们，他们还会“真心生气委屈”地说你道德绑架他们了，认为他们只是说点不好听的话就故意把他们政治化抹黑他们了。但是他们却比水军更喜欢抹黑国家，你说可怕不可怕？有没有人来科普下这种人的心理有没有啥专业名词形容他们这类型的？,2021-12-31 11:21:19,2021-12-31 11:24:37,0,2,https://www.zhihu.com/api/v4/answers/2292905629
Millerharp,250,眯眯眼这事儿，我看了下，网上基本两种对立论调。第一种，眯眯眼就是歪曲和歧视，我们的审美也是大眼睛。第二种，我们的审美就是眯眯眼，并拿出一些“主流”作品作为论证，批评大眼审美是心中的辫子没有剪掉。我觉得第一种就是没抓住主要矛盾，让第二种论调钻了空子有了理论支撑。这件事情的本质是，西方采用眯眯眼这个特点，并且将整个面容进行丑化，对中国人的形象进行标签化。核心其实是丑陋，而非眯眯眼，是将这两个特征建立联系，并且和国人的标准形象画上等号，并且用高级脸这个词进行PUA（或雇佣水军说是建模问题等借口），是这一整套操作。于是，第二种论调钻了空子：你看，我们的主流作品好多都是眯眯眼。然后有产生了丹凤眼非眯眯眼的反驳……这事儿核心是丑化，是丑化，是丑化！眯眯眼只是一种形式。大眼睛也能整很丑啊，好多美颜相机下的蛇精脸，都是大眼睛，就问一句丑不丑。如果这种形象整在荧幕里，空洞的大眼睛，削尖的下巴，变成国人的标准形象，算是歧视吗？完全可以吧？我们明明有各种各样的帅哥美女呀，就问一句咱们外交部的眯眯眼坚叔帅不帅，就问一句，你拿起镜子，里面的人好不好看？,2021-12-31 11:14:57,2021-12-31 11:14:57,0,2,https://www.zhihu.com/api/v4/answers/2292895905
活到宇宙重启,371,以下是好莱坞最炙热的巨星，维密秀最顶级麻豆。我可没有胆量敢歧视白人老爷，我就是觉得这些都是欧美标准脸型我就觉得这些长相才符合我的欧美人印象。一头金发，雍容华贵。一袭白裙，仙气飘飘兄弟情深夫妻恩爱白头偕老快乐的好兄弟，欧美人和文化的楷模。舆论阵地，我们不去占领，敌人就会占领。,2021-12-30 21:18:34,2021-12-30 22:22:15,0,2,https://www.zhihu.com/api/v4/answers/2292388613
胡麒麟,6,为什么一部电影它不能被说不好看？毁掉一个人从毁掉他的自信开始，那么毁掉一个民族呢？,2021-12-30 16:29:10,2021-12-30 16:29:10,0,2,https://www.zhihu.com/api/v4/answers/2292066160
里德胜,2,怎么水军都不给力啊，你们水军不行啊(▼皿▼#)笑死，我寒假工去电影院，连着7天一张这个电影票都没卖出，上座率01月5号好家伙，我在b站发的关于这个的视频，然后我号被永封了，行，我再去举报一次，TNND，给我玩阴的是吧。,2021-12-30 09:14:59,2022-01-05 07:34:38,4,2,https://www.zhihu.com/api/v4/answers/2291400255
不开音响听歌,113,b站公司里有人极力推荐《雄狮少年》，我就祝他全家长得像主角，然后他急了骂我没有素质。要是换个帅的电影主角都不知道他有多开心了，还不是连自己都觉得那脸长得丑。,2021-12-29 20:15:34,2021-12-29 20:20:34,0,2,https://www.zhihu.com/api/v4/answers/2290978862
saka,4,,2021-12-29 15:52:45,2021-12-29 15:57:46,0,2,https://www.zhihu.com/api/v4/answers/2290646195
Gauge,40,,2021-12-29 12:09:33,2021-12-29 12:23:51,0,2,https://www.zhihu.com/api/v4/answers/2290311905
知乎用户,17,有，而且不少，甚至借着前不久的陈漫事件和现在的奔驰事件在故意混淆概念，把正常人的小眼睛和丹凤眼硬生生抹黑成“眯眯眼”，问题是“眯眯眼”是欧美辱华刻板印象，眼睛眯成缝斜向脑门延伸，正常人长这样？再说回《雄狮少年》，小胖子是小眼睛吧，那个形象是不是就是我们身边可能有的胖胖的小眼睛男生，为什么小胖子这么正常，没人说小胖子小眼睛辱华？而女主这样？再放一张欧美以前拍的科幻伦理片《人兽杂交》的杂交生物剧照你看看,2021-12-28 23:04:53,2021-12-28 23:55:54,0,2,https://www.zhihu.com/api/v4/answers/2289769770
飞蛋,0,说眯眯眼的，刘玉玲笑起来眼睛眯不眯，不知道从什么时候起玻璃心这么严重，部分国外人都喜欢丹凤眼国人美女，而我们中有一部分现在却以丹凤眼辱华，大眼不辱华为标准，看看国画里的传统美人。是以舶来品国外大眼睛这种媚外心理为美呢，还是以传统美人标志丹凤眼作为当做辱华来上纲上线呢。摈弃自己的容貌自信和优势，只因为以大眼蛇精脸这种舶来品的畸形审美为榜样，有人喜欢丹凤眼就冠以辱华为帽子，请自行判断,2021-12-28 22:54:51,2021-12-28 22:54:51,0,2,https://www.zhihu.com/api/v4/answers/2289758766
满船清梦压星河,106,,2021-12-28 22:23:43,2021-12-28 22:28:44,0,2,https://www.zhihu.com/api/v4/answers/2289726036
知乎用户,3024,剑眉星目 明眸皓齿  柳眉杏眼  顾盼生辉—中国古典审美贫困山区女孩新闻镜头下的山区男孩（驳某些说底层留守儿童就长那样的。长相什么时候还和阶层挂钩了？）以上哪一个和眯眯眼 吊梢眼 宽眼距有关？,2021-12-28 13:37:59,2021-12-28 16:17:40,1,2,https://www.zhihu.com/api/v4/answers/2289019668
张源,455,真是看得我着急，老爷要强推这个片子直接组织党员和公务员事业单位包场看就行了嘛，票房口碑双丰收，告诉中国人，猿猴脸建模，就是行！你就长这样！,2021-12-28 13:24:36,2021-12-28 13:24:36,0,2,https://www.zhihu.com/api/v4/answers/2289000339
匿名用户,0,就这最后一句话，足够让它站在人民群众的对立。,2021-12-28 12:52:13,2021-12-28 13:05:49,0,2,https://www.zhihu.com/api/v4/answers/2288955363
夢師,3,民族的就是世界的。我们国家是社会主义国家，为人民服务是我们的宗旨。艺术家无论怎样都应该有着正确的阶级性立场，爱祖国，爱民族，爱人民。资本主义国家的民主和自由是它们国家阶级所决定的，并不是真正的民主和自由，是金钱操控下的虚伪的民主与自由。而我们国家则是真正的人民至上，实现了全过程的人民民主，建设法治社会，脱贫攻坚到共同富裕，从站起来到富起来到强起来的历史性飞跃，一步步向着更高更好的阶段进发，为实现共产主义而奋斗。如果资本主义妄想通过文化的洗脑和刻板印象的偏见去撅我们中华五千年开放包容平等自由的人民、民族、国家所传承中华优秀传统文化的根，那么它必然会被人民所唾弃，被人民的浪潮所击败。文化自信是我们制度自信，道路自信，理论自助中最重要和首要的。好的艺术文化作品应该是深深植根于中华传统优秀的文化的沃土中吸收广博的知识认真制作呕心沥血经历千百万次打磨，经历时代和岁月考验的，人民喜欢的艺术文化作品。而不是为了所谓的“艺术”追求在作品中夹杂私货，站在人民群众的对立面。艺术后头总会带有文化的原因就是艺术作品从来都是有着鲜明的阶级立场和文化底蕴的艺术文化作品。根据以上几点，可见这并不是一部好的艺术作品，甚至表现出了作者内心的不爱国，对祖国的文化没有认同感，归属感和荣誉感！你是中国人吗？你爱中国吗？你希望祖国好吗？这是时代之问，是需要我们带带传下去的历史之问。,2021-12-28 02:07:56,2021-12-28 02:07:56,1,2,https://www.zhihu.com/api/v4/answers/2288479478
追黄埔,8179,,2021-12-27 21:27:00,2021-12-27 21:32:01,0,2,https://www.zhihu.com/api/v4/answers/2288264337
哟哈,26,刚看完。真的是一部很棒的电影。,2021-12-27 21:13:47,2021-12-27 21:13:47,0,2,https://www.zhihu.com/api/v4/answers/2288250149
芒果奶茶没有奶,107,只能说有些人为了钱抹黑中华民族罢了混淆视听，小眼睛和眯眯眼是一个玩意？你怎么不说正常性交是强奸啊？黑奴和黑人是不是就等同了？有意思吗？,2021-12-27 20:54:32,2021-12-27 20:54:32,0,2,https://www.zhihu.com/api/v4/answers/2288230498
刘凯,10592,我一点也不奇怪这部电影背后的资本可以推动所有媒体来唱赞歌。我也一点也不反对资本通过好的作品赚取利润。我也不否认这部动画有可圈可点之处。我甚至认可作品中这几个少年的人设本身就不俊美。但是，不俊美和丑陋可憎是有区别的。这也是雄狮少年，不俊美，但是能接受。怎么最后变成了这个面目可憎的样子？一开始的设计并不是这个风格啊。所以我觉得投资人应该好好找找到底哪个内奸其中坑了你们，而不是让那些歪嘴公关怎么把广东人扯进来羞辱一番。越描越黑。,2021-12-27 20:27:39,2021-12-27 20:32:40,0,2,https://www.zhihu.com/api/v4/answers/2288202742
小鸡不撒尿,50,原本是想着用滤镜让人们要放下滤镜看世界人们反而不得不戴上了滤镜还有人借着滤镜造势有人滨河而居，习水勇泅，操舟鬻渡，利贡百口。裹粮就学者成徒，而溺死者几半。本学泅，不学溺，而 利 害 如此。孰是孰非？昔齐人有欲金者，清旦衣冠而之市，适鬻金者之所，因攫其金而去。吏捕得之，问曰：“人皆在焉，子攫人之金何？”对曰：“取金之时，不见人，徒见金…”,2021-12-27 19:38:16,2021-12-30 22:54:09,0,2,https://www.zhihu.com/api/v4/answers/2288148831
杭嵘律师,60,最近这部电影的网上软文硬广的宣传文章和我们普通人的风评直接的落差实在是很大。我没有看过这部电影，只是从路人甲的视角看了3位主人公面部造型也是感觉很不舒服，和这部电影安利的背景环境的写实风格实在是画风冲突得利害，这个还是请懂艺术的知友分析吧。关于是否有网络水军“洗地”，这个事情还是比较难定论，互联网上的“网络水军”的一些乱象至少在目前看来在网络管理方面还存在空白地带。按照我们通常的理解，“网络水军”是指通过雇用大批人手在互联网上集体炒作某个话题或人物，以达到宣传、推销或者攻击某些人或产品的目的。这些受雇人员在网络推手的带领下以各种手法和名目，在各大互联网论坛上发帖，有时候人数很多“复制粘贴”固定的文案套词。对于如何确定有水军洗地的难度至少有以下几点：首先就是定性比较困难。一帮人有一定组织地通过在网络上发帖，对某一企业或产品进行吹捧或贬低，对某个人的行为或外表进行褒奖或挖苦、辱骂，是不是给该企业、产品、个人造成了损失?其权利是不是遭到侵害?这个损害如何衡量，这个收益如何衡量与水军工作之间的因果关系？在现有的法律中很难找到比较准确的答案，而且，许多公司也有一些正常的广告或者营销行为，或者委托第三方进行广告、营销策划活动，这些与“网络水军”的行为究竟分界线在什么地方，属于网络营销还是还是网络侵权，比较难定论。其次就是追究责任困难，想象一下，一个大型海浪泰山压顶排山倒海拍过来的力量很强大，但是对于其中的一滴水而言如何去界定他的伤害和责任？每个参与的水军成员在一起网络造势活动中的作用非常小，只有将每个人的作用聚合，然后产生放大效应，才能达到追求的效果或目的。因此，如果“水军”在网络上对某一企业或产品、个人进行毁谤或实施侵权活动，最终只能追究策划者、组织者的法律责任，而对于其他大部分发帖者，则很难对其进行追责。 如果某一电影话题博主、或者某一普通网名ID造势支持或者贬低某一部电影，即使最终有办法证据他是受到片方宣发的雇佣发表评论，也比较难确定其造成的伤害并追究其责任。还有取证以及法律适用方面的困难。网络侵权或犯罪也必然要求相应的证据作为支撑，尽管对于我们普通网民来说有时候可以真切地感觉到水军的活动，但是也不能只凭感觉来指控对方，毕竟从表面上看，对方和自己一样都只是某个互联网平台上发表意见的用户。水军往往也具备一定的技术支持手段，可以一定程度地通过技术手段隐藏自己的真实身份。另外，技术上看由于网络上各种信息泛滥，有些论坛或门户网站将服务器自动设成定期清除程序，也进一步造成了取证困难。目前，我国在计算机网络监管方面的法律法规并不太详细，《侵权责任法》第三十六条规定:“网络用户、网络服务提供者利用网络侵害他人民事权益的，应当承担侵权责任”；《刑法修正案(七)》将公民个人信息保护纳入刑法保护的范围，但在如何具体运用法律方面却没有相关标准及实施细则。如何认定民事权益受到损失，损失程度如何，是否构罪，情节严重的标准等等，都没有比较细则的规定。不过说来说去一句话，对于电影不过是个消费品，让普通观众普遍感到不待见不喜欢，不管有没有雇佣水军洗地都解决不了一个商品被市场芭比Q的后果。,2021-12-27 17:03:45,2021-12-27 17:31:14,0,2,https://www.zhihu.com/api/v4/answers/2287953535
TNEBALLSUNDERREDFLAG,47,"嘿嘿嘿嘿嘿就很简单啊全人类审美标准都是三庭五眼，你搞个唐氏综合症面孔出来群众不喜欢没毛病吧？且不说丹凤眼，眯眯眼，眼距那么宽，眼角那么挑是为啥？咱们退一步来说，你拍个“小众审美”的电影去法国拿个奖，无可厚非。就像我也不会骂陈漫，毕竟人家靠这个挣钱吃饭啊,甲方爸爸肯定先于群众。可你一边搞“小众审美”，一边要大众买单什么意思啊？这不是欺负老实人吗！？嗷，你们能喜欢我们就不能讨厌了呗，我们就都是审美缺失呗。真有你们的啊。A：最近那个新出的巧克力吃了没？B：没啊，那里面不是掺shi了吗？A：就掺了一点点而已，没事的，尝尝？B：还是不了吧，挺恶心的。A：这可是国巧之光！不吃不是中国人！B：阿这。。。。就一口。A：其实也没那么恶心啊，多嚼几下就好了，一吃就停不下来呢。B：（咀嚼）A：我跟你讲哦，以前咱们国就不怎么产巧克力，就算产出也是按人家标准来的，质量还那么差。。。。。B：呕呕呕呕。。。。。。A：别吐啊！你怎么能吐呢！？这可是业内大佬做的巧克力！B：原来一些巧克力是烂，可它也没掺shi啊！（砸吧砸吧嘴）还是外国标准的shi！A：你还挺懂的诶，这可是大佬按西方标准搞出来的！一样但又不一样，不仅能得到业内奖项认可，还能开拓新审美道路呢！B：。。。。。可它掺shi了啊。A：你这人怎么说不通呢！现在肯定会掺一点，发展起来不就不掺了嘛，我们要对这些努力让国巧走上世界的人宽容一点。B：。。。。。我们要习惯了，他们岂不是会掺更多。。。。A：顽冥不灵！国巧发展不行都是因为你这种人！B：。。。。我就是不想吃shi啊。。。。那么兄弟们，你觉得B这小小的愿望过分吗？我觉得很过分啊，消费者居然还能挑挑拣拣！？简直是礼崩乐坏！哈哈哈哈哈哈",2021-12-27 15:44:10,2021-12-28 09:43:42,0,2,https://www.zhihu.com/api/v4/answers/2287819823
QRH,24,有些人的心理很奇特。如果一个人故意用他家人个矮来表示对他的侮辱，他不去怼那个侮辱他的人，他只去怼别的矮个子和矮个子的家人朋友们。然后他自己把所有个子矮的人当成自己家族的耻辱。,2021-12-27 14:13:42,2021-12-27 14:13:42,0,2,https://www.zhihu.com/api/v4/answers/2287674667
我的宇宙,7,大家瞧一瞧，普通中国人的长相是什么样子的。https://www.zhihu.com/answer/155020719,2021-12-26 20:37:00,2021-12-26 20:37:00,0,2,https://www.zhihu.com/api/v4/answers/2286902802
云飞烟灭,2368,“某种作品只为少数人所偏爱，而为多数人所不需要，甚至对多数人有害，硬要拿来上市，拿来向群众宣传，以求其个人的或狭隘集团的功利，还要责备群众的功利主义，这就不但侮辱群众，也太无自知之明了。”——《在延安文艺座谈会上的讲话》，出自《毛泽东选集》第三卷，人民出版社1991年版，第862页。,2021-12-26 20:26:41,2021-12-26 20:31:29,0,2,https://www.zhihu.com/api/v4/answers/2286893170
猫不荒,55,又蠢又不自知，还想忽悠人,2021-12-26 12:59:59,2021-12-26 12:59:59,0,2,https://www.zhihu.com/api/v4/answers/2286459244
Tweak,249,通胀了,2021-12-26 12:35:39,2021-12-26 12:40:40,0,2,https://www.zhihu.com/api/v4/answers/2286437781
无术,3,不愧是在广东取景，满满的风水元素有没有，两眼睛一个坐北一个朝南，岭南地区最讲究玄学这玩意了……,2021-12-26 12:29:31,2021-12-26 12:29:31,0,2,https://www.zhihu.com/api/v4/answers/2286432345
主宰,0,什么阴兵借道,2021-12-26 12:15:34,2021-12-26 12:20:35,0,2,https://www.zhihu.com/api/v4/answers/2286419247
来即我谋,7,对比一下误杀的豆瓣评分和评分人数，你说呢？,2021-12-26 11:42:01,2021-12-26 11:47:01,0,2,https://www.zhihu.com/api/v4/answers/2286386521
做自己,71,那就祝水军他家人以后都长那样吧,2021-12-26 11:36:44,2021-12-26 11:36:44,0,2,https://www.zhihu.com/api/v4/answers/2286380788
someone,3122,网上看见的一图片，国家最近不是打击水军控评吗？这么多明显的证据，怎么举报啊,2021-12-26 08:27:13,2021-12-26 08:32:13,0,2,https://www.zhihu.com/api/v4/answers/2286217511
大脑空白,1,我觉得现在挽救这个破电影唯一的方式就是导演本人就长这样,2021-12-25 23:53:06,2021-12-25 23:53:06,0,2,https://www.zhihu.com/api/v4/answers/2286071893
gzl6899,18,仅针对NGA的这张图偏题了吧，做成动画总得有夸张，夸张成类似傅满洲的刻板印象那肯定是罕见行为，但你要说不像人。。。那这种的怎么算？要批判罕见就直接批判就完了，整这一堆乱七八糟的。。。,2021-12-25 23:07:06,2021-12-25 23:12:07,0,2,https://www.zhihu.com/api/v4/answers/2286031424
匿名用户,0,好久不回答了，直接上图吧。其他骚操作太多了，懒得说了。当然，我承认我确实很惊讶有那么一批人是真心实意“喜欢”这电影的，你评论这电影有一句不好ta就一蹦三尺高，我很不理解。,2021-12-25 22:43:42,2021-12-25 22:48:43,0,2,https://www.zhihu.com/api/v4/answers/2286009521
1812年的雪,157,第一次让我觉得傅满洲都比这四个角色好看起码傅满洲还是一个“人”后者我已经在进行生物学上的分析了,2021-12-25 15:22:49,2021-12-25 15:27:50,0,2,https://www.zhihu.com/api/v4/answers/2285597508
Lucifer,13832,已经不只是水军洗了，水厂都开始漂白了吧。,2021-12-25 13:50:30,2021-12-25 13:55:30,0,2,https://www.zhihu.com/api/v4/answers/2285506008
贺伊,2,身为广东人，从小看黄飞鸿，每逢年节本地也有醒狮表演，超喜欢配合敲锣打鼓节奏萌萌哒的狮子。但是这部电影不会去看，因为老子有圆溜溜外双眼皮的水汪汪亮晶晶的大眼睛！老子不长那样！眼睛小也就算了，孙红雷林永健眼睛也是眯眯眼，但是也没有宽眼距 ！也不不往两边斜飞啊 ！正常人长那样吗？！导演说是为了塑造角色形象，就没见过谁当女娲捏脸往丑了捏的，除非有仇。,2021-12-25 12:59:44,2021-12-25 13:04:52,0,2,https://www.zhihu.com/api/v4/answers/2285453930
云间月,1320,已经超出电影的范围了。票房不如水军费高，不惜代价也要打赢，简直是舆论战。敌人在哪没看见，全是自家的飞机大炮朝自家扔炸弹。,2021-12-25 12:28:21,2021-12-25 12:28:38,0,2,https://www.zhihu.com/api/v4/answers/2285421559
巴社,7,在rh这方面，还真的只有中国人能做到如此高度,2021-12-25 12:12:28,2021-12-25 12:12:28,0,2,https://www.zhihu.com/api/v4/answers/2285402944
缤纷可乐,17,《评论系统升级中》,2021-12-25 01:14:12,2021-12-25 01:14:12,0,2,https://www.zhihu.com/api/v4/answers/2285076655
泪心与谁,22,那要按照他们的逻辑 那上气简直怨成岳飞了 ,2021-12-24 18:39:27,2021-12-24 18:39:27,0,2,https://www.zhihu.com/api/v4/answers/2284751642
小黑锅锅,105,有啊不然谁觉得主角正常？就那面容，白左画的,2021-12-24 17:28:39,2021-12-24 17:28:46,0,2,https://www.zhihu.com/api/v4/answers/2284674018
夏紫炎,19,第一次知道B站评论区可以隐藏按时间排序,2021-12-24 16:43:55,2021-12-24 16:43:55,0,2,https://www.zhihu.com/api/v4/answers/2284612027
匿名用户,0,只讨论这个片子是不够的，这么有问题的片子，为什么点映的时候能达到9.8分的好评，根本就是制片方在通过控评，来拉高自己的股价，所以不止是片子有问题，更有问题的是制片方，最好是让证监会介入下，这么明显的操纵股价的方法，简直和特斯马有的一拼了，我们在这为影片炒的不可开交的时候，制片方已经通过股市赚的盆满钵满了,2021-12-24 12:51:25,2021-12-24 12:51:25,0,2,https://www.zhihu.com/api/v4/answers/2284272709
q50,0,我不知道，说说我最近的感受把，最近刷b站老看到说什么国漫之光的，讲道理，我最近今年，什么黑悟空。白蛇，魔婴和最近的雄狮少年，我就看了一下封面，实在是辣眼睛，所以我一个都没看完过（看过，指刷视频中可能无意中看过部分片段，不可否认的是部分动画特效确实不错，但要我完整去看，我觉得是谋财害命，浪费我时间）,2021-12-24 09:58:41,2021-12-24 09:58:41,0,2,https://www.zhihu.com/api/v4/answers/2284013854
林风二,16,小红书上一堆人，都自称看这个看得流泪的，还要二刷。一会儿说求求大家都去看。一会儿又说以貌取人不配看。话都被他们说完了。也不见票房被他们刷起来。 ,2021-12-24 09:33:12,2021-12-24 09:33:12,0,2,https://www.zhihu.com/api/v4/answers/2283974759
彩色的田园,106,觉得好的人可以这样祈祷，我愿意找一个长得像主角的男人或愿意娶一个动画片女性角色形象的女人，生一个像男主角形象的孩子，子子孙孙无穷尽也！至于长得像阿猫，我就不这么赞美你了。,2021-12-24 08:34:40,2021-12-24 08:34:40,0,2,https://www.zhihu.com/api/v4/answers/2283904936
匿名用户,0,我认为它有自己的优点，比方说画面很精致，但由于他的人物形象问题，我并不打算给它贡献票房。国产动画题材限制太多了，原创作品热度不够，票房口碑不错那几部都是神话题材改编加工。在我看来，雄狮少年想用眯眯眼，引发争议，从而带来圈外的热度。它做了，就应该承受被鄙视的后果。Ｂ站有个粉丝不少的up，全文都在抨击我们对它人物形象报以怀疑r h的人。她的评论区前几位都是在清一水的夸，她的评论区甚至不能查看最新评论，你说没拿洗白，我不信……前排评论的话术都差不多，无非是物种多样性、传统文化和动画本来就夸张应该有自己的特色。为什么不另想它就是要靠传统文化让自己站在道德最高地，让我们这些对他塑造的人物形象不满意的人被围攻。让大众逐渐接受眯眯眼宽眼距的设定。———————————————————————听说它被举白旗国动画电影节认定为代表了东方人…抖个激灵：啊 洗吧kkk——————— 找到了有趣的东西——————有图有真相～,2021-12-24 04:21:30,2021-12-26 11:56:43,0,2,https://www.zhihu.com/api/v4/answers/2283837824
风中,1,看到那么多媒体个人推荐然而票房塌方我暗爽,2021-12-24 03:51:18,2021-12-24 03:51:18,0,2,https://www.zhihu.com/api/v4/answers/2283834033
暴雨凝空,1,,2021-12-24 00:28:59,2021-12-24 00:33:59,0,2,https://www.zhihu.com/api/v4/answers/2283761877
学徒,9,某些人所谓的，日本动画也有大眼睛，为什么国漫不能眯眯眼……那我问你，我能没事夸你两句，但我可以闲下来就骂你两句吗？,2021-12-23 23:15:28,2021-12-23 23:20:29,0,2,https://www.zhihu.com/api/v4/answers/2283692125
韩跑跑,47,首发25%排片，这叫宣发不给力？,2021-12-23 21:34:03,2021-12-23 21:34:03,0,2,https://www.zhihu.com/api/v4/answers/2283581510
一个人的臆想,1,洗呗，，，我祝那些洗地的人的孩子都长那样,2021-12-23 13:45:06,2021-12-23 13:45:06,0,2,https://www.zhihu.com/api/v4/answers/2282912904
