author,fans_count,content,created_time,updated_time,comment_count,voteup_count,url
隔壁二狗子,1,以下是我引用人民日报评论怎样看待围绕“眯眯眼”的争议 | 圆桌会作者：党报评论君12-28 12:25阅读 1024万+​编者按近日，某品牌产品宣传海报中，模特的“眯眯眼”等元素，备受质疑；电影《雄狮少年》，也因主要人物造型是“眯眯眼”的问题，引来争议。与此类似的事件，一段时间以来不时引发讨论。对这一类问题，应该如何看待？我们进行了一次“圆桌会”，也欢迎大家和我们一起探讨。从产品角度看：充分尊重受众，才能赢得市场A：不管这家企业是否存在丑化国人的主观故意，这件事本身反映的问题却很真实，就是无论是国内外企业，还是艺术家、电影制作者，所播出的广告、创造的作品，都必须有更成熟的受众意识，既要对受众的认知和审美情趣有所了解，更要尊重受众所处的文化环境和历史情感。毕竟，无论广告还是艺术作品，一旦公之于众，就必然被置于聚光灯下和舆论场中，就必然要接受来自各方的批评和审视。必须周全考虑主流文化、大众审美和受众心态，没有这样的受众意识，轻则闹个笑话，重则适得其反、彻底“翻车”。B：我觉得这是品牌形象塑造和大众审美的一次正常碰撞。消费品牌选择模特是为了增加社会公众对他们的好感度，他们可以引导公众接受，但不能挑战大众的普遍审美。品牌选择的模特，代表品牌的形象和价值，如果引起公众不快，就会在市场上产生负面效应。C：是的，将“眯眯眼”作为一种辱华标志，有着很长的历史渊源。因此，“眯眯眼”某种意义上确实牵动了人们的民族情感。所以，当商家的广告出现这一元素时，一个商业行为便引发了一场社会舆情。D：需要注意的是，基于个人特征打造、用于商业宣传的文化产品，应当尽可能考虑两个因素。一是和产品气质是否相符，二是大众审美能否接受。无论是海报、还是视频，做出来都是给人看的，那就需要兼顾大众的审美意趣。以表达文化自信、传播正能量为根本，根据市场反馈，不断调整表达方式、宣传内容，推出更多消费者买账的文化产品，企业才有可能真正获得市场的尊重。E：的确。包括模特的选择、人物的造型等等，从审美的市场接受度上来讨论，消费者作为受众，有投好恶票的权利，这本身也是在给品牌以市场反馈。更多注重文化内涵和产品质量，才能更好赢得市场、也赢得认同与尊重。从审美角度看：培养健康审美趣味，涵养强大审美自信F：正如人有高矮胖瘦，人的长相也各有特点，“眯眯眼”、吊眼梢本就是客观存在的样貌特征。在此基础上，有环肥的丰腴美，有燕瘦的苗条美，有人推崇纤细，有人推崇力量……每个人都有自己特定的审美标准，个人的审美偏好也各不相同。这是个人的自由，也是个人权利。从这个角度看，眼睛大也好小也好、肤色深也好浅也好，每个人尽可以保持自己的审美偏好，无需定于一尊。G：不过，一个时代、一个社会，也都会有属于自己的风尚，这是一种大众审美或者说社会审美。大众传媒上的内容，包括广告、视频等等，都会影响甚至塑造这样一种社会审美。我们包容多元的个体审美趣味，但也需要形成一种健康的大众审美，更需要塑造一种向上的主流审美。这样的审美，决不能是扭曲的、恶俗的；塑造这种审美的大众文化产品，也不能是媚俗的、病态的、矫揉造作的。眼睛可大可小，但要精气神十足；身材可胖可瘦，但要自信从容阳光。这样，整个社会的审美才能更健康也更健全。H：一个基本前提是，不能让西方塑造我们的审美。对于他们恶意的丑化和不怀好意的污蔑，要保持足够的警醒并予以反击。在历史上，西方国家对于中国人就有“傅满洲”“查理陈”“苏西黄”这样的刻板印象，“眯眯眼”甚至成了一种辱华符号。在这样的情况下，我们尤其需要防止被这种歧视性的审美趣味给带歪了。I：不过，对于用“眯眯眼”之类的符号辱华，反击的行为绝不是对内上纲上线、自我审查。否则，如果再嘲笑低鼻梁、黄皮肤等特征，我们又该如何自处？这个道理并不复杂。我觉得应该有一个共识，那就是我们反对的不是“眯眯眼”，而是反对以下两点：一是，基于陈旧刻板印象、特定身体特征的歧视；二是，刻意讨好西方审美、在曲意逢迎中定义中国的现象。这当中不仅有审美的问题，更有心态的问题、文化的问题、政治的问题。J：其实，无论是模特的长相，还是自己的容貌，我们都应该欣赏和悦纳多样的美，以不同的风采展现中国的审美。只有建立由内而外的自信，才是对歧视的最好反击。如若没有这样的自信，就容易被类似的议题牵着鼻子走，反而把西方的偏见当成了唯一的标准，“是人之非，非人之是”，为了赞成而赞成、为了反对而反对。当我们有足够好、足够多的作品和产品，来提升对何为美、何为时尚的定义权、话语权，才能走出被西方审美文化带偏节奏，乃至被其所侵袭的境地。从传播角度看：坚持效果导向，也避免“扣帽子”K：应该说，舆论场的反映，很大程度上也折射出公众对美西方辱华标签的警惕，体现出高度的文化自觉。但对“眯眯眼”的讨论，既需要分清对象，更需要分清动机和场景。在艺术创作中故意丑化中国人，甚至以比“眯眯眼”的手势表达歧视，这样的西方偏见，我们不接受，也会有力反驳。爱国是本能，维护民族尊严是每个中国人天然的情绪。不过，如果不分场合、不分情景地认为，眼睛小就是“眯眯眼”，只要使用小眼睛模特一律就是辱华，这多少也有些太过敏感了。可以不同意类似的审美，可以讨论艺术创作的方向，但没必要上纲上线。L：质朴的爱国热情可以理解，但确实要一事一议，不能把不同的情形混为一谈，笼统扣上帽子，跟风喊打喊骂。应该容得下多元化审美，各美其美，才能拼凑起美美与共的图景。不过，也需要对相关内容有所警惕，不能在有意无意间成了西方歧视的“传真机”。此外，还应格外注意防范，一些自媒体利用公众朴素的爱国情绪，恶意引战、拉仇恨、搞对立，污染网络空间。M：眯眯眼已经成了一种特别的议题设置，我们应该警惕辱华问题，也应该警惕借眯眯眼议题搅混国内舆论，乃至强迫选边站队制造分裂。诛事不诛心，诛心无完人。网络舆论纠纷的纠结点，就在于很难区分诛事还是诛心。一个话题设置成公共话题，一种行动设置成公共选择，便会考验舆论走向、也考验公众心态。对眯眯眼的话题，尊重审美多元是第一层，警惕对立分裂是第二层，呼吁理性看待是最高层。N：一种社会观念的形成，往往具有复杂的历史原因、现实因素，眯眯眼被视为对亚裔的歧视，这在社会观念层面特别是在西方社会已经成为共识。在这样的情况下，国内企业不正视客观存在的观念、不清楚可能造成的争议，甚至试图迎合西方的刻板印象，本身是不可取的。我们尊重审美的多元、尊重个性化差异化的表达，但进入到公共传播领域必须坚持效果导向，特别是要避免陷入西方设置的话语陷阱。审美是客观的，可以随着社会现实的变化而变化，但在社会现实没有变化之前，有必要尊重客观规律和现实。人民日报评论,2021-12-28 19:07:02,2021-12-28 19:07:02,1,0,https://www.zhihu.com/api/v4/answers/2289515814
匿名用户,0,搞不懂有啥可抵制的广东人不就长这样吗？,2021-12-28 18:48:05,2021-12-28 18:48:05,2,0,https://www.zhihu.com/api/v4/answers/2289495101
赵光,129,我觉得挺好看的，还不知道你们说的这么复杂,2021-12-28 18:36:15,2021-12-28 18:36:15,0,0,https://www.zhihu.com/api/v4/answers/2289480869
知乎哉不知也,7,丑就丑吧，黄渤丑成那样也爆红但刻意的小眼睛、宽眼距真是典型的唐氏儿面相，不知道有没有人看过一部电影叫《启明星》的？被骂了也不端正，说什么“广东人就长这样”，意思是其他省的没那么丑？来来来，我™告诉你广东人长啥样：还要吗？,2021-12-28 17:51:58,2021-12-28 17:56:59,0,0,https://www.zhihu.com/api/v4/answers/2289431006
giao,0,66666669666666666666666666666666666666666666666666666666666666666666666696666666666666666666666666666666666666666666666666666666666666666966666666666666666666666666666666666666666666666666666666666666669666666666666666666666666666666666666666666666666666666666,2021-12-28 17:21:58,2021-12-28 17:21:58,0,0,https://www.zhihu.com/api/v4/answers/2289387855
HunterX,9,谁特么喜欢眯眯眼，水军别胡乱代表别人,2021-12-28 17:13:37,2021-12-28 17:13:37,0,0,https://www.zhihu.com/api/v4/answers/2289375879
狗头祭酒,43,「没想到啊没想到，你这浓眉大眼的家伙也叛变革命了!」为什么深入人心，因为正面人物，或是符合我们审美的都是浓眉大眼的。反之，眯眯眼就非正面。你再洗地，回去问你爹你娘谁丑谁俊？打不死你,2021-12-28 16:23:43,2021-12-28 16:23:43,0,0,https://www.zhihu.com/api/v4/answers/2289293846
知乎用户,24,肯定是有的。毕竟这设计是真的丑。我之前的回答也猜测过为什么会设计成这样。只能说这3d建模一言难尽。,2021-12-28 16:15:58,2021-12-28 16:15:58,0,0,https://www.zhihu.com/api/v4/answers/2289279537
顾顾顾德益,1,关于眼睛的问题，倒让我想起了陈佩斯和朱时茂的小品。浓眉大眼是好的，大多数情况下是演正面角色的，浓眉大眼的人背叛革命是违和的，所以你说大眼睛是欧美文化侵袭的结果，中国人的审美就是小眼睛，我是不信的。虽然我的眼睛也不是很大，但我还是不能背叛革命。,2021-12-28 15:46:36,2021-12-28 15:51:37,0,0,https://www.zhihu.com/api/v4/answers/2289226975
知乎用户,40,我没去看，我朋友去看了，她是那种经常看电影的人，她确实觉得剧情不错，然后说除了主角之外有挺多不是眯眯眼的角色，认为主角本身设定也比较底层所以是这样的形象，她觉得这样也认为是乳化的话那是不是眼睛小的人长得也乳化了。我应该不会去看，听介绍不是很感兴趣，只是想说确实有路人觉得还行。只要不是恶意，我觉得多元化的评价很正常。,2021-12-28 15:03:59,2021-12-28 15:07:23,0,0,https://www.zhihu.com/api/v4/answers/2289154221
知乎用户,40,我没去看，我朋友去看了，她是那种经常看电影的人，她确实觉得剧情不错，然后说除了主角之外有挺多不是眯眯眼的角色，认为主角本身设定也比较底层所以是这样的形象，她觉得这样也认为是乳化的话那是不是眼睛小的人长得也乳化了。我应该不会去看，听介绍不是很感兴趣，只是想说确实有路人觉得还行。只要不是恶意，我觉得多元化的评价很正常。,2021-12-28 15:03:59,2021-12-28 15:07:23,0,0,https://www.zhihu.com/api/v4/answers/2289154221
易筠竹,329,他们说这形象是来照着广东人的面相画的？来来来，咱不找演员明星，免得有人说那些都是俊男靓女。咱就看看广东籍的运动员。全部是赛场直拍，没有化妆没有美颜的：易建联：这眼睛比姚明都大。苏炳添：浓眉大眼鼻直口阔。樊振东：眼睛算小的。女孩子也有，全红婵。怎么着，国家选运动员不看颜值吧。我就想问问，哪有一个长成这样的？导演你倒是给我找出个原型来啊！最恶心的是，这电影不是不会画正常人。这不都挺正常的？咋的他们就不是照着广东人画的啊？所以根本不是什么审美的问题。是什么问题我们心里都清楚。,2021-12-28 14:58:02,2021-12-28 15:03:04,0,0,https://www.zhihu.com/api/v4/answers/2289144523
端木舞风,1668,我科普一下眯眯眼是什么，为什么这是辱华实际上亚洲人并不长这样，但是如果把你饿几个月，颧骨凸出，再关几个月暗室，拉出来见到太阳时虚眯起的眼睛……没错，他们嘲笑的就是当年被当成牲口和奴隶的中国华工，还有1840s往后的那一段历史我真想不到还有人搁这洗,2021-12-28 13:10:02,2021-12-28 13:10:02,0,0,https://www.zhihu.com/api/v4/answers/2288979879
tiger是只猫,485,浓眉大眼，星目剑眉。龙睛凤颈，鼻如悬胆。面如银盆，眼如水杏。俊眉修目，顾盼神飞。在某些人眼里，中国人当然不配长大眼睛，当然也不配喜欢大眼睛。只要你喜欢大眼睛，你就是“抄袭欧美知识产权”就是“崇洋媚外”“你们黄货本来就是眼睛小啊！所以你们当然应该喜欢小眼睛！自己一边去喜欢小眼睛才是政治正确！长得像21三体综合症还可以当少数群体，有何不好？”呸！你们不喜欢大眼睛娱乐女明星们还一个个去剌双眼皮！？双眼皮整容量还那么大！！蒙谁呢？真能蒙啊！蒙到你们自己都信了？！,2021-12-28 13:05:15,2021-12-28 13:12:45,0,0,https://www.zhihu.com/api/v4/answers/2288973094
zzzz,0,建议导演拍一部讲述黑人种植园的电影，名字就叫《种植园的黑人少年》吧，种植园主人一定要是白人，而且金发碧眼又高又帅，主角黑人少年最好也长得别太像正常人，而且最好还爱吃西瓜，要用魔法打败魔法，用刻板印象回击刻板印象，毕竟创造自由嘛，故事内容就是勇敢的黑人主角反抗白人的压迫带领同胞逃离种植园，但是结局确是失败的，区别只是从一个种植园到了另一个种植园，如果还想要格局的话，就设定在美国南方种植园，时间自然是南北战争时期，黑人主角参加了战争赢得了胜利，最后结局让林肯接见主角顺便吹一波林肯水平有限胡乱写的，如果有错误的话请大佬指正,2021-12-28 12:59:10,2021-12-28 12:59:10,0,0,https://www.zhihu.com/api/v4/answers/2288964352
直觉,5,第一张是她作为楼主的评论，第二张是头像，第三张是她本人的录的视频。具体评论在博主李三金视频评论区，与博主本人无关，第四张是中国五官里面眼睛的说明图。,2021-12-28 12:51:54,2021-12-28 12:56:55,1,0,https://www.zhihu.com/api/v4/answers/2288954982
Boeing-2707,0,这么说吧长这么大第一次直接了解到了欧美还有二鬼子有多么恶心,2021-12-28 12:49:21,2021-12-28 12:54:22,0,0,https://www.zhihu.com/api/v4/answers/2288951632
彬天雪地,1584,突然发现，吹雄狮少年和黑战狼黑长津湖的是不是同一批人,2021-12-28 12:41:23,2021-12-28 12:41:23,0,0,https://www.zhihu.com/api/v4/answers/2288941028
匿名用户,0,没看过,2021-12-28 12:30:31,2021-12-28 12:30:31,0,0,https://www.zhihu.com/api/v4/answers/2288926323
七里湖的糖,1412,就说民国时代的几大公认美男子，哪个是眯眯眼？然后民国时代的名媛们，哪个是那种样子。历朝历代的名画壁画上的仕女也好，飞天也好，哪个是哪种造型。我国主流电影电视上的主持人，影视明星，当红过的男男女女，哪个是哪种奇怪的眯眯眼和诡异的妆容。对我中华泱泱五千年的审美有点自信好嘛。如果你觉得迪奥那张照片或者外国主流喜欢的那些奇奇怪怪的妆容好看，脸也好看，搭配也好看。就请你以后无畏无惧的照着那个标准捯饬自己。,2021-12-28 12:25:55,2021-12-28 12:25:55,0,0,https://www.zhihu.com/api/v4/answers/2288919722
猪吃粥,10,想靠电影票赚钱？ 都是傻蛋！想夹带私货就得拿钱砸，舍不得孩子套不着狼。先高薪聘请一帮水军，再找几个说反话的人当靶子，谁火就灭谁。电影靠什么？靠的就是热度！这话题性上来了，海外野爹不就来了？你砸进去多少钱，减一零儿就直接卖给网络平台了。我还告诉你，有人和你说买断，立马就套现，和你说分成都免谈！你要是感兴趣，投个百八万到一千万，多了我不敢说，我保你一年挣一个亿。,2021-12-28 12:25:33,2021-12-28 12:25:33,0,0,https://www.zhihu.com/api/v4/answers/2288919239
王喆,2157,之前我说过一次，很多创作者就是硬凑“国风”。没本事解构中国人中国社会的思想和行为模式，只会拿水墨、脸谱啥的表面功夫做文章，实在是太low了。对不起，我道歉。你们不算最low的。。。。。。最low的在这里，居然还有拿贬义刻板印象来做表面“国风”的，而且还low得这么理直气壮。,2021-12-28 12:23:41,2021-12-28 12:23:42,0,0,https://www.zhihu.com/api/v4/answers/2288916636
知乎用户,25,不同时代不同地区，审美不同不是很正常吗？塑造正确的集体记忆这件事情，每个国家都在干，我们的集体记忆都是这100年挑挑拣拣塑造出来的，所以你没必要觉得所谓的“历史”有多么神圣。现在出现各种rh问题的争论，最大的原因是文化极其不自信，白人不是体味重吗？中国人提起这件事情，白人根本不鸟你，为什么？可以说这就是文化自信，人家觉得你就是比我臭，如果不是也觉得只是巧合。当然有人觉得这就是自欺欺人，我想说，正因为人家比你强大，所以你才会想让他公平的对待你，你的要求听上去很可笑，可以想象越南和中国的关系。至于水军洗地，只要不是铁拳出面，剩下的都是战5渣，但是其实铁拳有没有干涉我不知道，毕竟这是塑造集体记忆的机会。,2021-12-28 12:02:15,2021-12-28 12:02:16,0,0,https://www.zhihu.com/api/v4/answers/2288886929
匿名用户,0,我已经将某音关注的几个视频博主拉黑了，本来挺喜欢的，关注也挺久了，但是他们仗着粉丝多，仗着那点专业知识，阴阳怪气的diss网友，真是无语了。好像只有他们是专业的，网友都是自卑，都是不懂装懂，这部分脱离了“大众”的“小众”是哪里来的勇气“俯视众生”？哪里来的勇气代表正义？有人质疑他们收钱了，他们又装清高，收没收钱，敢发誓吗他们？！！取关！,2021-12-28 11:36:40,2021-12-28 11:36:40,0,0,https://www.zhihu.com/api/v4/answers/2288845205
哈哈,0,为什么要看《雄狮少年》，看《羊羊运动会》不好吗?不是知乎我并不知道这部电影，然后看了些图，这并不是中国审美…其次剧情…羊羊运动会有泪目的场景，起码我小时候看有流泪的地方详情见图不知道有没有人记的上图的场景这个建模设计，现在看依然很优秀一等奖实至名归以上是喜羊羊与灰太狼的审美，以下是雄狮少年（动物拟人化，人动物化）这个小胖还可以，其他两个我只想上去给两巴掌,2021-12-28 11:28:17,2021-12-28 11:33:18,0,0,https://www.zhihu.com/api/v4/answers/2288830163
adh·乔,4,应该有的，其他答主已经举例论证了。不过既然这么丑，这么吓人，不能理解为啥没有“家长”站出来举报吓坏了自己家的孩子？,2021-12-28 11:27:20,2021-12-28 11:27:20,0,0,https://www.zhihu.com/api/v4/answers/2288828291
匿名用户,0,当然有了。他们洗的逻辑就是：“我要是骂你全家人都是砸种，他家里只要有一个人承认自己是砸种，就不算骂他们家，如果他们家没有人承认自己是砸种，就要找一堆证据，证明自己家有砸种。”,2021-12-28 10:20:38,2021-12-28 10:20:38,0,0,https://www.zhihu.com/api/v4/answers/2288707385
知非,0,据我有限的审美判断，第二张图这个兄弟的长相应该并不算很理想，但是与电影雄狮少年相比应该并没有多少人觉得这个角色rh。,2021-12-28 10:13:30,2021-12-28 10:18:31,0,0,https://www.zhihu.com/api/v4/answers/2288694557
知乎用户,9,不仅洗地，还出3000元每张的巨资去看呢。而且白天不过瘾，凌晨2点还是爆满呢。,2021-12-28 09:42:00,2021-12-28 09:47:01,0,0,https://www.zhihu.com/api/v4/answers/2288647026
王安邦,1,https://www.zhihu.com/video/1459093254914957312这不是废话吗？,2021-12-28 09:29:34,2021-12-28 09:29:34,0,0,https://www.zhihu.com/api/v4/answers/2288629004
K R,5,现在不仅仅是水军洗地的问题，你们猜猜借着这个骂小眼睛的有多少是水军？如果后续再出现小眼睛被拒绝入职，无缘无故被打，甚至不堪受辱自杀这样的媒体报道，你们猜猜会是什么样的结果？会不会出现以多元化审美为名的mmy政治正确？而从此媒体上全是支持丑话后的mmy这样的结果你们觉得会不会发生？发动群众斗群众这样的事在西方已经被玩的炉火纯青，从两性对立到少数性群体到多元化审美，再有圣母白左与种族歧视，以及环保卫士，你们猜猜推动这些背后的是谁，为什么这样推动？,2021-12-28 08:48:57,2021-12-31 09:16:36,0,0,https://www.zhihu.com/api/v4/answers/2288580312
意本,7,我只想说，50亿能做的事比我想象的多的多，是我肤浅了，我一直以为我能分到一杯羹，至今没渠道。该死的，原来是他们抢了我的50亿，美金,2021-12-28 02:53:04,2021-12-28 02:53:31,0,0,https://www.zhihu.com/api/v4/answers/2288490142
两个名字的湘君,3,和那些卖国贼汉奸扯这么多干什么，一张图,2021-12-28 02:24:05,2021-12-28 03:01:43,0,0,https://www.zhihu.com/api/v4/answers/2288483623
王尼玛,12,懒得说，尚气知道吧，你觉得那个瞳距更离谱。,2021-12-28 01:08:42,2021-12-28 01:08:42,0,0,https://www.zhihu.com/api/v4/answers/2288458258
绚辻词,310,,2021-12-28 01:05:43,2021-12-28 01:10:44,0,0,https://www.zhihu.com/api/v4/answers/2288457078
匿名用户,0,那我给你举个列子东亚病夫就是为了侮辱中国人而发明出来的，眯眯眼吊斜眼也是外国人为了侮辱我们衍生出来的。当初李小龙把这个牌子踢走了，好不容易摆脱了这个形象，而现在的他们就是把它捡了回来，还搬到荧幕上大肆宣传并告诉我们这是文化自信。我文你妈呢文。就相当于导演拿着东亚病夫的招牌到处宣传我们中国人就是东亚病夫。我们告诉他我们不是这样的。他说照照镜子吧你就是，你周围的人也都是，我还去广东采了风广东人也都是。放以前他这种性质的都是汉奸了，都是要吃枪子儿的。,2021-12-28 00:48:30,2021-12-28 01:11:32,0,0,https://www.zhihu.com/api/v4/answers/2288448142
暴躁的蘑菇汤,15,恶心！恶心！还是特么的恶心！,2021-12-27 23:24:05,2021-12-27 23:24:05,0,0,https://www.zhihu.com/api/v4/answers/2288384348
95后干饭人,19,洗没洗地我不知道，我好奇谁让它上映的！,2021-12-27 23:06:44,2021-12-27 23:06:44,0,0,https://www.zhihu.com/api/v4/answers/2288367278
王大全,7,网上的讨论点其实已经歪很远了，首先，主角丑不丑，我觉得审美正常的人都知道这是丑的。所以核心问题是“为什么这么丑”。所谓“辱华”其实只是这个问题的一个推测。如果要反驳这个推测，那你应该给出其他的解释。然而网上谈基本上全是“是否能推测为辱华”“我认为是/不是辱华”。这就好像漏水了你不去堵出水口却在拿水盆接水，你接的住吗？,2021-12-27 22:46:00,2021-12-27 22:47:05,0,0,https://www.zhihu.com/api/v4/answers/2288345913
知乎用户,7,还是那句话，要是真像有些人带节奏的那样，电影能拿到龙标？最近网上总是有一些人早莫名其妙的带节奏、煽动舆论，到底是什么样的一批人呢～～～,2021-12-27 22:45:20,2021-12-27 23:38:32,2,0,https://www.zhihu.com/api/v4/answers/2288345293
sobeit,26,我发誓我没点过。看看你们的吧。,2021-12-27 21:49:21,2021-12-27 21:50:27,0,0,https://www.zhihu.com/api/v4/answers/2288287373
匿名用户,0,知乎的影片推荐，没碰过的发现自己自动点了赞，点过踩的也自动变成了赞这是咋回事捏,2021-12-27 21:29:16,2021-12-27 21:29:16,0,0,https://www.zhihu.com/api/v4/answers/2288266741
ALEX K,273,有没有不知道，反正看了一些高赞的评论，更迷糊了。怎么这世道这么多二极管呢？,2021-12-27 21:09:22,2021-12-27 21:09:22,0,0,https://www.zhihu.com/api/v4/answers/2288245383
映尘斋,2,放轻松心态。你看黑人能互称N-word，凭什么中国人不能给自己观众做眯眯眼？手动狗头。,2021-12-27 19:15:00,2021-12-27 19:15:00,0,0,https://www.zhihu.com/api/v4/answers/2288123485
三更寒天,348,那不是丹凤眼，那是吊角眼丹凤眼，突出的是一个美和艳丹凤眼吊角眼，突出的是一个邪和妖吊角眼连这个都搞不懂，还自诩有文化，我看是文盲,2021-12-27 17:20:27,2021-12-27 17:25:28,0,0,https://www.zhihu.com/api/v4/answers/2287978981
就很好,1,质疑了就是不懂艺术人民大众怎么能懂艺术呢，懂了那帮所谓艺术家怎么捞钱呢？,2021-12-27 16:50:20,2021-12-27 16:50:20,0,0,https://www.zhihu.com/api/v4/answers/2287931665
