author,fans_count,content,created_time,updated_time,comment_count,voteup_count,url
shebaily,3,我前几天去看的，抛开形象不谈，其实剧情和画面还行，剧情有些bug和尬点，但是不影响观影感受——但是！！！本来我就秉承着不骂不吹，就吃瓜看个热闹，结果！某些水军评论直接把爷整笑了！纯纯的恶心人呢一群迷惑人？？！民族自信是不错，看完之后也还挺热血的。但是！我是为中国的舞狮文化感到自信啊！里面的狮子威武霸气，古灵精怪，这是只独属中国的舞狮文化！我自信的是舞狮而不是那啥的眯眯眼啊！！至于某些形象问题——少tm扯民族自信的问题，就尼玛离谱，民族自信是什么，你TM把别人侮辱你的话当自信了？哈？？？毛病吧？就像有人骂你是猪，你说：哎，我是猪怎么呢？我长得像猪是我的自由，我就乐意像猪！？？？毛病吧你？他没有侮辱猪，就单纯的侮辱你而已。猪这个词就是用来骂人的嘛？猪猪多无辜啊，吃吃喝喝的惹谁了？对方用猪来诋毁你，嘲笑你体格的胖。你大可以自信说：我胖怎么呢？吃你家大米了？多管闲事!但是总不能说：我是猪怎么了？！猪吃你家大米了？别人骂你的话，你还乐呵呵赶上了？!某些人把这个管叫自信？蛤？眯眯眼本身没有错，但是它已经被打上了rh的耻辱印记了！这些印记是怎么来的，是中国近代的屈辱造就的，是耻辱是污蔑！当然可以为眯眯眼鸣不平，它就只是存在着而已，但是不能拿眯眯眼当民族自信啊，把别人侮辱你的话当成自己的标签，真的太可笑了，真就丢人呗。以上，只是针对某些言论哈，要对号入座请随意。,2021-12-26 15:01:06,2021-12-26 15:01:06,1,40,https://www.zhihu.com/api/v4/answers/2286578255
千寻百度,9782,如何看待三只松鼠广告模特回应妆容争议，「事事上纲上线是病态」？ - 千寻百度的回答 - 知乎 https://www.zhihu.com/question/508523963/answer/2288399632,2021-12-25 01:36:36,2021-12-28 10:11:20,0,40,https://www.zhihu.com/api/v4/answers/2285086959
继续生存,32,我这夸他呢，弘扬民族精神，顺便热心网友还帮他改成了民族优秀传统容貌，不用谢，我们对你容貌的喜爱就像你对我们容貌的喜爱一样深沉,2021-12-27 14:16:36,2021-12-27 14:21:37,0,17,https://www.zhihu.com/api/v4/answers/2287679050
张小白,1926,冷知识：央视新闻也接商务，并不代表政府观点。,2021-12-31 09:24:43,2021-12-31 09:24:43,1,4,https://www.zhihu.com/api/v4/answers/2292739059
知乎用户,69344,敌人在内部,2022-01-01 06:17:04,2022-01-01 06:17:11,0,0,https://www.zhihu.com/api/v4/answers/2293802509
WinMain,2668,如果都像这部动画这样，还不如不自信。自信一定是把自己的审美喂给别人，而不是把别人的审美喂给自己。,2021-12-29 02:27:19,2021-12-29 02:27:19,0,3,https://www.zhihu.com/api/v4/answers/2289897988
十八千坛女儿红,5971,唐氏综合征即21-三体综合征，又称先天愚型或Down综合征，是由染色体异常（多了一条21号染色体）而导致的疾病。60%患儿在胎内早期即流产，存活者有明显的智能落后、特殊面容、生长发育障碍和多发畸形。1866年，Dr.JohnLangdonDown第一次对唐氏综合征的典型体征包括这类患儿具有相似的面部特征进行完整的描述并发表，因此，这一综合征以其名字命名为唐氏综合征（Down综合征）。1959年证实了唐氏综合征是由染色体异常而导致的。现代医学证实，唐氏综合征发生率与母亲怀孕年龄有相关，系21号染色体的异常，有三体、易位及嵌合三种类型。高龄孕妇、卵子老化是发生不分离的重要原因。临床表现1.患儿具明显的特殊面容体征，如眼距宽，鼻根低平，眼裂小，眼外侧上斜，有内眦赘皮，外耳小，舌胖，常伸出口外，流涎多。身材矮小，头围小于正常，头前、后径短，枕部平呈扁头。颈短、皮肤宽松。骨龄常落后于年龄，出牙延迟且常错位。头发细软而较少。前囟闭合晚，顶枕中线可有第三囟门。四肢短，由于韧带松弛，关节可过度弯曲，手指粗短，小指中节骨发育不良使小指向内弯曲，指骨短，手掌三叉点向远端移位，常见通贯掌纹、草鞋足，拇趾球部约半数患儿呈弓形皮纹。2.常呈现嗜睡和喂养困难，其智能低下表现随年龄增长而逐渐明显，智商25～50，动作发育和性发育都延迟。3.男性唐氏婴儿长大至青春期，也不会有生育能力。而女性唐氏婴儿长大后有月经，并且有可能生育。4.患儿常伴有先天性心脏病等其他畸形，因免疫功能低下，易患各种感染，白血病的发生率比一般增高10～30倍。如存活至成人期，则常在30岁以后即出现老年性痴呆症状。检查1.对外周血细胞染色体核型分析细胞遗传学研究发现，在21号染色体长臂21q22区带为三体时，该个体具有完全类似唐氏综合征的临床表现，相反，该区带为非三体的个体则无此典型症状。由此推论，21q22区可能是唐氏综合征的基因关键区带，又称为唐氏综合征区。按染色体核型分析可将唐氏综合征患儿分为三型：（1）标准型占全部病例的95%。患儿体细胞染色体为47条，有一个额外的21号染色体，核型为47，XX（或XY），+21。（2）易位型占2.5%～5%，患儿的染色体总数为46条，多为罗伯逊易位，是指发生在近端着丝粒染色体的一种相互易位，多为D/G易位，D组中以14号染色体为主，即核型为46，XX（或XY），-14，+t（14q21q）；少数为15号染色体易位，这种易位型患儿约半数为遗传性，即亲代中有平衡易位染色体携带者。另一种为G/G易位，较少见，是由于G组中2个21号染色体发生着丝粒融合，形成等臂染色体t（21q21q），或1个21号易位到1个22号染色体上。（3）嵌合体型占本症的2%～4%，患儿体内有2种或者2种以上细胞株（以2种为多见），一株正常，另一株为21-三体细胞，临床表现的严重程度与正常细胞所占百分比有关，可以从接近正常到典型表型，21-三体细胞株比例越高，智力落后及畸形的程度越重。2.羊水细胞染色体检查羊水细胞染色体检查是唐氏综合征产前诊断的一种有效方法，唐氏筛查结果为“高危”的孕妇需要确诊胎儿是否为唐氏综合征患儿。目前产前诊断最常用的技术是羊膜腔穿刺技术，即在B超引导下，将针通过孕妇腹部刺入羊水中，抽取羊水，对胎儿细胞进行染色体分析。适宜孕16～20周的孕妇。除羊膜腔穿刺术外，进行产前诊断的技术还有绒毛活检、胎儿脐静脉穿刺、胎儿镜检查等。常见核型与外周血细胞染色体核型相同。注*以上内容摘录自百度百科。,2021-12-27 19:48:48,2021-12-27 19:48:48,1,40,https://www.zhihu.com/api/v4/answers/2288159810
國病,3220,看过截图，人物形象看不出像中国人，画风更没有中国民族审美的影子。是否像中国人，要么是符合普遍中国人的形象，要么是神韵符合。人都有一种天生的能力，就是凭借直观感受就能得出结果。像不像中国人，有没有中国神韵，令人讨厌还是让人喜欢，凭借直观感受就能得出结论。我看到截图的第一感受就是反感。不仅人物形象令人厌恶，而且画风也不是明亮、明快的中国气息。西方是鬼文化，所以都是趋向于暗色调。你说传统的动漫，比如《天书奇谭》，当中老狐妖形象也很丑，但你不会觉得反感。因为画风神韵是完全符合中国气息的。所以并不是丑的问题，而是脱离了中国气息，脱离了中国人形象的基本基础。你就会感觉不舒服。有网友就说，人物的眼睛距离很远，很奇怪的一种做法。你只是隐隐约约感觉好像类似中国人，但又明确感觉距离中国人、中国气息很远。不要说这种动漫，事实上《哪吒之魔童降世》也是偏离中国文化的。只是画风类似，但故事以及一些细节并不中国，改变得很失败。这部，我的评价，「啥也不是」，建立扔垃圾桶吧。,2021-12-22 23:04:52,2021-12-22 23:04:52,0,90,https://www.zhihu.com/api/v4/answers/2282187739
泰伦惩戒骑,1944,你b一堆老番因为画风和画质陈旧，叫好不叫座的一大堆，这种丑上天的3d国漫我为啥要看？都二次元了，为啥不画好看点？为啥？大家都是老二刺猿了，你糊弄谁呢？网红脸咋了？key社全员眼大到出奇，有人不喜欢看《Clannad》么？国漫就是菜，因为菜才只敢做3d不敢做2d。都做3d了能不能认真做？那么丑，老子为啥要看？,2021-12-28 09:11:34,2021-12-28 09:14:33,1,55,https://www.zhihu.com/api/v4/answers/2288606223
陈玟,291,建议别拿仕女图说事嚎，很多仕女图中的人物除了细长眼睛外，还有一张樱桃小嘴的（别管是不是因为化妆显得嘴小），嘴唇长度都不到眼睛长度的三分之二。举例（上面那张是明代的，下面那张是唐代的）：,2021-12-29 21:35:45,2021-12-29 21:56:51,0,0,https://www.zhihu.com/api/v4/answers/2291059457
香樟连翘,99293,我想打电话举报一波，严重怀疑这个电影的创作人员里面有潜伏的敌特！上头说，我们要抵制低级红，还有高级黑！这片子不就是吗？打着弘扬传统文化的旗号，却来恶心我们。就这部电影，审片子的人都吃啥去了？中国人长这样眯眯眼？我认识的广东人没一个长这么丑的。建议电影撤档，创作人员全部隔离审查！顺便奖励我50万！,2021-12-29 00:14:08,2021-12-29 00:19:09,1,15,https://www.zhihu.com/api/v4/answers/2289834618
何威利,1256,李小龙说过了,2021-12-27 18:19:20,2021-12-27 18:19:31,0,19,https://www.zhihu.com/api/v4/answers/2288058996
FlirtLikeJoey,7991,  早说了官媒不要乱发声，不怕翻车吗？,2021-12-29 08:51:47,2021-12-29 08:51:47,0,1,https://www.zhihu.com/api/v4/answers/2290002865
知乎用户,6781,确实弘扬民族自信啊，我看出来了。举个栗子，我们从另一部经典电影说起。高菲高伯……啊错了，是海绵宝宝。海绵宝宝和派大星是怎么找到皇冠的？当然是一路无所畏惧地莽过去，又唱又跳，然后就是怪物们一路给他们开绿灯，让他们更加无所畏惧，最大的困难就是差点被晒干，但是一滴眼泪让电器短路，哥俩满血复活顺便找到了皇冠，还在一个猛男的背后解决了杀手，回到海洋，顺便拯救了蟹老板，升职加薪成为CEO。核心是勇敢和运气，上帝偏爱敢闯的孩子，看不起懦夫，其他的都不重要。还有阿甘正传，那也是一个幸运儿横冲直撞走上人生巅峰的故事。总而言之就是，做人不要走苟道，要往死里浪，这才是人生，这才是天选之子，不要稳，要勇，要超勇。如今雄猫少年也高度呈现了这个模式的叙事，主角团队只有勇气和幸运，可能还有臭脚丫子，然后就一路横冲直撞，走上人生巅峰。当然，故事的最后，他们也和派大星海绵宝宝一样，放弃了冒险旅途中的各种东西，只想升职加薪成为经理。这个故事很好啊，很形象地表达了美利坚民族的文化自信和民族精神，有什么不对吗？,2021-12-30 20:41:54,2021-12-30 20:46:55,0,2,https://www.zhihu.com/api/v4/answers/2292353699
卿如糖,0,今天陪孩子去看完了雄狮少年，有一说一，这个电影拉胯是真拉胯，我以为只有人物形象不符合审美，没想到剧情比形象更拉胯！至于女主角的事情就不想多说了，总共出现三次，加起来都没有几分钟，第一个，主角第一次参赛的时候的复仇战，编剧居然直接略过了，让我自己去想！！！！我特喵的心态炸了啊！你好歹演一下战况激烈是不是……这要是小说作者这么写小说，早被骂死了。第二个，前期的反派，一直压着主角的反派，在我看来应该是第二个爽点的，毕竟前期被打的爹妈都认不出来的样子，结果后期成了纯路人，然后强行洗白了！！！第三个，说实话，在我看来根本不算爽点了，那个擎天柱，师父一说，我就猜到了主角要跳那玩意，算是个读者视觉的理所应当吧！最后，就这样的剧情，这样的画面，我不知道那些闭眼吹的人是怎么吹起来了！反正我是没眼看！,2021-12-24 23:03:21,2021-12-24 23:03:21,5,26,https://www.zhihu.com/api/v4/answers/2284985570
后见之明郑荃,7922,所以上汽到底有什么问题？这油门也太大了。,2021-12-28 13:12:47,2021-12-28 13:12:47,0,6,https://www.zhihu.com/api/v4/answers/2288983542
低配版海灵顿,11926,央视新闻嘛，就那个科目一都没过，开口就要求司机急刹车的east west，不奇怪,2022-01-04 22:47:41,2022-01-04 22:47:41,0,1,https://www.zhihu.com/api/v4/answers/2297880389
多多多,0,今天和老婆去看了，那主角人脸感觉是外星人哈哈哈哈哈哈，洗白的全是匿名，骂的全是实名。,2021-12-26 17:15:29,2021-12-26 17:15:29,1,31,https://www.zhihu.com/api/v4/answers/2286716907
栗子,1960,,2021-12-31 14:55:59,2021-12-31 15:00:59,1,5,https://www.zhihu.com/api/v4/answers/2293169373
欢子,29621,本是一丘之貉，怎能坐视不管？,2021-12-28 00:45:31,2021-12-28 00:45:31,0,0,https://www.zhihu.com/api/v4/answers/2288446558
匿名用户,0,完全误导、虚构、丑化醒狮文化的一个东西。完全脱离广东省现实环境的演出。被广东人排队批评的东西。愣是因为【传承了醒狮文化，展现了广东人文】被其他各地的观众评为体育动画和国产现实题材的里程碑。————到底是哪里出了问题我也不懂。但它肯定是不对的。如果《雄狮少年》真的能作为弘扬文化的现实题材进入某种“殿堂地位”，那么我们电影艺术的未来就是弄虚作假，胡编乱造的好莱坞的翻版。塔人本身就虚伪，他们创造好莱坞符合他们的“精神”。但这不是我们实事求是的精神。我自己也是电影人，还望大家共勉。,2021-12-25 20:21:50,2021-12-25 20:21:50,0,28,https://www.zhihu.com/api/v4/answers/2285877585
无头的于天,519,那央视为啥不用这样长相的做主持人呢？,2021-12-28 18:50:24,2021-12-28 18:50:24,1,10,https://www.zhihu.com/api/v4/answers/2289497637
风儿红了,2,这几天网络上有很多黑子以各种方式来讽刺这部片子。但我想说这是一部人文关怀，并且积极向上的片子。 抛开其他先不谈，这部电影的主题是尤其难得可贵的，他讲述了一群身患唐氏综合征的少年（唐氏综合征的照片我就不放了，自己网上去搜，不然有人会以为我是黑子），没有向命运妥协，用舞狮来展示自己的态度。而他们被称为阿猫阿狗，这不是侮辱，这是喜剧冲突，阿猫阿狗代表他们被社会抛弃了，而影片展现了他们的不放弃，这就是勇敢的病患。 所以，我很敬佩这部作品的导演，他用自己行动来提醒我们，在中国还有着一群唐氏综合征的患者在和命运做抗争。 导演希望其他唐氏综合征的患者能从影片里学到不放弃，不屈服，努力的生活下去。 这是一部专门拍给唐氏综合征的患者看的，因为他们有着一样的命运，有着一样脸孔，他们能在这里面找到共鸣，找到人生的方向。注：我希望各位正常人不要去看这部片子，因为这部片子太火了，这才没过几天就破了一亿票房，而且场场爆满，希望你们能给其他唐氏综合征的患者留一个位置，留一张票，我替他们谢谢你们了。,2021-12-27 20:40:17,2021-12-27 20:40:17,10,15,https://www.zhihu.com/api/v4/answers/2288215486
知乎用户,47241,都快2202年的，贵乎居然还有人拿着头盖骨去“透视”动漫人物，“严谨”地证明动漫画的是猴子，当然不是中国人，喜获最高赞快8千：央视新闻评「雄狮少年」表达文化自信弘扬民族精神，你如何评价这部动画？这样大规模“科学鉴定”谁是“正统”自己人，发生在第三帝国——要按这种标准，难道中国自古自辱，还是将古人开除中国籍？作为直接被“辱”的广东人，为何包括本人和亲朋好友，并不觉得，反而觉得这部片宣传了岭南文化？如何看待三只松鼠广告模特回应妆容争议，「事事上纲上线是病态」？为何苏俄日常被西方黑，却没啥所谓？网友称《王牌特工：源起》将列宁塑造成控制俄国局势的间谍，你看过这部电影吗？如何看待其叙事？汉传佛教唯一敢称为“经”《坛经》记载一则公案：慧能从广东千里迢迢到湖北黄梅，向五祖弘忍大师求学佛法。弘忍问他从哪来，慧能说从广东，弘忍说，你是岭南人，“又是葛獠，若为堪作佛？”葛獠，是古时中原人对西南、岭南人的蔑称，意思是他们长得像猴子。弘忍故意刺激慧能说，就你这样还学啥佛？（“钢铁公司”老首长，参观甑皮岩遗址博物馆时，看到古猿人时有如下感言）慧能却回答弘忍：人有南北之分，佛性没有南北之分。弘忍一听，不仅接纳慧能，后来又将禅宗衣钵传给慧能，慧能成为六祖，也是禅宗真正的开创者。这则公案不仅表现禅宗的境界，也从侧面透露出当时大唐开放、包容的力量与气度。不看也不评价这部电影本身，揪着这部片个别眼睛一黑到底，又是怎样的能耐和胸怀？当一些人整天揪着辜鸿铭的辫子不放，辜鸿铭请他们看一下自己心中的辫子。当他们骂越南、菲律宾人是猴子的时候，可曾想过他们的血统、相貌和自己同胞的关系？中华之所以为中华，就在于用文化建构共同体，将“天下”作为比“国”更高的理想。这就是为什么东亚各国以唐律疏议作为自己封建法律的母本，唐朝对中华的代表也远不止是中华法系。同样，孙中山在梁启超基础上建构中华民族，也不是建立在扯不清的血统之上，而是建立在共同生活、文化与理想，这也是我国至今所秉承的。——正经影评：如何看待《雄狮少年》高口碑低票房？正经学术：千手关叔：中西民族观念史略,2022-01-04 22:58:00,2022-01-05 00:14:47,0,70,https://www.zhihu.com/api/v4/answers/2297891631
知乎用户,118,前无古人，后无来者。必须自信！国漫新风向，文艺里程碑。下面的帖子细数电影六大功绩，可以说是无人能及。如何看待《雄狮少年》高口碑低票房？怎么评价都不为过！我劝你要自信！看看这目录，自不自信？！,2022-01-06 20:04:33,2022-01-06 22:03:11,0,0,https://www.zhihu.com/api/v4/answers/2300504402
胸藏利剑李林甫,7042,衡山派掌门莫小宝不是被人从山上扔下去了吗。佟湘玉都成了寡妇了。,2021-12-31 14:56:45,2021-12-31 14:56:46,0,0,https://www.zhihu.com/api/v4/answers/2293170354
Chaeyoung彩瑛,37,这下NGA这种论坛还立功了，猎巫猎到老爷身上可太爽了这掐起来节目效果真棒，谁被打爆都很过瘾,2021-12-28 09:33:17,2021-12-28 09:33:17,2,25,https://www.zhihu.com/api/v4/answers/2288634859
贰柒柒27,12,去影院看了，客观的来答一下很推荐去看，场景和人物很写实。流畅自然，朴素真挚。视效方面毫无疑问的顶尖水准，当然国漫这方面做得也不差了，动作戏的运镜干净利落，丝毫不拖泥带水。剧作方面确实满意，剧作模式和笑点铺设都很好。笑点方面也显得有些陈旧，缺乏更新颖的表达，后半段共情体验上来之后就水到渠成了。我是沙B,2021-12-27 17:53:44,2021-12-31 18:42:01,12,24,https://www.zhihu.com/api/v4/answers/2288027562
斯图卡,5011,说到底，你可以骂一个片子 剧情烂，设定烂，定妆丑。一点问题都没有。但是这种“扛着红旗打红旗的”行为让我觉得无比奇怪。我想知道第一个提出这个RH问题的人的底细到底是什么样子的。有一说一……这片子定妆是丑……,2021-12-27 09:10:44,2021-12-27 09:15:25,10,9,https://www.zhihu.com/api/v4/answers/2287263455
