author,fans_count,content,created_time,updated_time,comment_count,voteup_count,url
AJCherry,193,用扎根于中国人的奋斗努力的文化，来打败中国人在审美上的自信；用中国的传统文化，来灌输一种病态的审美；用一种看似正确的信仰，来证明一种看似的政治正确；用左手打右手，太高明了，有点可怕啊！！,2021-12-29 16:58:33,2021-12-29 17:00:11,0,1,https://www.zhihu.com/api/v4/answers/2290756273
阿白,1,宣传奴工万是表达某些人的文化自信，弘扬某些人的民族精神。毕竟那些人的传统美食，是火鸡。毕竟他们的祖宗在宋代就和黑人踢足球了。,2021-12-29 15:13:35,2021-12-29 15:13:36,0,1,https://www.zhihu.com/api/v4/answers/2290577774
小安妮,6,总而言之，这是非常好的一部动漫，好就好在好踏马了个x,2021-12-29 14:30:01,2021-12-29 14:35:01,0,1,https://www.zhihu.com/api/v4/answers/2290508773
Lierre,3,看完《雄狮少年》以后，只能感慨现在做动画越来越难了，做现实题材要被骂做概念性的片子也要被骂，批判性太强要被骂隐喻过重观众又看不明白。那没有办法，还是按照传统的套路来吧，立意无非就是那几样，《雄狮少年》就是这样一部套路性的鸡汤电影。个人看法是，我觉得这是一部整体来说还是不错的电影，一个人从泥里爬起来的故事。至少它把故事讲明白了。立意也很明确，弘扬了传统文化，激励了人心。画面也很美，动作设计也很优秀，干净利落，反正本废物是做不出这么优秀的设计所以怀着敬佩的心情去学习的。看了下朋友圈大家的评论，大多数朋友尤其是做动画的朋友都是以一种“惺惺相惜”的态度来观影的。但是，作为观众来说，这部电影值得诟病的地方很多，主要还是吐槽剧情这一块吧。我觉得人物塑造的不够鲜明，比如片子里的阿猫阿狗，抛开人物和声音设计，这两个人的性格特点其实和阿娟是差不多的，只不过三人行必有一leader，而这个人刚好是男主而已。另外整个逻辑也很奇怪，有很多地方在莫名其妙的煽情，虽然大体节奏还是能看出来，但是很多局部节奏很混乱，逻辑有很多对不上的情况，比如最简单的一个地方在于陈家村欺负男阿娟的那群混混，开头都街头暴力了，结果最后又突然对主人公示好，就因为男主去广东打工的时候霸凌男刚好看到就深受感动咩？还有最最重要的地方，为什么是舞狮？我真的很疑惑，为什么不可以是其他的什么东西，就因为主创单纯的想宣扬舞狮的传统文化？电影里面直到结尾才告诉观众男主小时候和父母有过一段非常美好的关于舞狮的回忆，但这也不至于把舞狮当作梦想一般的存在，明明是一个为了生计而犯愁的青年，还不如谈钱来得实际。病猫和雄狮只是隐喻，简单直白一点的转译就是，如果不想继续这么窝囊地活着就要努力去做出改变，但是电影还是停留在简简单单喊口号的阶段，我要成为一头雄狮就真的是一头雄狮了吗？电影里男主父亲在外务工受伤被迫出走打工，确实，经历了生活的苦楚他的眼神和身体都明显坚毅了许多，但这还不足以解释“成为一头雄狮”这样的转变，我认为的转变应该是他的处境变好一些，可能收获金钱名誉可能是爱情这些切实可见的东西，但电影到这里又戛然而止了，男主只是有可能赢得一场舞狮比赛而已。即使是片尾的彩蛋里有暗示说他要继续学习参加高考，但这在之前的剧情里并没有提到过男主的成绩怎么怎么样（我不相信多背几句李白的诗就证明他有多么热爱学习）。所谓“转变”，虽不至于阶级的跨越，但好歹现实一点嘛，我真的很想知道男主之后到底过得怎么样！但是片子里最惊艳的两个地方，第一个是男女阿娟的惊鸿一瞥很戳我，这种不得不承认这一眼很惊艳，另一个地方就是结尾的时候，男主把狮头留在了擎天柱上。从美术的角度来说，我觉得这部动画整体是一极美的，很多场景的渲染都做得很不错，但是细节的地方，尤其是龙套角色没有做的很到位，但是这也不影响整体的画面。至于大家都在骂的人物设计，我只想说，我真的好喜欢！人物设计尤其是动画，又不是像平时大家喜欢看的纸片人那样，四分之三角度摆好姿势怎么看怎么完美。一个人有不同的表情，不同的角度怎么可能是完美的。我觉得雄狮的character design做得非常好的一点就是真实，就是在观影的时候他有些角度看起来确实可以给人一种很怂很智障的感觉，但是也有特别特别帅气的时候，比如男主把拿着狮头的时候。而且所有角色里又不是所有人都是小眼睛，咸鱼强的老婆就应该是传统审美中的美女。如何去欣赏一人设？我觉得首先要符合整个人物的性格，他的长相穿着神态以及运动的姿势都是为了他是什么样的人服务的；其次应该把他放在整体环境之中去看，他的人设是否符合环境他不同的角度看起来应该是怎么样的，人不是完美的，人设也不是完美的。单看这两点我觉得雄狮的人设就已经做的很好了，包括阿娟前期和后期的眼神、肌肉、运动姿势的转变很多很细节的地方都处理得很好（看完又觉得自己学到了好多），如果非要挑毛病就还是阿猫阿狗的角色塑造不够饱满吧，还是感觉只做了造型和声音那些外在东西的区分。总之，瑕不掩瑜，这还是一部非常优秀的电影，而且它更具开创性的美术设计，将审美这件事下降到一个庶民的高度，大家终于开始讨论“美的范式”这样的问题，而这个问题永远不会有答案。至于现在国内的主流审美，深受西方国家的影响，国人没有一套完整的审美价值体系，我觉得这才是最可怕的事情。至于什么小眼睛就是rh的论断，我只想说这是一部商业动画不是单纯的艺术创作，且不说主创根本没有这样的想法核心价值观也不是这个。如果真的看不惯想要骂人，去骂某个搞摄影的艺术家吧！,2021-12-29 14:29:04,2021-12-29 14:29:05,0,1,https://www.zhihu.com/api/v4/answers/2290507182
青绶,132,闹呗，反正以后全天下都是黑人，眯眯眼什么的也就现在能争论下了,2021-12-29 14:27:27,2021-12-29 14:27:27,0,1,https://www.zhihu.com/api/v4/answers/2290504767
JackeyJin,2,传说归传说，这个欧美认证的！十足香蕉！反正文艺圈已经不指望能有什么留学硬骨头了！人家世界公民老是丑化我们中国，我们真的不用告这些人种族歧视吗？为什么这些世界公民在国内装什么大师？欧美的审美凭什么我们要认准呢？现在中国市场就是你们按我们的标准来，不按可以别进来！眯眯眼与雀斑脸是你们欧美与亚裔的审美，关我们中华什么关系！再打着中国旗号，别怪我们告你们毁谤与种族主义！,2021-12-29 14:25:20,2021-12-29 14:25:20,0,1,https://www.zhihu.com/api/v4/answers/2290501418
匿名用户,0,想想被封的re：0，我竟不知说什么好,2021-12-29 13:04:07,2021-12-29 13:06:54,0,1,https://www.zhihu.com/api/v4/answers/2290384469
知乎用户,10761,丑化中国人的形象，拿西方的奖，回来圈中国的钱,2021-12-29 13:00:10,2021-12-29 13:00:10,0,1,https://www.zhihu.com/api/v4/answers/2290378816
不治将恐深,12,看看现在中国的互联网用户是一群什么妖魔鬼怪。我严重怀疑有五十万混在中间挑拨极端民族情绪。,2021-12-29 12:53:23,2021-12-29 12:53:24,0,1,https://www.zhihu.com/api/v4/answers/2290370405
魔铁兔,0,李小龙一辈子的努力现在被这些人全毁了……【就凭李小龙说的这段话，就值得我们粉他一辈子！！-哔哩哔哩】 https://b23.tv/TkDyFXH,2021-12-29 12:39:07,2021-12-29 12:39:07,0,1,https://www.zhihu.com/api/v4/answers/2290352379
穷酸腐儒,177,央  . Tv 站在人民的对立面也不是一次两次了，别忘了，柴静 还有个姓丘的都是央出来的,2021-12-29 12:36:19,2021-12-29 12:36:19,0,1,https://www.zhihu.com/api/v4/answers/2290348764
呐喊,9,“广东舞狮，能不能拍电影？”“能，站着。”“拍电影能不能挣钱？”“能，站着。”导演：“我就是要跪着，把洋人舔了！”,2021-12-29 12:06:13,2021-12-29 12:06:13,0,1,https://www.zhihu.com/api/v4/answers/2290307183
旁白,405,大裤衩里出了多少两面人和25仔还用多说吗，不聊这个？那咱们聊聊大型长篇3D动画《雷锋的故事》吧。,2021-12-29 12:04:01,2021-12-29 12:04:01,0,1,https://www.zhihu.com/api/v4/answers/2290304326
张惜惜,19,人在广东刚下灰机，我办公室的广东人对这个解释很不满意，人家几个本地姑娘都是水汪汪的大眼睛……舞狮子的在她们村都是很牛逼的，根红苗正好青年，从小开始培训也不是谁都能拿狮头的！我在朋友圈看到还有朋友家几个孩子4岁左右开始练习的视频，人家都是童子功起的，而且要讲究配合，很多动作两个人没有几年的配合真做不好，几天你能上桩还能比赛第一……我都替广东这些舞狮队生气！大家有机会来广东可以去西樵山的黄飞鸿纪念馆看看，他们之前每天都有几个时间段会对外表演舞狮（现在疫情不知道了）之前我们公司有请过佛山的舞狮队，现场看真的好精彩！,2021-12-29 11:56:26,2021-12-29 11:56:26,0,1,https://www.zhihu.com/api/v4/answers/2290293153
鳳城凌玉涵,84,纵然各大评分网站登顶，“荣登”最强国漫榜首。但依旧不能挽回《雄狮少年》票房扑街的事实。资本妄图像过去一样，通过控评推高电影评分收割票房。但没想到的是，在高度发达的自媒体下，剧组和影片的底细瞬间被扒了个精光。妄图通过垄断公众信息接收渠道强行给观众喂屎的企图，就此夭折。太阳底下没有新鲜事，国人看上去一盘散沙，只是因为他们缺乏沟通的统一渠道而已。成也互联网，败也互联网，当信息进入高度透明的时代，精英阶层就不会再拥有垄断性的话语权。在高度发达自由的言论环境中，每一个人发出的光芒都可以相互交融，变成一个耀眼的太阳，最主流的观点必然是最符合人性的观点。有些人在风口上赚了几个钱，就开始飘了，以为自己掌握着天下人的喜怒哀乐，觉得全天下的人都应该吃着它们喂的屎，还要跪着向他们上贡。这不免有一点自欺欺人。在这里，正告那些手握资本的所谓精英，不要与民众的审美观对抗，不要与人性和5000年的中华文明对抗。毕竟你们那一点点资本，在14亿人面前屁都不是。我们才是爷！,2021-12-29 11:52:09,2021-12-29 11:52:09,0,1,https://www.zhihu.com/api/v4/answers/2290286633
化伪,2,在不少平台骂过不少次了现在突然想起来你一个拍片子竟然还敢对观众指手画脚？,2021-12-29 11:26:07,2021-12-29 11:26:07,0,1,https://www.zhihu.com/api/v4/answers/2290241475
只能是卡尔啊,491,什么叫做文化自信呢？十年前我看到这种垃圾的时候可能会怀疑是不是自己和时尚圈子离的太远不能理解这种“高级审美”。十年后我看到这种垃圾终于敢说出来了，“这玩意它就是不好看，就是涉嫌歧视，天王老子来了我也说它不好看，段鹏把那几个瞎说八道的绑城门楼子上去，二营长你他娘的意大利炮呢？”,2021-12-29 11:22:45,2021-12-29 11:22:45,0,1,https://www.zhihu.com/api/v4/answers/2290235238
鳳城凌玉涵,84,纵然各大评分网站登顶，“荣登”最强国漫榜首。但依旧不能挽回《雄狮少年》票房扑街的事实。资本妄图像过去一样，通过控评推高电影评分收割票房。但没想到的是，在高度发达的自媒体下，剧组和影片的底细瞬间被扒了个精光。妄图通过垄断公众信息接收渠道强行给观众喂屎的企图，就此夭折。太阳底下没有新鲜事，国人看上去一盘散沙，只是因为他们缺乏沟通的统一渠道而已。成也互联网，败也互联网，当信息进入高度透明的时代，精英阶层就不会再拥有垄断性的话语权。在高度发达自由的言论环境中，每一个人发出的光芒都可以相互交融，变成一个耀眼的太阳，最主流的观点必然是最符合人性的观点。有些人在风口上赚了几个钱，就开始飘了，以为自己掌握着天下人的喜怒哀乐，觉得全天下的人都应该吃着它们喂的屎，还要跪着向他们上贡。这不免有一点自欺欺人。在这里，正告那些手握资本的所谓精英，不要与民众的审美观对抗，不要与人性和5000年的中华文明对抗。毕竟你们那一点点资本，在14亿人面前屁都不是。我们才是爷！,2021-12-29 11:52:09,2021-12-29 11:52:09,0,1,https://www.zhihu.com/api/v4/answers/2290286633
化伪,2,在不少平台骂过不少次了现在突然想起来你一个拍片子竟然还敢对观众指手画脚？,2021-12-29 11:26:07,2021-12-29 11:26:07,0,1,https://www.zhihu.com/api/v4/answers/2290241475
只能是卡尔啊,491,什么叫做文化自信呢？十年前我看到这种垃圾的时候可能会怀疑是不是自己和时尚圈子离的太远不能理解这种“高级审美”。十年后我看到这种垃圾终于敢说出来了，“这玩意它就是不好看，就是涉嫌歧视，天王老子来了我也说它不好看，段鹏把那几个瞎说八道的绑城门楼子上去，二营长你他娘的意大利炮呢？”,2021-12-29 11:22:45,2021-12-29 11:22:45,0,1,https://www.zhihu.com/api/v4/answers/2290235238
king boom,11,这几年，《大鱼海棠》国漫里程碑；《大圣归来》国漫里程碑；《白蛇缘起》国漫里程碑；《雾山五行》国漫里程碑；《灵笼》国漫里程碑；《雄狮少年》国漫里程碑这几年国漫净给自己立碑了，不知道的还以为给自己挖坟呢。特别是雄狮少年，先不提那个怪物一样的眼睛，你导演在发布会上说的话可真是把我恶心到了。“我们把接力棒递给了观众，是观众没接好”什么意思啊？合着你动漫没人看，怪观众不爱国？怪观众不去看！！？？有你这么道德绑架的？自己的动漫做的不咋地，还怪别人不去看也真是太秀了。合着国漫还能道德绑架了。再说一下，这个导演的金句“我们动漫中，人物的形象是根据广东人的形象画的”你说出来这句话不怕挨揍吗？我见过这么多广东人还真就没长这样的。广东的朋友怕是想打你一顿！！！！最后，这个电影中的人物形象，被法国某奖认定为，东方人物的形象典范，好家伙，辱华实锤了！！！,2021-12-29 11:12:16,2021-12-29 11:12:16,0,1,https://www.zhihu.com/api/v4/answers/2290215789
逸尘莜,3,一张图可以完美回答关于人物形象的问题。,2021-12-29 11:02:22,2021-12-29 11:07:23,1,1,https://www.zhihu.com/api/v4/answers/2290198581
小玉米,183,说实话这个电影开始我也没想那么多，虽然我也没关注也没去看，但是我态度还比较中立我就想着是不是创作团队画风本来就比较猎奇，毕竟一些创作者就是画风奇奇怪怪的，他们自己可能也没想那么多，但是做出来却触碰到大家的敏感点了，我还觉得是一个双方的误解但是直到主创说这是他写实的广东人，让大家去照照镜子的时候我觉得这玩意就没得洗，你画风猎奇你还说这是写实真人，在这恶心谁呢(▼皿▼#)不说广东人全世界估计也没几个张这样的吧,2021-12-29 10:43:42,2021-12-29 19:17:56,0,1,https://www.zhihu.com/api/v4/answers/2290166929
惠雍,2,实在不能理解有些人，洋人拿着这些长相缺点来侮辱我们，有人还要把这些缺点程度加大再聚一起，然后告诉我们这是写实动画，广东人都长这样，这都有人洗。有人说很多人长这个样子，我回复说，没人长动画主角那样小眼睛、宽眼距、再加眼角斜上45度。他说我胡搅蛮缠，说我拿量角器量过吗，他说我注意动画中人物下巴突出、眼睛和眉毛不是一个中轴线就是扣、就是较真。他说这样的人很多，却只举了一个高其蓁，我说她的眼角并没有那么斜，他跟说高小姐被人说形象乳化，跟我科普不止眼角斜是乳化。重点是，他也知道跟高小姐说她长得像这动画的人物一样是冒犯她！他说他身边很多人长这样，我后来想通了，他就是动画里的人物。,2021-12-29 10:40:12,2021-12-29 10:40:12,0,1,https://www.zhihu.com/api/v4/answers/2290161218
北京中伦高律师,32,你们刚刚删了我的评价，我还能如何评价？你说怎么评价就怎么评价吧,2021-12-29 10:28:37,2021-12-29 10:28:37,0,1,https://www.zhihu.com/api/v4/answers/2290141123
Mrs.Penguin,5,到底该怎么说，我，男主角，放着赚不完的舞狮钱我不赚，我就要去搬砖，打灰，住地板砖？我，舞狮主题的男主，结果我不舞狮，我他妈去打工。也不上学。再者，别人练习那么多年才有资格变狮尾，我，超牛，短短的时间我边练习边打工还能做狮头。,2021-12-29 10:22:24,2021-12-29 10:22:24,0,1,https://www.zhihu.com/api/v4/answers/2290131155
墨萝,1,没看电影，从网络的图片上看得出，动画建模的是非常有实力的。但是感觉近些年的电影，有些卖弄情怀，和有一些把大众当傻子的操作，单就这个电影来说这个人物建模不用狡辩，百分之一万是为了取悦外国人，这是极大的耻辱，以传统文化元素来吸引国人，再丑化人物取悦洋人。这种性质不应该仅仅只是在舆论中去批判，必须更上一个层级，让这种行为龌龊的人受到应有的，且严厉的处罚，至少让国内自身，树立应有的自信自强理念，逐步且彻底铲地除不正之风。,2021-12-29 10:12:58,2021-12-29 10:12:58,0,1,https://www.zhihu.com/api/v4/answers/2290115434
王也,0,西安因为疫情封了城然后凌晨三点雄狮少年排片拉满了《震惊！雄狮少年顶级豪华制作，市民竟为一观而放弃抗疫！》借阴兵也不带点脑子笑嘻了,2021-12-29 10:09:32,2021-12-29 10:09:32,0,1,https://www.zhihu.com/api/v4/answers/2290109861
知乎用户,0,“眯眯眼”事件还在发酵，其实比眼梢更上挑的，是所谓的“东方主义”……,2021-12-29 10:04:40,2021-12-29 10:04:40,0,1,https://www.zhihu.com/api/v4/answers/2290101631
mark111,1,他们做中国电影甚至都不愿意讨好中国观众。,2021-12-29 09:48:21,2021-12-29 09:48:21,0,1,https://www.zhihu.com/api/v4/answers/2290077240
咖啡茶,7,压在中国人民身上的三座大山，帝国主义、封建主义和官僚资本主义,2021-12-29 09:44:20,2021-12-29 09:44:20,0,1,https://www.zhihu.com/api/v4/answers/2290071492
直不疑,5,唔……我初看还以为是韩国  人跪舔鹰酱的扛鼎之作……顺便宣传下高丽整容秘术，狠赚美元、欧元、韩元……话说回来，你这所谓论据似乎夹了私货，好像只有红圈部分是真的，后面有待商榷……,2021-12-29 09:39:39,2021-12-29 09:51:50,0,1,https://www.zhihu.com/api/v4/answers/2290064617
匿名用户,0,看完微信群这两个人的评论，我突然觉得挺可悲的,2021-12-29 08:50:26,2021-12-29 08:55:27,0,1,https://www.zhihu.com/api/v4/answers/2290001358
知乎用户,138,某种程度上可以和《雷锋的故事》媲美,2021-12-29 08:14:58,2021-12-29 08:49:56,0,1,https://www.zhihu.com/api/v4/answers/2289970797
风晨月夕,22,该片受到法国昂西国际动画电影节好评，这也是被大家批评讨好西方的原因，说到法国动画，在中国最出名就两部，一部是中法合拍的中华小子一部是法国原创动画虚幻勇士所以不说剧情如何，就人物形象来说，小眼睛宽眼距吊梢眼的形象很难说不是为了迎合法国动画电影节吧此外附上近几年获得法国昂西最佳长篇动画电影的几部动画画面，其中法国的居多发现他们还挺喜欢宽眼距的，要不就是一些更猎奇的风格，然而虽然雄狮少年在审美上迎合，但我估计它大概率还是得不了奖，因为亚洲的几部获奖作品反而更符合中国更多人的审美，虽然获奖时间都较早，如麦兜故事，韩国的五岁庵，日本的红猪、百变狸猫，可见重要的是有自己风格，而不是迎合审美，同为亚洲人的日韩也不喜欢用这种动画人物设计,2021-12-29 04:15:52,2021-12-29 04:20:54,0,1,https://www.zhihu.com/api/v4/answers/2289916938
过客2000,82,辣鸡中的战斗机,2021-12-29 00:19:31,2021-12-29 00:19:31,0,1,https://www.zhihu.com/api/v4/answers/2289838647
小伺机,594,唯一正确的做法是？ @央视新闻 ,2021-12-28 22:49:17,2021-12-28 22:49:17,1,1,https://www.zhihu.com/api/v4/answers/2289752812
廷言,17,黑广东人的点可以有很多，比如身形没有北方人魁梧，比如塌鼻梁，比如高颧骨，甚至可以说龅牙。但是黑广东人眼睛的，我第一次见,2021-12-28 22:47:57,2021-12-28 22:47:57,1,1,https://www.zhihu.com/api/v4/answers/2289751366
让我在怂一会,9,说明内部有坏人啊,2021-12-28 22:47:06,2021-12-28 22:47:06,0,1,https://www.zhihu.com/api/v4/answers/2289750467
紫苏,378,,2021-12-28 22:39:54,2021-12-28 22:44:56,0,1,https://www.zhihu.com/api/v4/answers/2289742857
蓝子博,6,央视新闻是中国重要的新闻舆论机构，是党、政府和人民的重要喉舌，是中国重要的思想文化阵地，是当今中国最具竞争力的主流媒体之一。是全国公众获取信息的主要渠道，也是中国了解世界、世界了解中国的重要窗口，在国际上的影响正日益增强。,2021-12-28 22:39:50,2021-12-28 22:41:30,0,1,https://www.zhihu.com/api/v4/answers/2289742797
超宅男,18,我，广东人。我和我身边的人没见过眼睛长那样的。,2021-12-28 22:36:52,2021-12-28 22:41:53,0,1,https://www.zhihu.com/api/v4/answers/2289739759
拉普拉斯妖精,1,不要听他们说什么，要看他们做什么。我只知道他们老大刚娶了一个浓眉大眼的女演员，而不是娶了一个眯眯眼的女人。,2021-12-28 22:03:20,2021-12-28 22:03:20,0,1,https://www.zhihu.com/api/v4/answers/2289704262
123456,0,明白了姜维的感觉了,2021-12-28 21:33:12,2021-12-28 21:33:12,0,1,https://www.zhihu.com/api/v4/answers/2289673289
糖果盒,13,,2021-12-28 21:29:43,2021-12-28 21:34:44,2,1,https://www.zhihu.com/api/v4/answers/2289669751
WHOAMI,0,来一个，冲一个，谁来都没用。,2021-12-28 20:52:19,2021-12-28 20:52:19,0,1,https://www.zhihu.com/api/v4/answers/2289627600
WhosPiPi,17,原来中国人都长这样特别是广东人，听说跟广东人一模一样,2021-12-28 19:36:29,2021-12-28 20:01:08,0,1,https://www.zhihu.com/api/v4/answers/2289546904
上山下海打豆豆,751,文化自不自信我不知道。我只是单纯欣赏不了这个人物建模。所以不去看。我不喜欢眼距宽的眯眯眼。如果主角合我眼缘，那我可能会去看。老百姓不喜欢的，就不要自我感动觉得票房对不起片子质量。,2021-12-28 18:18:38,2021-12-28 18:18:38,0,1,https://www.zhihu.com/api/v4/answers/2289461260
匿名用户,0,祝导演的后代也能成为像电影《雄狮少年》主角一样的人物。最起码长的得像主角吧。如果你觉得这句话在骂人，那电影就有问题。,2021-12-28 18:16:47,2021-12-28 18:16:47,0,1,https://www.zhihu.com/api/v4/answers/2289459535
陈风去,813,说明央视这个堡垒可以被攻破，攻破他的一定是糖衣炮弹,2021-12-28 18:13:56,2021-12-28 18:13:56,0,1,https://www.zhihu.com/api/v4/answers/2289456476
昊ANGEL,734,丑就算了，还不让人说？,2021-12-28 18:07:28,2021-12-28 18:07:28,0,1,https://www.zhihu.com/api/v4/answers/2289450060
汤神君,8,货拉拉还不够让他身败名裂？她算个什么？内鬼大本营,2021-12-28 16:14:22,2021-12-28 16:14:22,0,1,https://www.zhihu.com/api/v4/answers/2289276734
司马老贼,2,我的评价是  哈人,2021-12-28 14:54:53,2021-12-28 14:59:54,0,1,https://www.zhihu.com/api/v4/answers/2289139604
人间人爱,0,好好的一部片，因为这个“眯眯眼”被推上舆论风波，这个应该是导演还有制片人没有想到的，但是从清华美院、到陈漫迪奥事件，导演和制片人都不看新闻的吗，不知道避嫌吗，,2021-12-28 14:36:14,2021-12-28 14:36:14,0,1,https://www.zhihu.com/api/v4/answers/2289109979
知乎用户,99,建议央视新闻以此作为选择主持人的标准。,2021-12-28 14:32:13,2021-12-28 14:32:13,0,1,https://www.zhihu.com/api/v4/answers/2289103531
yang,1038,是说那个在货拉拉案里评论，货拉拉司机应当第一时间踩急刹车才是唯一办法的央视新闻吗？是的话就不奇怪了,2021-12-28 14:32:08,2021-12-28 14:32:08,0,1,https://www.zhihu.com/api/v4/answers/2289103445
糖与黄金,70,我想问一句央视撰稿人，你看了么？一直饱受诟病的宣传工作还是一样的拉胯现在连审核都开始敷衍了事了,2021-12-28 11:35:25,2021-12-28 11:40:26,1,1,https://www.zhihu.com/api/v4/answers/2288843250
林qa,324,要是这样的话以后别的公司乃至外国搞眯眯眼宣传，我们也不要骂了，省的双标。离大谱,2021-12-28 11:29:26,2021-12-28 11:29:26,0,1,https://www.zhihu.com/api/v4/answers/2288832406
