author,fans_count,content,created_time,updated_time,comment_count,voteup_count,url
江白喊,57,"总有人喜欢把一切矛盾转移成内部矛盾。有时候他们表现得过于__让我一度怀疑这些家伙是不是在钓鱼。后来发现他们是真情实感的__所以我闭麦了，就像看到和资本家共情的__一样。比如：不管是眯眯眼还是斜眼，这种恶意满满的暗示，你们不觉得憋屈吗？很多人逻辑搞错了，是欧美/2龟子，用眯眯眼，斜眼暗戳戳的歧视我们，不是我们自己歧视这些生理特征。还有人觉得抵制用眯眯眼斜眼代表我们是容貌羞辱。双标玩得真溜啊，欧美剧里，有人故意比眯眯眼拿亚洲人开涮怎么没见你跳得这么凶的？你们知道什么是拒绝容貌羞辱吗？是就算你是眯眯眼，斜眼，别人也没权利用这个特征去嘲笑你。但这么多年欧美一直在通过这些生理特征歧视我们，以前我们没有话语权，现在终于上桌了，想推翻欧美给我们限定的歧视皮肤，按照自己的审美来，你和我说这是容貌羞辱？这类只会把矛头对内的人，真的不配上桌吃饭。如果今天我们接受了欧美对我们的""审美""，以后，可能还会解锁矮子，龅牙，朝天鼻等限定歧视皮肤。舆论战从未停止，我们的拖鞋，就是在给欧美提供越来越多的歧视素材。打个比方，广西大多人的身高在1.5 -1.7米之间。但是如果平均身高高于广西的山东人，拍了部电影，里面的广西人全部用身高1.4米的罗圈腿扮演。假设你是广西人，你什么感受？估计早就掀桌子了。为啥同样的恶心事，换成外国和2龟子干，就有人觉得可以理解了？为什么啊？为啥啊？啊？",2022-01-03 10:54:33,2022-01-03 11:26:46,0,2,https://www.zhihu.com/api/v4/answers/2295863140
Bezal,68,@沈逸：眯眯眼真正讨论的问题始终只有一个：这个符号（吊眼梢眯眯眼）是不是适用于中国的唯一美学符号？搞笑的是，出来辩护的，在绕了一圈或者几圈之后，回到的原点，要大家接受眯眯眼是美学符号，而且还不是歧视，不是辱华。这个就是内化了规训之后的自主传递，以自觉不自觉的代理人的方式。,2022-01-03 07:31:27,2022-01-03 07:31:27,0,2,https://www.zhihu.com/api/v4/answers/2295709320
飞狒,56,大家讨论这么激烈多累。评价电影先回归他的商品属性吧。我们不喜欢，觉得丑，就不掏钱看。票房多凉凉，下回就没这奇葩玩意了。他们就喜欢看你跳脚。不如，爱谁谁，爷不看。,2022-01-02 12:44:47,2022-01-02 12:44:47,0,2,https://www.zhihu.com/api/v4/answers/2294969582
飞翔的荷兰人,2053,有一说一，那么多权威机构、媒体、个人为“雄狮”站台，说明它本身是想做一部好电影的。但是！但是时机不对。你放在几年前兴许大家没有受冒犯的感觉，但是近些年借此RH的还少吗？美国人敢讽刺亚洲人的特征，它敢讽刺老黑的炸鸡西瓜？你让它试试？做个正常的动画形象很难吗？你敢做就得承受这样的后果！以此警示后来人，让后面的人都知道这个错误不能犯。我不管你是脑残还是别有用心，只要你犯了错就得承认改正吧？不改正而且还找理由，糊了就糊了吧！那么多权威机构都说你好也没用！老百姓不喜欢，你算老几！,2022-01-01 18:05:38,2022-01-01 18:05:38,0,2,https://www.zhihu.com/api/v4/answers/2294304636
卡卡鲤娜,0,眯眯眼不等于单眼皮小眼睛眯眯眼不等于单眼皮小眼睛怎么老是有些莫名其妙的人跳出来自己捡骂呢,2021-12-30 21:21:24,2021-12-30 21:59:24,0,2,https://www.zhihu.com/api/v4/answers/2292391433
善假于物,2,歪果人喜欢看咱们吃翔，电影的导演和制片想要拿到歪果人的称赞特意在一锅看起来鲜美的汤里加了一坨翔，美其名曰你们每天吃的就是这种东西，还雇了一帮人说锅里的翔不臭……,2021-12-29 19:57:23,2021-12-29 19:57:23,2,2,https://www.zhihu.com/api/v4/answers/2290961791
匿名用户,0,我不知道有什么好争的，眼睛大也好看，眼睛小也好看古代美女画像都是小眼细眼，而现在小眼睛被称为眯眯眼，而且是丑的象征。这是因为外国人用我们眼睛小来侮辱我们，所以现在我们的审美就要排斥这一种生理特征。我认为这种被外国人拽着跑的审美是非常不公平的，凭什么中国人就要管外国人怎么想，跟着外国人的审美走啊。大眼睛固然好看，但是小眼睛单眼皮就不好看了吗？外国人嘲笑归外国人嘲笑，我们被他们激怒才说明他们的嘲弄和侮辱达到目的了。那为了公平起见，我们也要用外国人眼睛大来侮辱他们，说他们长得跟怪兽咕噜一样。谁怕谁啊，真是无语 我觉得大眼睛的迪士尼动漫人物设计很不错，我也觉得雄狮少年里面的吊梢眼人物设计很不错。《白蛇传》很符合大家的审美，但它把中国人全部都刻画成大眼睛让我有些审美疲劳。我不是很喜欢《白蛇传》里面都长得一摸一样，跟网红一样的人物。我希望中国影视中既能包容大眼睛的形象，也能包容小眼睛的形象，不要让以后的动画为了迎合大众审美把角色全都捏成网红脸。,2021-12-29 11:10:56,2021-12-29 11:24:02,31,14,https://www.zhihu.com/api/v4/answers/2290213439
匿名用户,0,看这么多人骂，还以为是大烂片呢，结果我怎么发现骂的全是盯着眼睛骂的。剧情，立意，配乐碰都没人敢碰。咦，成功挑起了我的兴趣，这下我还真想去看看了。顺便，那个把别人的照片p了放在评论区里的，这种不好好说话攻击辩论者的，是真的恶臭，臭不可闻。,2022-01-05 23:33:26,2022-01-05 23:33:26,1,2,https://www.zhihu.com/api/v4/answers/2299327238
匿名用户,0,看了好多回答，为《雄狮少年》说了哪怕一点好话的人下面都有一堆人骂，一堆人喷，言辞着实有些难听都说眯眯眼辱华，角色丑，西方灌输审美，审美丑化，没有树立中华民族的正确审美，影响下一代，还有说资本恶意修改原画，把原本正气灵动的少年改成了现在这个丑样子。我就在想，如果我们刻意在意这些，是不是才是真的被西方牵着鼻子走了。片子里的主角是现实里的小人物，是小混蛋，导演选择这样不甚悦目的形象表现也没什么问题。谁说小人物不能追梦，谁说小人物不能体现精神。你非得说形象辱华形象丑陋，是不是有点刻意在乎外在而忽视了精神内核。换个角度想，如果这个形象真的就是故意往西方审美靠的，我们为什么不能说是让西方看看，“瞧啊，你们看不起的小人物啊，身上也有巨大的精神力量。”再者说西方污名化中国的小眼睛眯眯眼，重点并不是在眼睛小和眼睛细长，中国古代包括戏曲和绘画都是呈现细长态的，但是却能表现一种气度一种气场。西方却是在刻意将这种眼睛特征丑化，并且将一些特定的不堪的性格包括奸诈狡猾赋予拥有这样眼睛的角色（傅满洲）。鉴于电影主角本来的身份和生活环境就是不堪的，面相猥琐一点也勉强说得过去。关键是精神啊精神，我想雄狮少年在这一点上并没有违背什么吧…当然有些媒体吹说是审美复苏什么的就确实有点傻逼了。那个舞狮的颜值都比里面的人类高。,2021-12-30 23:26:16,2021-12-30 23:26:16,0,3,https://www.zhihu.com/api/v4/answers/2292509930
花生糖,5,不知道说啥好，感觉自己不适合看动画片了，被骂的很惨的雄狮和姜子牙我觉得挺好看的，哪吒和大圣觉得就这就这就这？看了开头就知道结尾的片子，道理也是老生常谈看点在哪里的感觉，哪吒看到后面直接坐不住，看待的话大概是觉得审美这个玩意真的挺神奇。,2022-01-06 09:46:38,2022-01-06 09:46:38,0,1,https://www.zhihu.com/api/v4/answers/2299609626
说话要阴阳怪气,124,建议先去摸摸导演的底做个背调看看是谁给他的投资有没有奇怪的交易记录或者是大量现金我反正是不信正常人能做出这样的东西还美其名曰提高自信，弘扬传统2个月的努力超过别人几十年努力然后去打工真是好名族自信啊！真就一点一点拓宽我们的底线还要我们夸？,2022-01-06 08:27:26,2022-01-06 08:27:26,0,1,https://www.zhihu.com/api/v4/answers/2299518292
鱼香肉丝,74,我不知道多少人被骂cnm的时候会去跟骂他的人说，他发现你并没有跟他妈妈进行性关系，所以他并没有被骂。,2022-01-06 07:37:15,2022-01-06 07:37:15,0,1,https://www.zhihu.com/api/v4/answers/2299491917
千幻叶奈,6,,2022-01-06 00:05:10,2022-01-06 00:22:29,0,1,https://www.zhihu.com/api/v4/answers/2299358586
小黑,1,是这个雄狮吗？看着挺帅的,2022-01-05 22:30:24,2022-01-05 22:35:24,0,1,https://www.zhihu.com/api/v4/answers/2299257580
那谁家的小谁,3926,这两波人都不在一个频道上，骂的人说眯眯眼，宽眼距，夸的人说热血，积极向上，两帮人就是骂了个寂寞。单说这部电影，画面不错，配乐也不错，然后没了。人物造型垃圾，剧情垃圾，人物塑造也不行。关于人物造型，眯眯眼其实没什么问题，毕竟单眼皮小眼睛的人有很多，但是宽眼距和吊稍眼就很离谱，我们可以评价一个人长的不好看但是不丑，但电影里面的完全可以用丑来评价了，小眼睛虽然说没有什么问题，但全部都是小眼睛，这就是问题了。剧情是真的让人很头大，每次都要强行喝鸡汤来推进故事发展，像主角为什么要舞狮，看完了也不知道，就因为那女的说了两句话？他俩什么关系？相当突兀。换个省份，赛龙舟，扭秧歌也完全可以。最后赢了又去打工了，这真是舞了个寂寞啊。有些情节也是，可以看出编剧导演根本不懂行，踩狮头是什么行为，擎天柱把狮头干上去了，这是打篮球吗，灌篮高手？这部电影的技术是够的，编剧太差，没什么意思,2022-01-05 19:01:52,2022-01-05 19:01:52,0,1,https://www.zhihu.com/api/v4/answers/2299024295
匿名用户,0,去**的中国风眯眯眼什么时候成为中国风？外国人对你做眯眯眼动作的时候你难不成还要鼓掌欢呼说:你太了解中国文化了，全世界都在学习中国文化？舔就舔吧，还按着大家的头一起舔，贱不贱啊？一边说审美差异，一边又让所有人欣赏自己的“艺术”，好事都你占了呗。批评的就说文化不自信就说太过敏感，好家伙，文化自信也不是这么用的啊。感情那么多在外华人受了那么多年的歧视，你现在搁这说这是中国风？BBC，ABC看了都得直呼同志你好！以后用眯眯眼都不用怕被喷种族主义，因为这是Chinese culture？？！！先说，我是看过的，这部电影里人物形象不用眯眯眼完全不会对影片的表达效果产生影响。除了加上眯眯眼能让外国评委看着顺眼以外！！！,2022-01-05 12:44:21,2022-01-05 12:44:22,0,1,https://www.zhihu.com/api/v4/answers/2298474297
笑人,1,以前：没有调查就没有发言权。现在：我不听我不看我不了解反正你吹你就是收钱了。时代的眼泪,2022-01-04 17:00:20,2022-01-04 17:00:20,1,1,https://www.zhihu.com/api/v4/answers/2297495758
卜卜的故事,7,RH 这个词不知道是谁提出来的， 也许是偏执份子，也可能是反串的。  别说这个词 ，这样那些反串份子又要抓着这点不放，我看到的大多数言论，都是对于斜眼 眼间距，吊梢眼的批评。 没有上升到侮辱的高度。  作为一部面前大众的作品。 是不是应该考虑大众的审美。 当然你说是为了表现普通人，不追求千篇一律网红美。也理解。 没必要弄的这样，让人看着反感吧。丑有很多种方式， 像我看到的一个回答， 说这种眼睛比例，只会出现在《人兽杂交》这种限制电影里出现。 有兴趣的自己去查询这部电影。我以前看过，内容上让人很不适，长的也让人不适。  我相信 《雄狮少年》可能是部制作尽量的动漫电影。 因为这样的事票房不如意，却一点都不让人同情，甚至想笑。被自己的不知道是不是“小心思”还是决定“失误”反噬。 希望以后的作品。广告能更好。别用你们的高级审美来挑战大众的耐心。 ,2022-01-04 16:10:54,2022-01-04 16:10:54,0,1,https://www.zhihu.com/api/v4/answers/2297415803
知乎用户,91,我发现大多数回答都没抓住关键。还有部分故意带偏节奏的别有用心者。这是眼睛大小的问题吗？这是自信不自信的问题吗？这是人民群众自发对资本喂翔的抵制！这是你胆敢伍乳我，就要做好被群殴的表态！哪怕是苗头也不行！理客中，清醒人，自信人……我敢说都不是什么好人。至少不是站在广大华夏劳动人民这边的人。,2022-01-04 14:31:12,2022-01-04 14:31:12,0,1,https://www.zhihu.com/api/v4/answers/2297262371
菠萝叶子,4,资方应该学习下当年《大鱼海棠》片方的精神——躺平挨骂。大鱼海棠是雕成花的X，当年被唯美画风骗进去看的观众没几个出来不是在骂的。人片方也知道自己剧情差，买的营销也只敢吹主题曲好听。而雄狮少年是X雕成的花，最惨就是宣传PV里角色直接劝退观众，观众直接看都不想看。结果片方你？？？营销什么不好营销“高级审美”（大概方向的意思），翻车很是活该。后续操作硬杠观众更是把这“花”变成了“X雕成的X” P.S.话说国动是越来越拉了一首抓耳的歌都没出现过。,2022-01-04 05:52:22,2022-01-04 05:52:22,0,1,https://www.zhihu.com/api/v4/answers/2296754607
以后,0,收钱的还在用这种避重就轻的方式硬洗，那些所谓的争议点根本没必要在这啰嗦，因为在给人第一印象的人物外形上的刻意丑化你就是用硫酸洗也洗不掉，至于其他的争议点，还真没人在意，基本的外形是这鬼样子，还要大家理中客？骂人俩字都糊脸上了你还指望人说你有内在美。最后补充一点，哪怕这真是个好故事，也绝不允许用这种刻意丑化的形象来讲，想想前几年明明大家都觉得丑却还有人堂而皇之说是高级脸的，近两年才敢有人把高级脸＝丑的实话说出来，这次的雄狮少年只是更多人说实话罢了。再好的巧克力外面包着屎，也不会有人去吃的。,2022-01-04 05:12:01,2022-01-04 05:12:01,0,1,https://www.zhihu.com/api/v4/answers/2296749462
知乎用户,887,主要是最近一段时间国外实在没啥可以撕扯的素材了。只能是自己撕了。,2022-01-04 02:35:38,2022-01-04 02:35:38,0,1,https://www.zhihu.com/api/v4/answers/2296724212
匿名用户,0,之前没怎么关注这动画片，就只看见眯眯眼海报，我以为是美国拍的，毕竟花木兰的例子在哪里，花木兰的眼睛就是斜着吊上去的，但花木兰那种不过分，看着舒服，但这是国产的，雄狮少年我真的崩不住啊，看图片右边人的这侧脸，很像陈山这侧脸像吧，简直一模一样，不知道这动画片里人每个眼睛都这样吗，我是真的不敢苟同中国人要认清现实的这个观点的，我现实看见这种长相的很少,2022-01-03 23:54:55,2022-01-04 00:28:04,0,1,https://www.zhihu.com/api/v4/answers/2296636669
背后原因却很暖心,10,,2022-01-03 23:24:34,2022-01-03 23:43:03,0,1,https://www.zhihu.com/api/v4/answers/2296608758
轩辕十四,1,一场自卑与自信的冲突,2022-01-03 14:45:42,2022-01-03 14:45:42,0,1,https://www.zhihu.com/api/v4/answers/2296099148
无名氏,17,来解释一下，为什么好好的原版非要搞成这样,2022-01-03 13:11:38,2022-01-03 13:15:46,0,1,https://www.zhihu.com/api/v4/answers/2296002603
黑面包,24,无论是《雄狮少年》还是曾经同样引起巨大网络争议的《后浪》，其实都是表象。不管持着不同观点的双方，如何摆事实、上证据、讲逻辑，争辩到最后，只能去看他们的创作者在创作这类有争议的作品的时候，动机到底是什么。而这一点，只有创作者本人自己清楚，其他人几乎不可能得到一个最终的真相。所以这样的网络争议，永远也不会有一个最终的结果，永远也不会结束。但是跳出具体的事件本身，揭开表象之后，我看到的是，早已存在的，一些现实。毕竟，文艺作品，是现实的反映。它存在，关于它的争议存在，是因为某些现实，已然存在。,2022-01-03 12:19:59,2022-01-03 12:19:59,0,1,https://www.zhihu.com/api/v4/answers/2295954712
龚敏迪,327,“三只松鼠”说你可以不喜欢，但不要无限上纲。《雄獅少年》也被人说是迎合西方的感觉，究竟是否文化不自信的表现？小眼睛就不能出现在广告上吗？那也是爹妈给的，并非迎合西方才长成这样的，何必如此神经衰弱。,2022-01-03 08:45:14,2022-01-03 08:50:14,0,1,https://www.zhihu.com/api/v4/answers/2295740312
Pluviophile,508,不说zz问题，这主角是真丑，长得像那个唐氏儿，我估计三庭五眼都没长正常，光看一眼都感觉精神污染的程度就这长相，还要搬上大屏幕呢，别来污染我的眼睛了他和一些卡通画角色的丑还不一样，有些卡通画角色也丑，但是主要是因为夸张化的地方我get不到，迪士尼那些我统统get不到，但只是风格不对我口味，但是他这个我看了只想送他去医院动一个手术，整个人长得就不像健康人仨病人上大荧幕，还想挣我钱……我又不是扶贫……,2022-01-03 02:21:20,2022-01-03 02:42:08,0,1,https://www.zhihu.com/api/v4/answers/2295656940
何少言,3,玻璃心炸了呗，畸形社会的畸形人文生态，爆炸是迟早的事，就这才哪跟哪，还早着呢,2022-01-02 17:07:14,2022-01-02 17:07:14,0,1,https://www.zhihu.com/api/v4/answers/2295205760
Wilde,2,看了微博关于rh下面的评论，第一反应：跪了多久腿都直不起来了，还舔。后来想想人家兴许也知道rh，但这是门生意，吸引相似言论及想法的网友（粉丝粘性与热切程度远高于普通群体），然后进行变现（看到不少主页进去微商的）或单纯享受流量的快感，要么就是吸引异性资源（参考艹粉某伯爵）,2022-01-02 14:11:21,2022-01-02 14:16:22,0,1,https://www.zhihu.com/api/v4/answers/2295046678
知乎用户,99,各位有看过伊藤润二漫画吗？双一系列有个布制教师的，这眼睛简直一模一样了,2022-01-02 12:17:13,2022-01-02 12:22:13,0,1,https://www.zhihu.com/api/v4/answers/2294944240
匿名用户,0,哈哈哈查了一下票房投资和背后公司背景股市变化，现在我不想知道网络骂战问题，你们骂有什么用啊，我主要想知道一个需要八亿回本现在票房刚过一亿的电影哪里来的自信，股市还看起来离谱的不错，票房变化更是午夜飞翔式，现在我不关心网络了，我关心这是哪里来的钱，哪里来的人。一亿票房十六万评论，旁边二十几倍票房十四万评论，我真不关心这口水仗了。——————现在想来我对这个动画没有好感其实就是挺恶感的了，我对我家附近的传统文化无感这应该就是最大的问题了吧，一部打着弘扬传统文化旗号的电影，传统文化当地人没有共鸣，也是挺厉害的。看完了就觉得除了背景和人物肤色，居然没觉得有啥熟悉感，内核还是外国那一套，没味儿，看完了记不住，鸡肋。——————我个人对这个动画观感非常普通，没有好感也没有恶感，就是一个传统合家欢类型的逆袭动画电影。画面做得很不错，故事很寻常（想起大鱼海棠，那个是真画面惊艳剧情？？？）。但是我认为我可以理解这场网络骂战发生的双方。老实说我认为这不是动画的问题，这是宣传和人物形象设计的问题。这部电影最不幸的是技术人员和编剧，本来想挣份安稳的大钱，不想宣传和人物设计部个顶个拉胯，我都怀疑里面有内鬼。如果说国产动画➕传统主题是这个特别时代的赚钱利器，那这两个利器加分加到85，细腻的画面技术又加上10分，眼看着冲百了，宣传和设计一把拉到30，本来中规中矩都至少95了，你非往歪路走，那咋整。首先，内容仍然俗套，当然动画片都这样，逆袭嘛，对吧，平常的话也可以接受，但是同时形象做得丑，那就没办法了；再一个，丑还踩敏感线，那未知全貌人群（指可能只是看了一些部分的人，没有贬义，毕竟宣传就是让没有看的人去看，他这个宣传做的，仅仅是让没有看的人觉得不适罢了）不冲你冲谁啊？接受采访还那个样，知道的知道你是卖货的，不知道的以为你债主呢。我真是服气了，做宣传的人是有什么问题吗？没给够钱？还有最初设计人物形象的人和那个大言不惭“我们家人都长这样”的那个，我就看你虽然长得也不咋地比较普通（没有贬义）也没长成那样啊？眼间距那——么宽，眼角那——么吊。但凡你稍微有那个意识在使用夸张手法的同时规避一下这个敏感问题，你这电影也不至于掉进这么一个舆论漩涡。这些参与设计还觉得挺不错的，真实脱离现实，感觉专业能力也不怎么过硬，毕竟动画形象设计原则里首先就有：符合受众心理要求，合情合理，符合大众审美，还有一个要正反派分明，毕竟是动画片。你这个丑连丑萌我都没法昧着良心算。怎么说呢，一饮一啄，莫非前定，世界上有的是做了100分努力因为一点小破事前功尽弃的，没办法。,2022-01-02 10:58:33,2022-01-02 17:59:48,0,1,https://www.zhihu.com/api/v4/answers/2294868190
zch五世,0,这部电影说它rh就过头了，毕竟官方参与发行。造成目前这种争议只能说官方对民众的了解太脱节，我相信官方当初也是看重雄狮少年的立意什么传统文化，留守儿童，励志啥的，只是没把握好民意翻车了。至于这部电影扑的不冤，不管rh不rh你整一这么丑的形象，观众无法带入啊，无法共情怎么贡献票房?我看很多人那什么审美，创作说事，你们说的都对然后呢？老百姓不买账啊，电影是商业，卖不出票就是原罪，经过这件事情后你看看还有没有头铁的制作方敢这么设计形象。说白了雄狮的翻车是精英对民众的傲慢，以前这些文艺精英整啥观众看啥，说谁是高级脸谁就是高级脸，现在老百姓有钱了借着互联网发出自己的声音而已，想挣老百姓口袋里的三瓜俩枣就老老实实的按老百姓的审美拍,2022-01-02 10:13:59,2022-01-02 10:13:59,0,1,https://www.zhihu.com/api/v4/answers/2294825264
未知的未来,51,阿猫，阿狗，暗示大多数人都是阿猫阿狗。毕竟正常的电影谁会给主角取这种名字？眯眯眼是某人塞私货的行为，当然这些人肯定也明白眯眯眼是什么意思。网上舆论的反对眯眯眼是正确的，因为再不反抗就完了。,2021-12-30 11:28:56,2021-12-30 11:28:56,0,1,https://www.zhihu.com/api/v4/answers/2291616609
YumNope,822,这是整哪出呀我应该没按错吧,2021-12-29 23:48:43,2021-12-29 23:53:43,0,1,https://www.zhihu.com/api/v4/answers/2291192083
汨昜,8,,2021-12-29 14:07:50,2021-12-29 14:12:50,0,1,https://www.zhihu.com/api/v4/answers/2290473720
细辛,1518,,2021-12-28 09:03:04,2021-12-28 09:08:05,0,1,https://www.zhihu.com/api/v4/answers/2288595572
imShannon,10,这部电影我看过很喜欢，国漫很强，这一次主人公不再是哪吒悟空这类大题材了，而是身边每一个留守儿童，结尾跳擎天柱那一段我不是很懂，阿娟突然化身成了一头雄狮，这是浪漫主义手法吧，电影好像也没有公布红白狮谁是真正意义上的胜利方，不过阿娟不可能跳过擎天柱，因为片中不止一次地提到了擎天柱的意义就是提醒每一个舞狮人：山外有山，人外有人，所以阿娟最后很可能在一跃而起后重重地摔在了水里…… 舞狮成功与否，生活都将继续，放弃不切实际的幻想，留守儿童只能继续为生活奔波，我想电影甚至为此做了一定美化，宽慰每一个为生活而搁置梦想的人：只要鼓点还在心中响起，我们就是雄狮。该片的地域文化特色很明显，我国每个省都有不一样的特色，如果都能拍成电影，也不失为一件宣传乐事，我只看我想看的东西，这就是一部很正常很精彩的国漫，文化多样性，思想多元性固然重要，相反正因为有了言论自由这样的权利，我们才更应该好好思量：在公共平台所说的每一句话是不是传播了不好的舆论导向，自媒体社会不要忽略每一个人的影响力。,2021-12-30 01:19:57,2021-12-30 01:19:57,0,4,https://www.zhihu.com/api/v4/answers/2291250657
