author,fans_count,content,created_time,updated_time,comment_count,voteup_count,url
人造海,5032,说个关于判断力的问题。对善意还是恶意的判断力。这是一种直接的，重要的判断力，不能交由别人，只能靠自己。很多人会讲一堆故事 ，会说这是对大家有意义的事情，对你好的事情。然而，说再多，也暗藏不住那种恶意。虚伪，狡猾，这是所谓高素质社会经常玩的一套，因为在不发达社会，恶意往往很直接，但是文雅化，规训化以后，不是说就变得很善良，没恶意了，而是学会了伪装和修饰，藏的好，藏的有套路，把恶意表达出来了，挣了你的钱，还笑你们这般二百五，不就是被我们忽悠吗。就像某些港台盲流经常把质素挂在嘴边，其实心中毫无善意。面对恶意，哪怕伪装再好，也必须回击，有时候欧美闹事的那般比我们做的好，不管你是直接的歧视，还是伪饰起来的，我就是闹，一闹破万法。也是那种环境下的一种生存和斗争经验。华人社会大概是做题家路径依赖太重，反而对这种事情还要先辩一辩，内部先闹起来。啥审美多元啥的，长相自由啥的，这些问题，倒算是问题，但这里根本不是让你去讨论美的可能性啊，就是识别恶意的问题，这是不是恶心你，恶心你们，你心里没数吗？难道真自以为读了几本书就比普通人更懂了？,2021-12-29 19:28:21,2021-12-29 19:28:21,2,9,https://www.zhihu.com/api/v4/answers/2290935610
生如夏花,1408,相关行业。我朋友圈里不少同事都转发了这部动画给其助势。我个人持负面评价。我没去看过这部动画。抛开剧情来说，这部电影的导演组我觉得没有搞清楚一件事。当你的作品要面向大众，或者说面向平台。你一定程度上都会起到影响他人的作用。这也是我们政府比较关注的方面。换句话说，你自己小打小闹，真的没人去关注你。可你既然想捞钱，那就别去碰这些让人联想的红线。越过了，总会让人产生某某某的即视感。吊梢眯眯眼你觉得不怎么，是大家玻璃心，确实，你可以这么说。但问题是西方文化拿它跟乳化绑定啊，还由来已久。眯眯眼，口音协同，面向平哪个不是？说的好听是无心之举。说的难听就是给敌人提供舆论文化阵地。还有迪士尼也搞这种东西。那个寻龙传说，那条龙，以及配音的演员，不是我人身攻击，真的就挺扯淡的。还出演了尚气。你要是有演技我也不会说你什么，但可惜，从头到尾都没见。扯远了总之，雄师少年，美工和故事立意真的烂太多。,2022-01-05 17:07:10,2022-01-05 17:07:10,0,1,https://www.zhihu.com/api/v4/answers/2298874109
si zhao,6867,争论的观点只有一个，广东人是不是就长动画片里那样，中国人是不是就长动画片里那样导演自己说的 创作的时候 想的是 创作人照镜子看 是不是电影里的人跟镜子里的人一样结果就是，导演以为中国人就长这样，但国人不认可这个审美观点所以就骂街，尤其是广东人骂的最狠，因为导演创造的是广东人的动漫形象改变不是乱编，戏说不是胡说，把广东人画成这样，广东人骂街我觉得合情合理商业片 跟观众作对 没丢臭鸡蛋打他 只能说动画片没有主创上场的传统不然回家卖鸡蛋说不定能发家致富,2022-01-04 14:29:00,2022-01-04 14:29:00,0,0,https://www.zhihu.com/api/v4/answers/2297259301
冬瓜头怪兽,1003,什么是审美的自信？一、审美矛盾的产生眼睛小，眯眯眼，甚至有点吊脚，这种眼睛，周围有没有？有，而且经常能见到。但如果每个人都是这样子的呢？这就是绝对的脱离现实，来到了一个抽象的境地：画面里每个人都有这样的眼睛，说明是观察者内心看到的场景也就是说，导演希望观众的视角里，每个人都是这样的样子，他认为这代表了“美”，代表了能够让观众愉悦的形象。但我们说审美的自信，导演有他关于“美”的自信，观众当然也有对于自己审美的自信：很多观众对于“美”有自己的见解，认为这样的角色形象完全不美。于是乎审美的矛盾产生了。这个矛盾就表现在“高级审美”这样一种说法中，似乎普罗大众的审美就是低级的。二、审美的多样性先说一下审美有没有高低贵贱之分。先进生产力对应先进文化，而落后生产力对应落后的文化，本质上是有高级和低级之分的。我们看到劳动妇女穿着工鞋在厂中劳作热火朝天，再看封建妇女用布条绑出的畸形小脚走路都走不成，审美的高级与低级一下子就对比了出来。而大多数人的眼睛作为天生形成的器官，本身就是自然的，无关生产力的发展程度，因此吊脚眯眯眼本身不具有“高级”的说法，跟其他类型的眼睛都是一种类型。而另一方面，审美是具有多样性的，你喜欢苹果我喜欢梨他喜欢葡萄，这样的审美再正常不过。但是如果一个果盘里只有苹果，那不喜欢苹果的人骂两句当然再正常不过。更别提，当那种事物和一些不让人愉快的事情结合在一起，比如给黑人端上满满一盘西瓜而没有别的水果，自然就会让那个黑人感到冒犯。基于这样的分析，导演有自己的审美可以理解，但因为导演自己的审美而把所有的角色都采用这样的审美，就像上面的那个比喻一样，就变成了恶心人。三、文化与审美不同的文化氛围会孕育出不同的审美。文化与审美是密切相关的，我们倡导健康，多元的文化，因此“楚王好细腰”的故事听起来就非常的滑稽可笑；社会在前进和发展，因此伤痕文学在文革结束后有过大火，之后也陷入了沉寂。每个时代有不同的文化，就会有不同的审美。而用吊脚眯眯眼指代亚洲人物形象的文化，在中华大地上从未出现过，只有在欧美地区才出现过，因此电影里的做法，无疑是导演受到了欧美文化的影响和冲击，才会是所有角色眼睛都长成那样。四、文化与审美的自信真正的文化自信和审美自信，是对于中华民族原生的，现有的文化的推崇与发扬。不是兼容并包，不是盲目排外，而是取其精华去其糟粕。我们的文化里，容得下每一个中华儿女，但容不下偏见和傲慢。审美自信不是说别人的谩骂和歧视我们都能够容忍，而是我们既能够“以直报怨”，又能够“以德报德”。欧美鬼佬用“东亚病夫”来侮辱中国人，中国人不迎合他们，而是用拳脚踢碎那块牌子；欧美鬼佬用吊脚眯眯眼来侮辱亚洲人，某些中国人偏偏把角色全部弄成吊脚眯眯眼，错了，分明是应该用好的剧情，好的画面和富有东方美感的人物去踢碎鬼佬产生自文化的偏见，而且还要打败功夫熊猫讲一个中华文化内核的故事。所以，《雄狮少年》的导演该被骂，他觉得吊脚眯眯眼具有“真实感”，完全可以给个别角色配上那样的容貌，而其他人也各有千秋。一边说“真实”，一边把所有角色的眼睛弄得千篇一律丧失真实，这是双标，这是自取其辱。而那些嚷嚷着要“文化自信”的人，吊脚眯眯眼从来不是我们中华文化中的主流审美，何谈文化自信？商业电影不尊重观众的智商和审美，喂屎被骂不是活该？,2022-01-02 13:39:48,2022-01-02 13:39:48,7,2,https://www.zhihu.com/api/v4/answers/2295019101
鱼北冥,69,这根本不是审美的事，跟丑不丑化没关系。眯眯眼为啥被抵制？因为丑？完全是顾左右而言他。这种眯眯眼形象是一个符号，它被厌恶，被抵制，是因为符号本身的含义。是因为有人将对中国乃至整个东方的歧视、偏见、奴役整合起来，通过建构眯眯眼这样一个符号来呈现。就像“支那”，本身是中性词，中国古籍中也用过，但因为近代这个词逐渐成为侵略者对国人的歧视性称呼，它目前也成为了一个承载着歧视和压迫的符号，需要更加谨慎的使用。我们讨厌眯眯眼形象，不是因为它丑，而是因为当有人使用这个形象的时候，我们有充分的理由认为这个人在表达眯眯眼形象所承载的，对中国人的恶意。就像侵华日军的军服和太阳旗，就像纳粹的万字标志，就像三k党的装束，我说我抵制这些符号，你说这些符号不丑？你怕是有啥大饼。这破电影要么坦坦荡荡辱华，投入白皮爹怀抱，要么承认自己在民族问题上的迟钝和无知。跟这儿搞啥美丑之辩，说得好像网友不懂审美似的，你阴阳怪气nm呢！就像一个中国人生病了，我说他是东亚病夫，而且翻开词典告诉你，我这词用的没错，从比义上讲，东亚病夫就是可以指生病的东亚人，难道东亚人都不生病？？？？？？？“倪哥”这个词，本来也是个学术用语。“尼格罗人”和“蒙古人”、“高加索人”、“盎格鲁撒克逊人”一样，就是单纯的人种名。但是这个词在使用过程中，被建构成一个承载歧视和压迫的符号，所以黑皮老哥们不管三七二十一，宁可错杀一千，绝不放过一个，直接把这个词给冲臭，冲烂，冲得一众昂撒大儒噤若寒蝉，把“倪哥”冲成“n—word”，把“black English”冲成“AAVE”，把“黑人”冲成“非裔美国人”，冲出个TMD黑命贵如我所愿！反观批乎上一群辩经人，摇唇鼓舌，狺狺狂吠，真是从未见过如此厚颜无耻之人,2022-01-02 14:32:19,2022-01-02 14:32:19,1,16,https://www.zhihu.com/api/v4/answers/2295065923
杜小凡,9632,咎由自取。其实我也很疑惑，通过预告和很多人的批评与支持来看，这部电影肯定是精心之作，而不是粗制滥造。但是既然是精心制作，为何在这种细节的地方不多花点心思？就算不取悦观众也不用恶心观众吧，国内关于这方面舆论又不是最近一两年才出现的，但凡会上网都会知道然后选择规避。为了这么点细节把其他精心制作的内容变成白费功夫，得罪观众更别说赚钱了。然后我看到导演说得到国外某奖项关注，我有点明白了。赚钱不重要，获奖才重要，名有了，利自然也就来了，就跟陈凯歌一样，一部电影的名声能吃好久的收益。奖是外国人的奖，那你中国观众喜不喜欢不重要，外国人喜欢就行了。,2021-12-30 08:43:24,2021-12-30 08:43:24,2,2,https://www.zhihu.com/api/v4/answers/2291364245
彩云飞,1,  没有骂战，只是大家团结起来骂《雄狮少年》而已，主要是人物形象太丑了，就是不扯到“眯眯眼”上，这些个人物形象也太丑了！  就说上面这幅图的眼睛，丑不丑？ 其实对于眼睛的描述自古以来还是挺丰富的：杏眼，吊眼，柳叶眼，狐狸眼，铜铃眼，桃花眼，瑞凤眼…  上面这幅图应该是丹凤眼吧，难看吗？不难看！    就算是古人单眼皮居多，自古以来的传奇画作人物都是丹凤眼，那也没有这么丑的样子！     审美是随着时代在变的，好歹跟上时代的变化，这丑出天际了，怎么能不挨骂！  再说回“眯眯眼”，为什么国人不喜欢这个东西，就说这几年的所谓辱华的外国文学作品，哪一个不丑到恶心，服饰到妆容都让人恶心，能说我们国人玻璃心吗？为啥迪士尼动画版的《花木兰》没人骂？一样是丹凤眼，但整体看起来就是自然又好看！     现在的国人，自信又包容，好看就是好看，不好看就是不好看！,2021-12-28 19:18:21,2021-12-28 19:45:00,16,7,https://www.zhihu.com/api/v4/answers/2289527916
知乎用户,876,有一说一，我觉得制作组真的未必觉得自己丑化了谁，因为他们的思想和审美早已经西化了。你们看看欧美动画片，有几个角色长得好看的？说起来我早就对我国这些动画感觉不满了，那些质量真差的就不提了，就说从大圣到白蛇，从哪咤到姜子牙，有哪个角色有多好看呢？都是那种夸张脸，或者高级脸，高鼻深目，没有一个真正符合东方审美的。当然，主要是我国动画这些年没有形成一种新的风格，太唯美了可能就奔着日式去了，真实系就奔着西式去了，所以用什么画风代表东方审美可能还需要长期探索，目前唯一能确定审美是否对味儿的大概只能是XP系统是否能被唤醒吧。,2022-01-02 12:08:10,2022-01-02 12:13:10,0,1,https://www.zhihu.com/api/v4/answers/2294935249
知乎用户,27,简单概括：甲：“草泥马”乙：“你侮辱我！”理中客：“乙歧视女性！女性就没有性自由吗？令慈不能和别人发生性关系吗？”----逻辑其实很简单对不对？当一个人对你说“草泥马”的时候，和你的母亲并没有任何关系，只和你有关。,2022-01-03 21:20:15,2022-01-03 21:20:15,0,0,https://www.zhihu.com/api/v4/answers/2296480538
法国面包,211,雄狮少年剧情没看过不予评论，但是针对一下那些说审美应该多元化的人：迪士尼舞台剧贝儿公主 黑人大码LGBT成员Jade Jones扮演迪士尼音乐剧版《美女与野兽》的贝尔公主，导演：“打破了标准，是最新的经典迪士尼公主”如果你觉得审美也可以这样多元化，当我没说。不过话说回来，动画里的人物造型可以是多种多样的，这点无可厚非，并不需要拘泥于一格，如果不是别有用心刻意为之的话。,2021-12-31 01:07:28,2021-12-31 04:13:28,2,3,https://www.zhihu.com/api/v4/answers/2292580366
竹蜻蜓,74,一开始我以为是水军引流。后来再看看这热度，发现真的是有一大批人是真心实意的喜欢这个烂片的。让我想起刚刚开始有批评声的时候，我看到了一个帖子。大意是说我们这样批评这个片子，到时候人家真的在国外拿奖拿到手软，就知道自己错了。我想这个帖子很好的体现了那些认可这部电影的人的心态。而这样的心态，说实话确实不是一时半会能够扭转过来的。没办法，让他们跪着吧。14亿人的国家不出几个傻X，你以为你是在天堂吗？,2022-01-05 13:15:37,2022-01-05 13:15:37,0,1,https://www.zhihu.com/api/v4/answers/2298514188
知乎用户,3084,人民群众不喜欢，他们就想强行让人民群众喜欢，人民群众依旧不喜欢，并且表达了这种不喜欢，这叫网络骂战？格局小了。这不是骂战，这是意识形态争夺战。本来吧，如果不是《雄狮少年》非要强行营销，吃相难看，主创团队各种让人摸不着头脑的操作，比如让你们去照照镜子，强行解释吊眼角眯眯眼的行为。也不会有什么大事。但是，事情闹大了，让国民意识觉醒，发现竟然还有其他品牌也使用了这种有辱东亚人的眯眯眼，吊眼角妆容。这就挺好的。《雄狮少年》从另一个角度唤醒了国民意识，也让更多人知道到了这种眯眯眼造型就是西方昂撒人对东亚人的侮辱，这何尝不是一件好事。不惜让票房扑街，真是多么伟大的国际主义精神啊。,2021-12-29 11:54:40,2021-12-29 11:54:40,3,20,https://www.zhihu.com/api/v4/answers/2290290365
囧叔,191522,很遗憾今天才看完《雄狮少年》，关于“眼睛”的网络骂战，从上映争议至今。要我来讲，关于人物普遍“眯眯眼”的设计，其本质还是“动画创作上的极不自信”。详细的来讲，弘扬舞狮文化没问题，但是“脸谱化”一个多民族大国是有问题的。这也就是整部《雄狮少年》的引起网络骂战的争议所在。主创人员在二次元人物创作中并不自信，刻意的反美、日动画脸谱后，又掉入了西方刻板印象的“陷阱”。单从动画电影角度上来讲，主创人员低估了中国观众在动画电影上的审美提升，或者说，中国观众对动画电影的要求越来越高，传统的迪士尼、日系动画，已然无法满足中国观众对这个世界“所需要的”的认知：这个世界的一切，是多元的，单一价值的输出，是对这个世界不负责任的表现。基于此点，《雄狮少年》无论是故意还是没有跟上观众审美，脸谱的单一必然触及到中国观众的逆鳞。这个世界，从来都不是只有一种答案。《雄狮少年》不会是个例，他只是一个开始，在未来的数年内，除了动物类动画外，但凡涉及到中国群像的院线动画，在脸谱问题上，他都将面临着，“若不多元，必将批判”的窘境。这种现象或争议的出现，对中国动画来讲，我认为是一件好事。中国动画和中国观众，正在重新找回一条属于中国动画自己的道路。这条道路从不是指创作上的“中国学派”，而是创作自信、观众自信、文化自信下的“中国学派”。比如针对《雄狮少年》的“小眼睛”问题，有知友举例了《天书奇谈》中的袁公和蛋生。用以说明早前“中国学派”的动画，并非只有“眯眯眼”这一形象。其实这个问题可以以《天书奇谈》为例继续深挖，比如老狐狸一家，其脸谱特征就是非常多元的。我们可以鄙夷“中国学派”的市场效益，但是我们一定要认可“中国学派”对自我文化的自信。我们把时间线拉到1979年的《哪吒闹海》，这部有着“弑父”意义的动画作品，也都非常自信的展现着多元化的审美。哪吒、太乙真人、李靖等人，在眼睛和形态上都各有不同，其本身就展现着中国这个多民族大国的包容性。太乙真人和哪吒这场观众对《雄狮少年》的“脸谱”批判，其本身是对创作者的桎梏批判。舞狮文化是好的，是民族的，是国粹的，是我们每一个炎黄子孙所认同，它从始至终都不会是我们观众的对立面。但是非要把脸谱化的“眯眯眼”和舞狮文化混淆在一起，这个行为其本身是非常不自信的。《雄狮少年》里的一句台词形容这个，也可说在合适不过：病猫那么《雄狮少年》这部电影有值的称赞的地方吗？当然有，比如开篇用了五条人的《道山靓仔》，结尾用了九连真人的《莫欺少年穷》做配乐。五条人（左）、九连真人（右）五条人和九连真人的音乐都有着强烈的叙事性，所歌所唱的故事，都游走在边缘上，社会的边缘，思想的边缘，不受主流待见的边缘。前者会在插科打诨中，暗戳戳的挑战着这个世界。后者会挺起胸膛，回到一方故土，享受只属于自己的欢愉。这些为阿娟等人的际遇加了不少分，加着，加着，越加越多。所以，《雄狮少年》从配乐的选择堪称上乘，但可惜的是，五条人和九连真人歌曲上的叙事，似乎要比这部动画电影好一些......,2021-12-29 01:55:22,2021-12-29 02:14:49,115,164,https://www.zhihu.com/api/v4/answers/2289887977
知乎用户,19099,哪个正常的普通人长这样？导演话里话外的含义：你们普通人就长这样。不好意思，我就是普通人，我不长这样，我认识的人也没谁长这样。继续洗吧。,2022-01-01 14:35:11,2022-01-01 14:40:12,0,4,https://www.zhihu.com/api/v4/answers/2294121091
沧海已为雨丶,1,关于这部电影人物角色的外貌，有什么好争论对错的呢？导演制片人去广东，或者中国哪个地方都行，去小学，中学，镇子，村庄只要能找到五六个在一起玩耍，一起生活的小伙伴，注意必须得是真的好朋友且没有血缘关系，都是眯缝眼，吊梢眉，宽眼距集合于一体的少年，然后拍个几分钟的纪录片当宣传片，我就说你这个电影绝对没有叠buff绝对现实。或者追求在高一些，去各地舞狮少年队里找，看能不能找到三个集这三点于一身的少年。导演不是说在广东走街串巷好几年，深入了解当地舞狮民俗文化么，人物形象完全贴合身边真实人物不加滤镜么？那怎么不在了解的时候拍一些纪录镜头，然后在舆论风口放出来让大家看到证据呢？你现在去找也没问题的，也能让观众无话可说啊。找到了谁还会对人物形象吐槽呢？,2021-12-27 23:57:33,2021-12-27 23:57:33,0,9,https://www.zhihu.com/api/v4/answers/2288414292
orchimike,6706,反正我没看过弘扬舞狮文化是出场踩狮头起单腿踢人，拿了狮王没办法生存得去上海搬砖这种表现手法。,2022-01-01 14:10:51,2022-01-01 14:10:51,0,3,https://www.zhihu.com/api/v4/answers/2294100451
圆元垣,2051,首先，“眯眯眼”这个事情不是中国人自己挑起来的，原先其实没多少人知道国外用这个辱华，国人知道是因为近年不少外国人挑事，用这种“眯眯眼”的方式搞种族歧视，我们才发现：哦，原来这是在骂我们。之后才会对“眯眯眼”这个形象反感。所以起因不是国人“玻璃心”，是国外本身就有恶意。《雄狮少年》不知道什么时候拍的，但是你把人物做成“眯眯眼”的样子，还要往国外送，是什么意思？观众不满意，你认个错，改一下建模重新上映也可以，非得教训观众是什么操作？这阵骂战，《雄狮少年》制作组要负主要责任。另外，不早说什么眼睛小不配当中国的话？除非你真的觉得，中国人全都长这样，中国人以“眯眯眼”为美。,2021-12-29 08:21:42,2021-12-29 08:21:42,4,2,https://www.zhihu.com/api/v4/answers/2289975432
一人一口酥,2294,电影很好看，豆瓣打了满分。可惜了美术设计没有避免被伪“高级感”洗脑，且完全不照顾国民感情和正在风口浪尖上的社会舆论，非要照着搞个吊角眯眯眼，引发巨大的负面舆论。可惜了。,2022-01-02 22:07:10,2022-01-02 22:08:31,0,0,https://www.zhihu.com/api/v4/answers/2295471036
extinctromance,1,雄狮的瓜，大众难得一致的站对了边。因为个人感觉这个问题不用过多解释吧，这是一个中国人乃至亚洲人，都不能认可的行为，更何况人物，夸张到那个程度。经常在Azar上连人遇到比“眯眯眼”说歧视言论，80%都是欧洲人，不会真有人觉得西方人的亚洲审美是眯眯眼吧，就算有，那也是个别，少到不足以支撑数据，与其说是审美，不如说是欧美人在中国人脸上吐的痰，边吐边说，你看这个是中国人，因为他脸上有痰。这本就是个莫须有的东西。这一口痰现在被中国人亲自画在了脸上。本来就是欧美动漫对亚洲人的刻板印象甚至上升到歧视也不奇怪，这种印象来源于19世纪的极端民族主义，为了煽动“黄祸论”把中国人刻画成西方反派细长的“吊眼”形象，这种形象可以保留在大众审美或出现在文艺作品里，但不代表中国人要完全认同这种审美，追根溯源本质上的来源就是对亚洲人尤其是中国人的歧视，因为如果没有极端主义那便不会延伸出这类形象。那些认同“眯眯眼”为丹凤眼的人，只不过被西方错位的带有歧视的审美牵着鼻子走了。其次是这种行为出现的动机不对，如果说这是西方人的刻板印象，作为国人，不应该接受宣扬这种带有极端民族主义的刻板印象，哪怕它是没有恶意的。这世界只有一种美，本源的美，自然的美，没有任何标签的，自我但不会侵犯他人的美。,2021-12-28 02:39:08,2021-12-28 02:39:08,1,4,https://www.zhihu.com/api/v4/answers/2288487104
许广新,50511,其实任何一个作品，都想获奖这本无可厚非但是各种原因加持下中国文化艺术目前的话语权不及欧美也就是北京电影节的大奖不如蒙特利尔电影节所以电影什么的就想弄个国外大奖但是吧，想在国外弄大奖，要么就有足够优秀的东西霸王别姬卧虎藏龙都是这个路子如果能力不行那就只能投诚中国飞速发展得大前提下欧美是乐于丑化中国人的眯眯眼就是其中之一其实中国觉得眯眯眼不好看美国英国也觉得眯眯眼不好看不过他们希望让全世界都觉得中国人长那样子所以那些模特，那些广告，那些电影包括但不限于雄狮少年都是眯眯眼所以这种电影获得各种大奖可能性更大毕竟，你戳不戳他脊梁骨不影响他买房买车但是投诚欧美弄个蒙特利尔电影节或者巴塞罗那影视学院大奖就可以回家恰烂钱了,2022-01-05 00:46:05,2022-01-05 00:46:06,0,2,https://www.zhihu.com/api/v4/answers/2297985536
