author,fans_count,content,created_time,updated_time,comment_count,voteup_count,url
酩酊不醉,7828,《雄狮少年》无罪了？人民日报给“眯眯眼”一锤定音：一事一议隔夜说动漫要说今年12月的网络舆论是怎样，那我只能用一个字来形容---吵！至于为什么这么说，那就跟27日、28日当天的微博热搜上接连爆出的眯眯眼话题有关。一个是“三只松鼠的广告模特”，另一个是“奔驰的广告模特”，这两个话题的上榜再度引爆了一场关于眯眯眼的讨论。打开腾讯新闻，查看更多图片 >这下可把大家都给气炸了，竟然会爆出这么多带RH性质的事件，也让“眯眯眼”这三个字被大家放到了话题的焦点上，引发了新一轮的争议。不少网友都纷纷留言，把自己的不满情绪全都打在评论区上。在这样的舆论环境下，一些人不禁又联想起了不久前上映的一部国漫电影，它的名字就叫《雄狮少年》。该片自17日上映以来，就一直陷入两极分化的状况，虽说这种现象在影视界里也不是什么新鲜事了，但是《雄狮少年》涉及的问题却尤为突出，其原因无别的，不过就是里面人物形象有眯眯眼的倾向，故被大家质疑影片是在丑化国人。然而央视媒体对此则是点赞与好评，称该影片正面弘扬了中国传统文化，是一部非常不错的优质国产动画。可网友们却丝毫不接受来自官方的认可，坚称丑化就是丑化了，没得洗！对于官方媒体以及部分意见不同者的看法也是全然不接受、不想听。而就这段时间发生的事情来说，双方的争吵或将进一步加深，最终也让《雄狮少年》被全网正式打上RH的标签。只是，你们恐怕还不了解一件事情......《迪迦奥特曼》被下架的时候，那些举报者也是跟你们一样的想法，认为这部作品有问题就是有问题，必须要联名抵制！01.观点与立场9月下旬的时候，《迪迦》因不明原因无故在全网平台下架，由此引起了广泛热议，具体是因为什么事情或理由也没有通知，全网也是一片哀嚎。但是我想在那时候有一群人可能会很满意，你说那些人是谁？就是那些经常举报动漫的家长啊。早在今年4月份，江苏消保委曾发布过《动画领域侵害未成年人成长安全消费调查报告》，包括了《迪迦》、《伍六七》、《柯南》、《斗破》、《熊出没》、《Re:0》在内的众多作品均被点名。其中《迪迦》所涉及的“暴力犯罪元素”问题点数量有43个，占比全剧集的34.9%，除了奥特曼日常打怪兽情节外，还涉及持械殴打、多人恐吓、纵火爆炸等暴力情节。当然了，这些在我们眼中全是胡扯，小时候我们不也经常看《迪迦》吗？结果也没见人家说自己有什么不良行为，不照样是健康长大吗？但在家长眼中可不是这么看的，在他们的思想里，这些看似无关紧要的东西全是有害孩子身心健康的，既然看到了那就不能坐视不管，不能让这些“不良动漫”祸害祖国的花朵。很不可理喻对吧，但他们就是这么认定的，任凭动漫迷如何反对也没有用。在下架的几天后，《迪迦》又重新回到了大家的视野中，当我们打卡一看的时候，果然还是被删了点内容。像美尔巴用嘴戳爆巨人石像的头部、丽娜开枪退弹夹、女巫基兰勃有关小孩梦想的台词、宿那鬼弹出手脚、吸血鬼吸血和露出尖牙的特写、正木敬吾痛揍大古等一系列大小情节都被删去。尽管对正片剧情是没什么影响了，但是观看体验有影响啊，看着画面情节突然跳了一下，直接快进到了下一个内容中，你说会不会有点懵呢，总感觉有哪里对不上呢，反正就很奇怪。所以说，就很烦那些“家长们”整天盯着这个盯着那个来看，一有些什么不妥就记下来，到时一起送到有关部门举报，网友们的呼声他们根本看不到、听不进。这个情况，不就跟咱们现在对于《雄狮少年》的态度很像吗？央视和影评界都认为它是今年不可多得的优秀国漫电影，但网友却依然抓着那个“眯眯眼”不放，就像“一颗老鼠屎毁坏整锅粥”那样认为这部影片已经烂透了。说不好听点，这种固执己见的想法和态度，有时不就像俗话所说的---活成了自己曾经最讨厌的人的样子吗？既然老一辈的人刻板偏见，那我们不希望自己以后也变得和他们一样，那就不要学他们那样用先入为主的观点去看待事物。我明白，大家对于《雄狮少年》会有这么强的抵触情绪，除了角色的“眯眯眼”形象问题，还跟网友们因为之前的事情怒气未消有关。有人说，那些人都是一丘之貉，故意来“夹带私货”恶心咱们，包括这个《雄狮少年》也一样。不，朋友，这两者的问题完全不一样的好吧，甚至根本就不在一个问题点上。02.偏见与对错早在今年下半年，国内就发生过两起相关的事件，如六月份清华美院全员眯眯眼走秀，还有11月份上海展会又出现了陈漫的摄影作品，这两次事件的出现相继引发了广大网友的热议和批评。而电影《雄狮少年》便是在这种微妙的舆论环境中上映了，由于影片角色有着与争议事件类似的元素在内，这让网友们还没完全平息的怒气再次被点燃了。小眼睛、吊梢眼、宽眼眶，这几个特点在网友的观念中就是丑化，大家能不生气吗---外国人用眯眯眼来羞辱我们，怎么连自家人也要这样对我们？一遇到这种情况，大家就很不淡定，老是觉得处处被针对了一样。我理解大家的不满情绪，但有些边界的事情我们得说清楚。为啥说雄狮少年就不算丑化呢？这你就要看看故事的内容和设定了。电影的主题是舞狮，故事的核心主旨也是宣扬醒狮文化等民间非遗传统艺术，在这一点上影片内容明显是充满了正能量，与前面那两种艺术相比就是天壤之别。然后就是眯眯眼问题，严格来说雄狮少年并非全部都是眯眯眼，实则也就主角阿娟与好友阿猫有这样的特征，其设计目的也是为了对应他们“留守少年”的人设。作为一个在农村长大、不去读书、整天浑浑噩噩过日子的留守少年，他们的形象通常都是一副歪瓜裂枣的模样，自然好看不到哪去，所以用小眼睛来描绘是最合适不过了。再说了，他俩不是一个被叫成“病猫”，一个被叫成“瘦猴”吗，这类似眯眯眼的造型不就很适合了。其实大家就是近年来被太多这样的丑化行为给恶心到了，导致大家都对其有了PTSD，一看到眯眯眼就很愤怒。这里就需要补充一个重要内容，在热搜接连爆出眯眯眼广告事件并引发讨论后，人民日报官方也针对这个话题作出了一番表态---《怎样看待围绕“眯眯眼”的争议》文中提到过“眯眯眼”是品牌形象塑造和大众审美的一次正常碰撞，只是因为其背后的历史渊源问题，当商家的广告出现这一元素时便很容易引发一场社会舆论。不过正如人有高矮肥瘦，人的长相本来也是五花八门，人人都有自己的审美标准，不应该被肆意定论。而且官方也强调了最重要的一点---我们的审美不可以让西方来塑造和把控，“眯眯眼”就是因为西方人的恶意丑化和污蔑才会导致其成为RH的符号，这种情况下我们就要防止被这种歧视性的审美趣味给带歪了。那什么是带歪呢？人民日报接下来的这句才是重点：没必要上纲上线，爱国热情可以理解，但确实要一事一议，不能把不同的情形混为一谈。再说，本来我们反对眯眯眼的目的：就是要让西方人不再拿眼睛正常大小的人故意眯眼来代表中国人，并且让这种歧视行为彻底成为历史。这是一种对敌人的要求，而不是对自我审美的限制。回到雄狮少年的问题上，虽然角色形象有些争议，但论影片本身的质量和内核来讲，它根本不存在任何贬损的现象，既然都不符合这一标准，那自然就没有丑化一说，为何还要在意主角的那双小眼睛。总的来说，《迪迦》被举报是因为一些家长带着对动漫和特摄剧的偏见来看待而导致的，而《雄狮少年》被舆论怒喷在一定程度上也因为我们带着对眯眯眼的偏见，两者看似没有可比性，但背后的逻辑都是一致的---以自己的美好目的为出发点，用主观偏好进行打压。就像不要让动漫继续成为家庭教育失败的甩锅对象那样，不要让眯眯眼继续成为丑化国人的歧视标签，这些才是我们真正要改变的现象。再强调一次，这是对敌人的限制，而不是对自家人的审美限制。03.病猫与雄狮其实关于雄狮少年里的主角形象问题，还有一个比较中肯的说法，那就是形象上的改变。刚开始的阿娟就是一个胸无大志、喜欢成天混日子的废材少年，不仅体弱多病，还整天被人欺负，连师父咸鱼强当初都认定了他没有舞狮的天赋。但是随着故事后期的发展，从觉醒斗志到家庭变故，由维持生计到重燃斗志，被生活反复敲打、锤炼的阿娟整个人都发生了很大的变化，最初那个废材，到最后终于蜕变为帅气的雄狮少年。这样的变化在一定程度上也对应着中国人地位的成长史，早期的废材阿娟就跟过去的我们一样，被外人当成是任人欺凌的“病猫”，即使心中满腔怒火，但奈何就是打不过人家，到头来也只会被他们羞辱，此时的眯眯眼有助于强化这种弱者的气质。而同样，当阿娟开始强大起来，并最终彻底地站起来后，过去那些欺负他的人便再也不敢对我们动手动脚了，如同一头苏醒的雄狮不敢让人轻视，这时你再看他的眯眯眼就会发现那神色都已经变得十分坚毅，不再有那种丑化的感觉了。看到没，角色的眼睛还是长得那样，可是那意境却迥然不同了，你说就这还算是丑化吗？阅读原文,2021-12-29 09:35:24,2021-12-29 09:40:25,130,35,https://www.zhihu.com/api/v4/answers/2290058346
知乎用户,792,我这个人不喜欢打一堆字车轱辘话来回说。我捞点干的。单纯小眼睛细长眼什么的，可以说是画风问题。但是当眯眯眼宽眼距吊眼梢塌鼻梁整套出现，并且每一个角色都这样的时候，没啥可洗的。中国古画和佛像的眯眼睛是受佛教影响的一种表现。表现的是视线低垂，简单说就是人视线向下双目微睁的状态。而不是眼睛真的细长。主创张苗在美国哥伦比亚影业干过15年。这个片子在法国影展上被评价“东方人物形象的典范”。张苗说他们追求写实，还说让大家照照镜子看看自己长什么样子。可实际上，接近这种长相的人都能直接靠这种相貌博眼球出圈，可见这是一种多么稀奇的长相。我给徐志胜个面子，就不指名道姓了。另外如果一个角色长这样你可以说写实，每个都这样，难道不是自相矛盾。最后我总结一下，主创受外国文化熏陶多年，整出这么一个作品。主观上未必有辱华这么严重，未必有夹带私货让国人被动接受歧视形象这么深层，但是迎合外国审美肯定没跑的。,2022-01-02 10:50:19,2022-01-02 10:50:19,0,1,https://www.zhihu.com/api/v4/answers/2294859851
海纳百川,36,无语，就电影而言，我和我的小伙伴一起二刷仍然落泪。就风格和分镜而言，很棒。剧本台词还有提升空间。说眯眯眼的，先去看看导演说的话，注意，不是经过人为编辑后的。话说接受度这么低吗?看过恶童乒乓的人物吗？网上有位奥斯卡导演里有句话大概意思是：中国人被西风打压这么久，还要自己打压自己吗？以上个人观点，不喜你都对。,2021-12-30 11:19:22,2021-12-30 11:19:22,1,2,https://www.zhihu.com/api/v4/answers/2291600073
jing394,36,你还别说，八两金还挺好看的,2022-01-03 07:54:48,2022-01-06 15:12:43,1,3,https://www.zhihu.com/api/v4/answers/2295716230
Leon,146,不应该把广电拉出来骂？ 平时什么电影审核得严格得要死，现在这么明显的歧视辱华，广电会发现不了？ 还是说，我们内部有问题了？,2022-01-03 02:30:50,2022-01-03 02:30:50,0,1,https://www.zhihu.com/api/v4/answers/2295660177
李公昂,259,是制作团队有意引导的。与杨笠手法一样。抓住敏感话题狠吃，对持异见者猛怼，装无辜。正常人的言行，如果被广泛被认为是一种冒犯，第一反应难道不是道歉，澄清主观并无恶意么？不仅不道歉，反而提出扔石头砸狗，你去照照镜子等暴论。你说他没有主观恶意我是不信的。我还想问问，专业搞影评，给影院提供排片依据这些工作者，你们的工资这么好拿么？如此明显的风险，不提示院线，这算不算事故？一个搞股评的，推荐你放心投资的股，连续跌停到退市，还爆出各种黑幕。你怎么评价这个搞股评的？,2022-01-03 10:55:12,2022-01-03 10:55:12,0,1,https://www.zhihu.com/api/v4/answers/2295863888
刘昊,15,抛开人物形象，我就想问下，我们的社会是村里有村霸、卖闲鱼被人看不起、城里人鄙视乡下人、出了工伤事故没有一点赔偿保障的社会么这部电影对外宣传是弘扬正能量，展示传统文化风采啊，兄弟们！如果他对外宣传是揭露社会现实的，我就觉得没啥了。我从电影里看到的是社会对弱者的恶意、嘲讽、鄙视这电影立场真的有问题，这是一部抹黑乡村振兴的农村、抹黑国家医疗保障制度、抹黑社会主义精神文明建设的电影,2022-01-03 17:35:34,2022-01-04 10:20:52,0,1,https://www.zhihu.com/api/v4/answers/2296273780
劳纪石明,163,脱敏实验了属于是，傅满洲和黄皮猴子再上大荧幕我都不会觉得意外。,2022-01-04 23:02:04,2022-01-04 23:02:04,0,0,https://www.zhihu.com/api/v4/answers/2297896223
胡兰芝,1362,   我觉得只是不能够双标。  以后碰见有欧美脸建模的动画片。  我也希望看到同样的态度。,2022-01-05 18:03:51,2022-01-05 18:03:51,0,0,https://www.zhihu.com/api/v4/answers/2298957566
夜泮,771,很多人被骗去观影，结果主角巨丑。心里不舒服才发现眯眯眼这么多问题。不骂怎么办？感谢雄狮帮忙普及了什么是眯眯眼 ？,2022-01-01 18:54:42,2022-01-01 18:55:51,0,0,https://www.zhihu.com/api/v4/answers/2294345946
Man,22778,还没看过电影，但根据争议我有几个疑问:为什么国外影视作品用眯眯眼是辱华。我们的影视作品用所谓的眯眯眼也是辱华？为什么动漫人物形像一定得按欧美日定下的大眼睛来搞，小眼睛就不行？非理中客，只是单纯不明白。针对最近一系列关于外貌外型的事件，很多人的反应非常令人迷惑。别人用一个我觉得很丑也不像我且没代表性的形象扣在我头上侮辱我，我当然会觉得很愤怒，但我绝不会说拥有这种相貌的人不应该存在。,2022-01-05 10:56:11,2022-01-05 10:56:11,0,0,https://www.zhihu.com/api/v4/answers/2298309989
国际驰名双标,102,我所看到的只有骂，以及臭不要脸地强洗，没有战,2022-01-02 19:14:25,2022-01-02 19:14:25,0,0,https://www.zhihu.com/api/v4/answers/2295313060
