大家的不爽,来啦,哈哈哈哈,哈哈哈,关注果断三连,第一第一,广东人不背锅,主角真的很像我堂弟,
就说明问题,啦宝,看完预告感觉看完了整部电影,哈哈哈哈哈,这么多人夸,来早了,我眼睛大的很,麻了,阿娟
我周围的人,来啦,五条人,个个都当自己是当代鲁迅,可票房就是上不去,怎么没有人呀,你说这是个猴儿我也信,真人造型不能这么搞,别认
就没有眯眯眼的,啦宝,我们学校就有舞狮的,电影不错的,骗进去就完成任务了,老婆我来看你了,广东人和留守儿童这次被黑惨了,动画人物可以,阿娟就是最棒的
效果导向,是呢,广东索普吧,巨好看,我初中也不剪头发,告诉我是不是第一名,因为这是一场中美话语权之争,主为了这个商单也是脸都不要了啊,少年强则国强
所以效果就是被骂了,还不如陆光和程小时还有乔苓帅呢,五条人,肝帝,和他差不多,错付了,是场硬仗,难得啊,恭喜
我看着就不舒服,因为外国人就希望我们长成这个样子,猪肉荣,想去看了,挺住,来早了,中国需要掌握审美话语权,这种现实题材多少年都不拍了,支持
看着就不想买,普通人看电影一般是想要享受美好的,五条人啊,但这真是丑得离谱,谎,抱歉,陈曼的作品就不会再出现了,五条人的道山靓仔,好耶
就这样,可以不好看,不,普通点也好啊,哈哈哈哈哈哈骂的好,你这体格舞狮估计要高反,真难看,不用重复那么多,买票了
不想参加讨论,但要顺眼,你是牙擦苏,哈哈哈哈哈哈哈哈哈哈,醒狮在广东的地位还是很高的,好开,若干年后将来西方人对我们竖起了眯眯眼的时候,我看魔童就受不了了,已二刷意犹未尽
谁洗都没用,或者电影足够优秀,包租婆打酱爆,舞狮超级帅,剧情确实有点不现实,雄狮少年,我们的子孙也懵逼的配合着眯起了眼,那不看了,好电影
一个两个还可以洗,让人接受不顺眼,老势势是汕尾方言很拽很嚣张的意思,可是这关日漫什么事,本来就很好看啊,对不起我不去看,没得洗,青蛇就是辣鸡,不喜欢人物的审美
全员眯眯眼,审美都还不够,题材不错,骂的也没有说自己喜欢日漫吧,五毛,确实,垃圾电影就该抵制,我知道好,央视点名表扬
冲着国外拿奖去的吧,哪里有审丑的基础呢,等你好耐啦,不要随意加内容,分,没有兵马俑看电影,但当和哪吒重生眼镜的建模一样会被喷,但是那种少年冲动热血,出息了
你周围没有,好看,有点广东腔的味儿了,就是,本来想给零分,我也好早,抵制,我已经很难再,阿娟爱上了阿强
不代表不存在,广东人长这样,画风有个性,额,不过画面不错,开了,就我所知吴京是出了名的烂好人,每天就是上班下班,好看
你的世界不代表全世界,我信你个鬼,针不戳,我就这小眼睛,票房连哪吒零头都没有,我去,这明明是西方的偏见,也就图一乐,这不是大圣归来吗
而且正常的眯眯眼和他们刻意夸张加工后的眯眯眼也完全不是一回事,是对人文地理的采风,看起来不错啊,最大的难点应该一直都是表情吧,划时代的一部中国动漫,好早,怼这部电影干什么,佳片是真的,牛
但,不是人物模型,三个舞狮的少年,这部电影真的超级美,期待更多这样的作品,可这玩意不一定是由,中国人什么时候如此脆弱,做这种狮头玩偶,h
哈哈哈,看了,哈哈哈哈哈哈,每一帧都是壁纸,真的好看,市场,电影很好看,他们也得不到版权保护的,大快人心
关键是他做的不好看啊,茎,男主,美国人也不长辛普森一家那样啊,一分不给,设计的产品,看过再说吧,收益不会太高,大快人心
不单单小,没看,还挺,英国叫乔治的也不是猪啊,负分,更像是二鬼子表忠心的作品,这视频是明夸暗骂,好红红火火恍恍惚惚,我就看不惯网上民粹的歪风邪气
还小的丑,茎,乖,人物就是刻意的啊,最后还去了上海打工,t图一堆,雄狮黑实锤,收钱了吧你,动画人太难了
眯眯眼丑的要死,没看,五条人,胖子猪样,爷笑了,谁敢写啊,踩完退出即可,哈哈哈哈哈哈哈哈哈哈哈哈哈,看阿猫抖腿特别喜感
可以有,D,这质感不错啊,瘦子猴样不是夸张的手法吗,不会,不给,踩完退出,不得不说白蛇,真金不怕火炼
但是不能是全部啊,看了,啊啊啊木棉花细节,真的很美,你会收到三连,怀疑这是泰语,点右上角三个点选我不想看,还是不错的,期待你们下一部作品
一点都不尊重,没看,画风很有个性,哈哈哈哈哈哈哈哈哈哈哈,是我,好耶,主,哈哈哈哈啊这,但希望不是续集
看着恶心人,没看,马冬梅的大叔,完全没注意到这个小雪人,n,好,电影就是难看,什么叫国际化审美,是新开一个故事
我不讨厌眯眯眼,没看,我要睇粤语配音版,这又啥刻板印象的,这电影有啥好泪目的我服了,分,不是小眼睛,导演如果外国人,回形针跟这个可不一样
我身边就有眼睛小的同学,P,唱的歌是闽南话,我认为是实景嘞,n,下刺一腚,是唐氏残疾儿好不好,国内早就骂上天了,现实
但你特么特意化妆把眼睛画小,没看,才发现,说浑身不适的,觉得好看的家里人都和雄狮少年里面主角长得一样好看哦,是么,都没抓住重点,南派狮子,划重点
照片服饰妆容丑话,没看,大圣,也不至于吧,我打零分,都什么垃圾剧情,广东人要感谢你八辈祖宗,排面,现实题材
引起不适,没看,如果是粤语或福建话就完美了,主要说的不是丑而是眼间距宽眯眯眼符合西方对亚裔的偏见吧,坚决不看,就是丑爆了,票房打脸疼不疼,哪吒,燎
你这不是恶心我这是什么,没看,浓浓的迪士尼亚洲人画风,不要随便扯上二次元啊,大家都觉得很好看,哈哈哈哈哈哈哈,第一映像你都忽略那还有啥好说的,就这故事能激动啥,太怪了
这不是眯眼睛这是唐氏综合症,看了,千金散尽还复来,拿个反派特意搞的戏剧效果说说什么呢,该说不说,我也是真快,正怼着外国人,尚气,没一个正常人脸
抵制这类作品,没看,五条人,真的第一眼看得出这建模和光影是花了很多功夫的,这仨伙计,读的不错,从背后自己人递了把刀,女主表示很淦,
和审美无关,没看,冷静一下,哈哈哈哈,左边像狒狒,下次别读了,是不是故意已经不重要了,那是客家话,是你的审美单一
就是一个用了,没看,哈哈哈哈哈,关注了,主角像猕猴,黏,不打下回还有人敢这么创新,采青,刷
风格形象做广告的问题,挺好看的,哈哈哈哈哈到时候一定看,就冲,那一嗓子喊的真的和大圣归来猴子特写一模一样,哈哈哈哈哈哈哈哈哈哈哈,去了网红滤镜然后加了,狮头制作好后需要点睛,这个监制的眼睛也没那么细啊
通过转移焦点和稀泥不可取,入海,哈哈哈哈,这句,没有,坎巴拉,滤镜,主还是做好功夫吧,Q
关键是大眼睛审美也是六七十年代脚盆漫画传过来的啊,广东采风是采的风景啊,这不是,骂得痛快,大家都的好看笑死我了,参团,啥比,哈哈哈哈哈哈哈,居然不是韩国电影
毕竟浓眉大眼在这词最早出处可是形容又丑又凶的人,坐标西安,大圣归来,九连,哈哈哈哈哈哈哈全是看过的水军吗,半佛,蒉,减在一起好魔幻啊,现实
,是去不了,的孙悟空,已三连,嗯,我喜欢女的牛老师,电影不好看,我觉得挺有特色的啊,冲吧
年的事情,单纯只是样子好不好看的问题吗,期待了,不好意思,结局很好,半佛可以当那个狮,为什么要忽略,看一眼就记住了,我为你们加油
正常就好,单纯吗,哈哈哈哈哈哈哈哈,老子家里三个都是单眼皮,冠军继续去打黑工,哈哈哈哈哈哈,现实中有更丑的人,带节奏的心里绝对不是中国人,外貌协会的请先了解人物背景与定位再喷
也没说要大眼睛呀,自来水,五条人,笑起来就是一条线,很好看,下次一定,人家也没说不配活着不配做中国人啊,就冲着这点我就喜欢了,呸
但雄狮少年的眼距是三庭七眼了吧,对啊,这,本人广东佛山人,这条,哈哈哈哈哈哈,思想上的懒惰索性全部打死,有宫崎骏电影的味道,欧美
我反正是永远不可能支持,所以网上怼的这么厉害我就不太明白,这光影细节,看了电影就知道,毛,说白了,眯眯眼是客观存在的一种正常形状,他妈妈叫他回去的时候才是真的绷不住,觉得好看
多元吗,只能说有人作怪,真的无敌了我还以为皮克斯的新作,又不是所有人都是小眼睛,对对对,你敢教你爸爸做人,你为什么要迎合西方的言论偷偷摸摸藏着,忙完订房,太可怕了
一部动画电影里全是眯眯眼,真的相猩猩,能不换个故事模板,是的,分,消费者就是,这是人是鬼,雄狮一定要等我考研完啊,你的眼睛咋这么大
重点不在这里,看了,看到舞狮和海边就猜到闽南了哈哈,哈哈哈哈哈哈哈哈哈哈,我去的那一场,你爸爸,片方也给你钱了,我觉得哪吒不好看,醒狮是核心
动画夸张点没什么,这不是我们看外表的问题,米津雄狮,我觉得哪吒蛮好看啊呀,电影结束无人离席,确实,受疫情影响啦,早他妈腻了,核心精美就足够
而是创作者自己说是写实的,这是西方人用这个歧视我们的问题,渲染真好,但是这部全是故意搞丑,有人在擦眼泪的,你到说得标准喔,因为美元,连游戏都是黑悟空,脸只是陪衬
那不就跟扯淡一样,好看,别和蜘蛛侠硬碰啊,就很刻意了,一部以掺沙子为主要目的地片子,好骂,刀了,我是真的不想看到猴子相关的,重要的是内心
好继续作,又好笑又好哭,我很喜欢雄狮少年的呀,哈哈哈哈哈哈哈哈哈哈,怎么可能真的用心制作,哎嘿,我想感谢他八辈祖宗,哪吒和白蛇那种大眼睛才是典型的欧美动画片造型,吴京也表扬了
希望奔驰不要怂,本来就是小人物电影嘛,这是时间每天拍不到一场,我真是感觉到了舞狮的美,只能,下次,我想拿着铁锹去他家祖坟做客,毫无中国风美感,快去冲吴京
管得宽,赞同,我靠元华,哈哈哈哈哈哈,分,做得太监舍得割,当面感谢,我周末就去看,戎
就不看,但我觉得不是好不好看,这三个确实缺个师傅,哈哈哈哈哈哈哈哈哈哈哈哈,又看了遍黄飞鸿,终于等到你,豆瓣评分恒定,是我了,各位听到没有
这花了多少钱,顺不顺眼更合适,舞西,最后一起打鼓这一段真的太燃了,^,就别商业规则了,没有一丝波动,白蛇,打破偏见
人的长相有特点,主角一群人甚至不如胖子和大叔造型正常,题材很好啊,可能有的人智慧还没有开化吧,我也觉得好看,就不是中国人,我就觉着挺魔幻的,真的,这种主流推荐多来一点
对,这胖纸是最顺眼的,我靠做的不错啊,人们愤怒的不是丑,我觉得挺好看,老婆终于说这个啦,要是一两个角色正常,德不配位就是说,自来水每天摇旗呐喊很辛苦呜呜
但是不是唐氏综合征,没可比,宝芝堂三兄弟,而是眼睛,对,好活当赏,但是清一色的没的跑了,我乱用词骂我就是你对,阿娟
那哪是美呀,一个是爽文一个是现实,c,真的没必要偷换概念,V,来了来了,主角像耗子,关键是,冲
那是病态,小人物凭什么就必须长得畸形,主角说广普可能更有味儿,即便你是大眼睛也可以丑,真的好看,确实,眼睛小有,有一两个可以理解,啊
标准申论模板,剧情也不好,人设很棒,但导演选择一个更恶心的方式,我可以打,说得好,你看过这么多斜眼的嘛,一水儿的都,破圈冲
正常碰撞,给人递刀子,很有年代感,对,分,西安夜场每张,在中国了这形象固有印象就是贼眉鼠眼,丧气难道是因为拍得很烂才被抵制的么,为什么要吃过
啊呸,其实也没什么的啦,加油,这部剧眼间距放普通人身上就很奇怪,这就是现实,场场爆满,三连了,可恶,才能说
钱在我的口袋里,只不过是动画风格而已,感觉不错,不至于差评,这就是生活,懂得都懂,清美,明天就去看好了,臭
我乐意花钱看大眼睛美女姐姐,你想去看那些都长的一个样的网红脸模子吗,狂鼠,但是主角团长的奇怪反而不像普通人,兴趣爱好再喜欢都越不过生活,就是想去国外冲奖嘛,陈曼,有没有一起的,啥破玩意都能上新闻了是吧
就是不看,这不是好不好看的问题,期待一手,背景做的那么好,说的太过分了,让飞,耐克模样,福州,这要收多少钱
麻烦写出这篇报道的人,一句广东人就长这样真的得罪了整个中国人,五条人,人物就很奇怪,电影很好看,在申遗了,早被高级,这不是正常人眼睛比例大小么,烂透了是吧
看看模特的其他视频照片,是呀就是这么回事儿,看起来好棒,边缘人不全都是丑的啊,弹幕笑死我了,你喜欢女的牛老师,中国脸,但是天书奇谭不是眯眯眼,我拒绝这种眼睛设计
恶心玩意,更何况还让我掏钱,感觉不错,好歹还有普通的呀,我觉得好看,发音不错,恶心够了,不要混为一谈,打破偏见
腈,你在放屁,雄狮少年,哈哈哈,我身边广东人都长这样,下次别读了,吴京还挺过上海堡垒,但是天书奇谭不是眯眯眼,挺有喜感的
既然要多元化,中国电影能好好讲故事就已经难得了,站有官方号就叫电影雄狮少年大家快去关注呀,文娱圈反贼多谁不知道啊,宁可憋隔应广东人了好吗,你可以打鼓啊,G,古画的细长演和西方搞的眯眯眼两回事,拒绝就别看咯
眯眯眼都被西方炒这么多年了,就是最普通的平凡人长相才能更拉近和现实观众的距离,回力,可郦{^演技棒,没分,一股客家话的味道,奇怪了,哈哈哈哈哈哈哈哈,差你一个嘛
那现在就少点吧,换句话就是扣帽子咯,茂名普通话,演小人物就想到周星驰,\,只有诺兰能解决,平时怎么喷吴京的,九连真人,偏见让你一叶障目
书读得多了就没人情味了,关键是没他喵一个能睁开眼的,不错哦,他大双眼皮,丶,上座率高达一点几,现在又拿出来当工具人,哪吒魔童降世就算了,偏偏选外国人对中国人的刻板印象为审美
全是大道理,真的很难受,西游之再续师徒缘,关公狮,\,好开,不懂就问,一股尴尬的中二气息,怎么监制不是斜眼眯眯眼宽眼距
那种眯眯眼妆完全就是化出来的,我很想二刷,哈哈哈哈哈哈,这个狮子很漂亮,随便买个票都是包场,主要是自以为高人一等呗,广东为啥会有北京猿人,所以,黑子们开始你们的表演
和小眼睛没一点关系,也是因为疫情,讲舞狮吗,背景是真漂亮,哪吒的,剧情我喜欢,垌,可能是走得是类似皮克斯动画的路线,鼽
你让白雪公主化那个,那不是很出戏吗,期待,要看内核啊啊啊,我命由我不由天,广,要和,追求的是好故事,人民群众不喜欢
妆也丑啊,怎么可能,眯眯眼是吧,,不也是中二鸡汤吗,人笑裂开,苹果核阿尔法比比,普世价值,你算老几
早该出手了,长得丑就不配当主角么,哈哈哈哈哈哈哈哈哈哈,看过,这片子比哪吒好看太多,分钟,导演说广东人都长这样,不是那么商业化,主角很帅啊
关键人家做这个也不一定冲你口袋里的钱来的,丑人就不配拥有高光时刻么,强烈要求粤语配音,心灵奇旅,真,别说不是中国人了,什么玩意,工业化,跟导演长得挺像的
人家有更大的生意,这帮人也是搞笑,广东人太期待了,吗,我觉得超级好看,是个人类都觉得他丑,,来佛山买,非常好看
舔好主子不愁钱,怎么能接受哪吒有烟熏妆,画风好看,人脸很窄很长也不是照着真人去做的,因为技术的铺垫越厚,吃的咸鱼抵得渴,制片方故意把眼睛改成那样的,什么款式都有,加油
这次如果被他们得逞,为什么不能接受身边普通人长这样呢,不错不错,为什么雄狮少年就被追着骂,夹带私货时才可以软着陆,傲慢的创作者,突然切换,因人设问题怕外国人笑话处处冷嘲热讽,阿
以后的影视,不是双标是什么,可以,哈哈,正所谓又当又立,哈哈哈哈哈哈,吓我一跳,耗时耗力耗钱选冷门题材宣扬中华传统文化,自轻自贱就能打破别人对他的偏见吗
广告全是眯眯眼,就是人设没做好不讨喜,想看,反正我喜欢,感谢阿婆主帮我们踩雷,速度转行去送外卖吧,三连给了,我更希望能独创新的世界观来讲故事,别人该怎么侮辱阿
扣帽子,,五条人,刷支持了,哪吒不俗套,骂的好,我开始看到人物的时候就觉得看到了外国动画人物,当然这个不是一蹴而就,也还是照样侮辱
您可真善良,站才几个人啊,画面质感相当不错,关注电影本身传递的思想才是重点啊,我笑了,我出息了,我看不是迎合西方言论偷偷摸摸藏着,天书奇谈男主是豆豆眼也是狐狸,精美狂喜
你这避重就轻了,大数据背景下,不像闽南话,这脸的设计真的太刻板印象了,哪吒很好看,是的,而且迎合西方人对中国人的审美显摆,天师眼睛细长也是狐狸,哇塞好大的眼睛
这哪是眼睛小的问题,又有几个被推送了这个电影啊,,动漫就是动漫为什么要扣在真人身上,我是真没感觉,说的太好了,我支持吴京,眯眯眼动画也能吹,绝无回旋余地
这是一种病态,大数据已经把我们禁锢了,怎么感觉像是换皮孙悟空,啊,说好看的赶紧刷票房三次,难看死了,但不支持这电影,还十佳,什么眼光
我阿祖是自愿的,人物设计很奇怪,不错,这朝二次元开什么火啊,在这刷存在感干啥,真的建议给技术人员磕头谢罪吧,广东人只想表示,别侮辱动画了,会赞这个电影
,故意丑的影响观感,哈哈哈哈,为什么人物一定要漂亮呢,现实也是啊,为了装逼糟蹋了那么用心的画面和配乐,我就是不去,先做好建模吧,绝无回旋余地
观点比较折中,主是成熟观众吗,一定看,这些评论怕不是脑袋有问题,遇到挫折总有那句话会让你重拾信心,我想到了美末二,就硬吹去吧,那这不就是双标吗,不看
但是中立客观,审美狭隘,题材也得支持一下,我的天,国漫天天都在崛起,一样的高高在上,就不看就不看,这,又是你
,你去美丽人星球生活吧,画风好独特,六级号什么东西呀,绷不住了,一样的反人类,要是导演是外国人拍的,不算剧透,被绑架了你就眨眨眼
这片的受众的外国人,不好看和丑是有区别的,迷上了,电影里也不是所有人都长这样,逾期太高了,一样的充斥歧视,内容再好,因为狮子眼睛大,好看
眼睛可大可小,这眼距,光影不错,看过,还有方言歌,但你懂眯眯眼呀老婆,我想你也会冲烂他吧,周末去支持,安利
但是要精气神十足,受不了,都是小眯眼,很棒,人物我也觉得很到位,想站着把钱赚了,剧情多老套啊,个人认为,超好看
请注意,啥都能上纲上线的,这三个是悟空,三连了,主人公的外形变化,这个图太好笑了再看一遍,妈耶,档期就差一个月,剧组制作太
眼睛可大可小,面对国内的中文动画片扯什么外国审美歧视,八戒,,我也觉得很好看,越是强调越表明你喜欢牛老师,要让我盯着这个电影主角看一个电影的世界,只看得见哪吒看不见罗小黑,认真
但是要精气神十足,广东人不背这个锅,沙师弟,借你吉言,特别是配乐,文章看了,实在是酷刑,都是不公正的,了
这该不会是老胡写的吧,这是广东人被黑的最惨的一次,好棒,木棉花,镜头感,不要给艺术摸黑好吧,好丑,真人能有这种力气跳起的明星不多,把外国人对中国人的丑化中国的形象全部融入了这部电影里
日常生活中谁会去说别人眼睛小啊,哦,是少时回忆里的场景,确实真的丑,唢呐和大鼓,可是股票涨了呀,看评论,看过的回来说一句真的很好看,
奔驰广告代言也是眯眯眼,动画风格,虽然但是个人觉得这段配音有点出戏,我觉得没啥问题啊,中国式寓意,这就很尴尬,喜欢的理由有很多,有五条人,唐氏少年吧
制片导演故意的吧靠,那是不是迪士尼福克斯宫崎骏等等长的和某唐氏画风不一样的都是网红脸啊,我命由我不由天,一个个审美都那么高以后自己画去呗,我全程没玩手机,六千人观看,不喜欢的却只有一种理由,九联真人吧,无数
支持的意思,确实,太真实了,广东人不会真的长这样吧,笑看全场,就是,作为一个可以独立思考的成年人,这是,指
我们是爱国主义者,您是分不清妆和五官位置的区别,,有的人的辫子再心中,最后都要哭了,非常非常宽容,我决定看过再评价,狮头玩具也不需要他这电影带货啊,幸好我不是广东人
可我们并不会因此而变得无比盲目,您能长这样希望,非常真实,就因为外国人用眯眯眼丑化搞刻板印象就不允许我们自己人真的有眯眯眼存在,我觉得很好看,读得很好,捩,我觉得卖狮头手办就挺好,广东人
斜眼妆和眯眯眼是两回事,张自拍让我大开眼界,,有事吗您,我觉得很好看,下次别读了,大学生都在期末考试,说外形问题,
不管是雄狮少年,不是采风得来的人物形象,这歌是不是五条人唱的啊,看过很棒,眯眯眼就离谱,庵野痞子,消费主力军还没有放假,真的是忘本,哈哈
还是三只松鼠的模特,采风仅仅是采景,舞,还好吧,人物形象挺好的,他的股票涨上天了,广东人表示,青蛇算是能打的了,不看就不看略略略
还是陈漫的照片,篌,加油啊中国动画,我没觉丑的过分,平凡的可爱,票房算个蛋,都不看,同期电影实在不行,看看弹幕有多假
那一些人的眼部都是经过化妆过的,永远不会看,挺期待,客家人表示超级开心,接地气,猪还大眼睛呢,水分,可天书奇谭那个是狐狸啊,刻板印象都乎脸上了
这不是单存的眯眯眼,还是白蛇团队来做审美吧,祝我能解封出去看,应该都是黑的才对,很好看啊,还有人吹这部电影票房过两亿,好在哪里,所以眼睛细长,当我们傻吗
一个小眼睛就算了,至少不咋坑,卧槽,建模真的很有水平很厉害,曲,真的搞笑,那是一样的吗,好想看呀,真的特别好看啊
全,看了,我想看,我要去看,彡,洗白文自媒体拿的估计都不止两亿,赢,可惜在伦敦,我跟着安利一波
小眼睛是几个意思,广东人难看,这剧人物名字绝了,我要去看,广东人表示,塑料塑料,海,我觉得角色还行啊,真的好电影
凸显丑化和正常长相是两回事,挖草,认真的吗,就是,我不长这样,这破电影是谁拍的,不^希望大家快⒊龈咭,企,为什么主角一定要帅
他,会不会说话,阿娟,骂的好,真的好看,导演很有钱,不然N方也太弱了,这个狮子可以做周边呀,非得俗套网红脸
感觉没有什么用,避重就轻了,是,美术声乐配合极佳,很有生活气息,亏钱无所谓,D,也是,怎么说呢
好像在扯皮条,真实原因就是眼睛,男的,哈哈哈哈哈哈哈哈哈哈,我完全代入了,想用这部电影在国外拿奖,证明了美国撒的毒,九连真人,像小胖子那种做成豆豆眼的小眼睛
活出自己的多元,哪,潮汕人,票房扑街了,看到后面根本没注意主角团的美丑了,m,终于起作用了,方向错了,或者一条缝我是没意见的
e人会看见,有矛盾有问题不去修改反而发酵它,还踢球,哈哈哈,雄狮少年已被法国电影节提名,赶紧转行吧,证明了美国的一种定义,实拍不是更好吗,为什么要吊梢眼
审美,不是主角问题是这三个,这三好像猫猴猪哦,哈哈哈哈,东方人物形象典范,抓紧转,影响了中国人,不觉得是缺点,我有
不是审丑啊,都得唐氏都眯眯眼说不是故意的我真的不信,F,周日看了,我觉得好看,这样的设计见一个骂一个,黑子的问题就是分不清陈曼和雄狮的区别,反而在一众锥子脸大眼睛的画风里脱颖而出,感觉不错的
那个师傅老婆全剧最好看最正常的了,说理性就是拉偏架,爆丸小子训练营,隔壁一个大叔看到阿娟回忆那段摸摸擦眼泪,三连有了,哈哈哈哈哈哈哈哈哈哈哈哈哈,鼽,不服憋着,哈哈
,不不不,是西游记吗,我一定要去看,同感,褙,去同质化就是就是一部电影里只有眯眯眼,白蛇那种爆米花一边呆着,无数
动画和媒体狡辩,是一看成分就不一般,声音好像彭于晏,就明天晚上,跛,左边好色啊,我都看动画了,果然发条,阴兵吗
包容不等于让你贱,对,画风感觉还不错耶,认为小眼睛就是刻板印象的想法,五分我都嫌多,我感觉我完了,导演给我来了句写实,这音乐广,唐氏少年
前面的不懂乱说什么,我真的不想去看一部人物让我看的不舒服的电影,五条人唱的,又何尝不是一种刻板印象呢,真的看疲了,太对了哥,当你的敌人夸你时,人,挎
浓眉大眼是形容人老实,广东风评被害,五条,你主要是长的,分,哥太对,你就得反思一下自己,动了,支持
一个好词怎么被你说成这里,水军评论不要太多,李白说的很有可能是,刻板印象,{,导演的后台不在乎亏钱,有眯眯眼可以,个人觉得可以啊,硬恰
审美,丑拒,天生吾徒有俊才,所以被人骂了,一分都不给,只想去法国拿奖,但能不能不要全是眯眯眼,有点特色,广东人不是长这样的
