,因为电影的人,,感谢,,申遗,吓死人了,看完电影再去听,破坏团结
,竟然比我丑,,真的丑,,有啊,挣钱嘛生意,无名的人,将中华民族的骨气丢得一干二净
,我也就五分的长相诶,,S,,每晚子时阴间自来水都具体刷票,不寒碜,真的鸡皮疙瘩满身,对传统文化的玷污
,不看,,好的我去看,,三体综合征是吧,资本的力量而已,就是你分不清是哪个地方,恶心
,普通没关系,,关键是,,但它们教工人做人,瞎放什么原片,但你知道这就是广东农村,不过是慕洋犬跪舔西方的自我陶醉罢了
,眯眯眼就是丑了,,舞狮的细节都能做的那么棒,,巅,刚才这一下,眯眯转移火力了,不过是慕洋犬跪舔西方的自我陶醉罢了
,丑可以千奇百怪,,为啥要把眼睛距宽调的那么膈应人,,笑死,差点给我送走了,是人设美术风格就丑,盛世
,但偏偏选带有刻板印象的吊梢眯眯眼就说不过去,,肠粉好好吃,,赶紧转行,还能有六千多万就让美工和编剧赶紧去给摄像磕个头,史莱克美术可不丑,软骨头的国贼
,听好了,,可是那么多美术表达方式,,重点,它师傅是外国人,这眼不挺大嘛,玷污传统的慕洋犬
,广东不长这样,,它却选择了眯眯眼,,阴兵刷票,小眼不影响我看剧,青蛇好,甲级战犯
,这不是不好看,,B,,我真的非常同意这观点,但凡两个眼睛往中间稍稍,设定模糊,中国人民坚决抵制西方的歧视标签
,这是唐氏综合征,,出来洗地啦,,做任何设计都是要考虑受众,都不会骂他半句,剧情含糊,原来这就是央视啊
,电影没问题,,你也别换概念,,某星电子厂,,人物更是没灵魂,太恶心了
,是又眯有斜,,就是不好看,,我工厂起火了,这一幕明显鱼脸,属实好片,导演你自己长这样吗
,分得很开的眼睛,,虽然但是,,你们等着吧,两个眼睛中间隔着一道海,强烈推荐,两头吃
,实在是受不了,,这眯的也太离谱了点,,高手就是既表达自己的艺术,广东人的蒜头鼻呢,适合全家观看,吐了
,他们的师傅和师娘好看呀,,还是国产那就更离谱了,,同时赚钱,二鬼子,神,恶心
,在下广东人,,洋人宣传的中国审美目的终于达到了,,再说什么,了然了,话,唐氏三兄弟
,对于导演的话我无法理性,,鬼,,都在看吊图,我爱国,系,臣等正欲战死
,哈哈哈哈,,有本事你们去爆破央视,,艺术类电影都是小众,洗地的还支持个屁,列,陛下何故先降
,我,,收了钱,,甚至不上院线的,他拍战狼咋不也弄个眯眯眼,财,电影很棒
,当然是收钱的角度出发,,心都黑了,,广东朋友,用精良的包装装一坨奥利给,富,推荐
,是的,,洗的尴尬不,,我教的时候明明不是这么读的,再精美里面也是奥利给,木,恶心
,R,,别洗了,,因为导演是个歪屁股,你没看过就说剧情好,马,滚
,大哥,,别人骂你傻子你以傻子自称还想让其他中国人也当傻子有人认账吗,,笑死,又是收了钱的,九连真人和这部剧莫名搭,陛下何故先降
,是好不好看的问题吗,,好洗,,我很多美院同学真就这样想,这稿子谁写的,要周边的去佛山民间艺术社找,陛下何故先降
,你得起码是个正常人啊,,放你玛的屁,,人在美院,一会说自己看过一会又没看过哈哈哈,大的小的都有,傻口
,我广东人不长这样,,百京人上人捏,,确实是这样,我只想说大部分国人眼睛长这样,这段说的真好,你们去看看美国画的华人动画
,有些道理,,啊,,精神变态,客套一下,虽然因为外貌埋没优秀电影确实不应该,长的甚至比雄狮少年还顺眼
,呵呵呵呵,,预祝票房扑街,,这声音好熟悉,别当真,但是暂且不论有没有私货,电影很不错
,理中客,,票房扑街,,请问谁知道,剧情也离谱,建模没有特殊用意的前提下对于观感和传播度的影响确实改批评,一个新手随便训练几个月爆锤老玩家
,重新定义,,类人猿,,主还有哪个号,抹黑社会,画的真的好真,臣等正欲死战
,自来水,,不愧是宣发费够拍一部哪吒的唐氏少年啊,,声音太熟悉了,这话说得骂人一样,最后决赛那些狮头,陛下何故先降
,我笑了,,吃瓜,,一时想不起来,广东人背锅,中间那个太像猴子了,恶心
,观众聪明了,,谢谢安利,,我看国产片我容易啊,吴京,胖子比较正常点,在
,烂片宣传再好也不上当了,,马上去看,,噗,真的只是赚爱国钱的人,右边少年也可以接受,滚
,这不是好看不好看的问题,,这是,,这个表情包想要,唐氏综合征少年,就中间不行,三流媒体
,为啥特码要搞个西式眯眯眼,,电影,,剧情也很拉,导演全家都长这样少年,又黑又猴子,毫无敏感度
,允许不好看,,,,只是矮子里高一点,广东人表示受到了冒犯,q,臣等正欲死战
,允许丑,,唉,,观众真的很受罪,我眼睛很大,狮子建模真心不错,陛下何故先降
,不允许刻意丑化,,就不看,,花钱受罪,电影的确不好看,出周边,可别了
,允许丑不允许刻意丑化,,到找钱都不看,,哈哈哈哈,电影也是拉基,我也会买,还弘扬中国传统文化
,还说现实采样的,,广东人都要,,突然意识到语速快是不是让我们没法思考,啊意思是说眼睛大的就是开了滤镜,五条人,我看是刻板印象吧
,真的心坏,,人了,,一宣的时候就有人提了,这个眼距放在卡通里怎么看怎么别扭,无敌,倒是看看那个结局咋样
,这真是软洗,,美在那,,结果他们就改了甘蔗,更别说动漫电影了,本,蚌埠住了
,丑化国人,,所以为什么要是眯眯眼,,这里把自嗨改成弱智会更好,不管你拍了多少部长津湖,视,臣等欲死战
,,,纱布,,可惜过不了审之类的,该锤还得锤,频,陛下何故先降
,看个电影要考虑那么多,,这也能吹,,叫好不叫座的很多都是偏文艺片,全员嘎子,不,很好看呐
,好看不就行了,,就一句话爷不乐意看,,它本身就是为了表达导演的小众情怀,法国人不是喜欢,含,触及人心
,爽不就行了,,全家长这样,,医疗,吕燕,任,Z
,我觉得好看,,我理解,,咪,吗,何,三废材学了三个月舞狮就能赢学了十几年的专业舞狮团队
,老套的咸鱼翻身的剧情而已,,这都能洗,,我也这样看,这还用问吗,商,你管这叫弘扬传统文化
,说天花板,,我不理解,,抛开争议,一定要抵制,业,你看这监制是眯眯眼吗
,封神的也太能吹了,,是宁马长这样还是宁跌长这样,,让观众不爽被冲就活该,这部国漫做的再好我也不回去看,推,后台真硬
,我们观众只要求一个正常的普通的人的审美,,长得像猴的那个孩子挺像广东人的,,就这么简单,吴京就是礼尚往来,广,封杀
,过分吗,,这种视频我闭着眼睛也能做,,哈哈哈,同行之间捧个场,,我们广东人不需要西方定义的形象
,你看他在那站着不知道干嘛,,吹就对了,,,无可厚非,这段真的爱了,就离谱
,画的好像个傻子,,自来水,,影视区,辣眼睛,同,
,好像猴子啊哈哈哈哈,,我觉得男主很帅,,,还是注水的票房,希望舞狮能被更多人发现,这是资本占领高地了
,这锅我广东不背,,哪吒买票看了,,说来说去还是太丑,但凡画的像个人也不至于这样,它不仅仅是酒楼开业过年耍耍的东西啊,清华美院卷土重来
,你这话本身就是造谣,,看完感觉一般般吧,,找肖战王一博龚俊皮一龙罗云熙陈飞宇这些耽丑咖来配音,我可去,讲的就是村里不起眼的留守儿童,猴子
,别变相安利忽悠了,,特效不错,,不就可以化解,的,特别真实啊,臣等正欲死战
,吴京还推过上海堡垒呢谁看啊,,偷换概念不是你自己,,自动营销水军,从小到大都在广东,诫,陛下何故先降
,本来能做好的,,D,,我的建议是,就没见过这样子长相的,同意,臣等正欲死战
,主角难看观众很诚实,,想转发去头条,,赶紧死,傻狗,讲好故事的电影不多,陛下何故先降
,烟熏妆帅的雅痞,,对对对,,宫崎骏笔下那么多俊男美女,被狗罕见气晕,惨叫真多,臣等正欲死战
,,,神,,不照样国际上获奖,,青蛇就是腊鸡,陛下何故先降
,你敢做就得承受损失,,崇洋媚外,,雄狮少年人物设计就离谱,恶心老子,一个完整的故事都讲不好,这是中国人说的话吗
,,,真的有病,,,哈哈哈哈,只会堆砌一大堆特效,啊
,主角起码要能看吧,,哈哈哈哈哈,,周星驰大话西游也是扑街,广东人躺枪,哈哈哈哈,你眼睛咋不长在耳朵那
,,,推荐,,好东西从来不怕喷,广东人眼睛超大的呀,新神榜这段画面明显卡顿,崇洋媚外
,不是眯眯眼或者什么好看不好看,,人民的共和国,,辣鸡才怕,这,追光只会追求,少恶心人了
,是眼间距太宽了不像人,,我就问,,就是消费者惯的,是什么牛鬼蛇神,宏大,死战
,,,大圣丑不,,惯的,恶心,把最基本的东西都做不好,那你就去死啊
,主角海报贴出来都没人想看了,,哪吒丑不,,这个导演应该是收了,可拉倒吧,追光特效好,臣等正欲死战
,,,有人这么骂吗,,的钱,送他一首凉凉,这类似于把,陛下何故先降
,想看的舒服没毛病,,有人把他们定义东方形象吗,,他讨好的是国外那批人,玛德,会飙高音,臣等欲死战
,,,道歉那么难吗,,不是国内,这线下去,唱歌好,陛下何故先降
,蓝衣服这个是猴子,,偷换概念是吧,,半佛说错了,汤姆也扛不住啊,不剧透,捏麻麻石蜡
,,,,,这个电影只有一个中心,只是下面疼,实景,恶不恶心
,看着不顺眼就损失了路人缘,,啊看票房就知道,,为资可,不分离吗,有点想看了,臣等正欲死战
,,,收了钱再洗吧,,为国否,都可以去当太监了,有一说一眼睛真的丑,陛下何故先降
,导演这是做了个猴,,不要拿这些来洗,,资出钱拍的,哈哈哈哈哈哈哈哈哈哈哈哈哈哈哈哈哈哈哈,卧槽,没有别瞎说不是我
,,,鬼子多得去了,,太棒了,广东人,又是毛不易,臣等正欲死战
,E,,我就是觉得广东人受到了冒犯,,动画电影里的精神变态,导演,不会又要哭死我吧,陛下何故先降
,主创团队的人说了,,是导演傲慢的问题,,美末,我吊尼老亩,毛不易,沙比
,一开始画的不像现在这样,,如果解释下动画夸张一下就算了,,哈哈哈哈哈哈,呵呵,无名的人,小镇
,后面是他们特意改的,,还说广东人就长这样,,老婆你的音调全错了嘎嘎嘎嘎嘎,谁不知道分是能刷的,全平台上线,何故谋反耶
,I,,广东人能忍,,口技,不,扯犊子,打破偏见
,找归属感和认同感,,真的是个好电影,,哈哈哈哈,我表示很怀疑,周五去看,懂了
,I,,超级好看,,对,支持的是指它的内核吧,其实不知道为啥,全家都是锤头鲨
,本身就是商业电影,,丑的不行,,说不定甲方要的就是这样的,原来丑真的能出名,我觉得师父长的很帅,这玩意宁缺毋滥
,非得装清高,,晒票根,,哈哈哈哈哈,我也看了内容一般,还没看电影,回旋
,审美得跟大众逆着来,,水军难道贴钱看了,,美的东西可以统一审美,比起很多日漫差的远,狗都不看,有钱能使央视推磨
,I,,g,,不好就是不好,配角的眼睛也是眯眯眼,嗯,这个剧组的关系好强大啊
,解封了就去看,,哈哈哈你可真是个笑话,,丑就是丑,恐怖片既视感,希望我没有在杠,臣等正欲死战
,b,,平凡少年得多美型,,确实宽容,战狼,这样不很好吗,陛下何故先降
,看个屁一群水军到处安利,,小眼睛就丑,,有的改编作属于能动就可以凑合看的了,的制片人也是他啊,毕竟悲喜剧的另一个名字叫做历史剧,笑死
,原来广东人都长这样,,我觉得挺好看的,,你是e面打鼓那啊,确实广府人有点但我们潮汕人眼睛绝对不长这样我们潮汕人颜值算高的,中国的文化被传播了,就算是央视吹得再狠
,单纯不想被恶心而已,,真欣赏不了,,为什么你的嗓音听着这么像某个给自己磕头的硬核男人,这还大部分都是刷的,这样就不会轻易消亡了,也改不了大众的看法啊
,哈哈哈你说我眼梁低我认,,动漫还是喜欢白蛇那种,,瞪,汉奸,这电影难道没喊口号,猪狗不如
,我正宗南番顺祖传深眼窝双眼皮被你整眯能捧你场,,,,燃鹅现在好多人说大众需要引导啊,鸫,哪吒故事不行,收钱了
,唐氏少年,,国漫巅峰,,需要听他们的来得到矫正啊,这事只能说是战狼也知道人情世故啊,白蛇,放屁
,看了海报恶心到我了,,时代标杆,,听不到半佛老婆磁性的声音,导演,可以,放
,自来水,,不喜欢的人都是苟罕见,,我为什么要看,监制的家人都长这样,哭死我了,资本的力量
,核废水吧,,是的,,好惨一狗子,粉转路,第一次觉得狮头这么好看,打疼我了
,为了去国外拿奖,,c,,梦想改造家,再见,无名之人哭惨我了,蛆能载舟亦能覆舟
,这是拍给外国人看的,,其实我觉得只是碰巧撞到了西方的歧视了,,好开,自找的,眼睛拉到太阳穴了大哥,哈哈
,这不是好看不好看的问题了,,造型本身没问题,,埠,我觉得广东没这样的人,经典日漫的大喊,回形针也上过央视
,让导演来广东在公开场合说,,盍,,说得好,广东人确实就这个样子,是超级撒亚人吧,我他妈就想现场就仨观众
,鸡蛋一砸一个准,,尼玛我是眯眯眼,,在点,难道往大便上撒点调味料,不是水潭,一个影院最多四个观众
,写实的太过了,,我不配做中国人,,这种东西卖爆的话,你就能吃下去了吗,是鱼塘,还有一个是水军
,都不是在写实了,,导演的水军,,国漫还不如死了算球,东北人替广东人不服,我觉得这个外貌很好看啊,你哪来的全场观众
,怎么可能满大街都是这种眼睛的,,阿猫阿狗在粤语里是骂人的话,,,进军电视剧吧,收了多少钱,它奶奶的
,眯眯眼是哪些混蛋在捧,,人物个个都是唐氏综合症,,有道理,K,真他么放屁,这个都在推
,特色,,还在洗,,打鼓正好合适,剧情也垃圾,俗的不行,是不是没救了
,就硬洗,,好一个偷换概念,,这部分说的有毛病,不是好电影,恶心的吐了,这人物造型跟我们广东人一点关系都没有
,看到眯眯眼就没胃口,,是的,,市场上也有不为票房的艺术片,剧情垃圾,扑街货,谢谢
,眯眯眼真他妈没胃口,,没问题,,电子厂我们也有技术含量,清华美院都沦陷了,提到哪吒可以退出视频了,绷不住了
,眯眯眼真他妈没胃口,,主就长这样,,狗头,外国粑粑就是香,垃圾电影,罕见
,眯眯眼真他妈没胃口,,就这票房主办方应该也没钱给一些,,来了,K,这句台词真的尬,
,艺术要来源于生活,,主推荐了,,食碗面反碗底,不用看了,配音也拉,这个人是不是值五十万
,符合大众审美的,,本广东人乐意,,哈哈哈哈哈哈哈哈哈哈哈哈哈哈,这,白蛇还好,长得跟猴似的
,才能被认同,,本广东人看得就很开心,,雄尸少年,是洗地狗,青蛇那个太夸张了,老传统艺能了
,眯眯眼真他妈恶心,,丑人就没有三庭五眼了是吧,,玩不起,吴京是野猪皮血统,完全就是美颜开过头的效果,祝愿所有雄狮少年创作人员的孩子都是雄狮少年
,眯眯眼真他妈没胃口,,难道丑人不是人类,,简单说,,人物太吓人了,真的好丑
,黑红营销,,呵呵,,想当就别立,她自己怎么不化那个妆,看完做噩梦,有时候新闻这些东西也不能相信
,看眯眯眼真他妈没胃口,,不要碧莲了,,没有阴兵半夜包场拉眼少年都过不了亿,,现在回形针们都来影视区了是吧,
,像吃了苍蝇,,哪吒是美学意义上的丑,,电影主创就是西方的一条狗而已,这个看了吃饭都想吐,以前还真是看错你了,淦
,眯眯眼真他妈没胃口,,雄狮是单纯的丑,,不是审美不审美的问题,,以后还有其他,金钱在说话
,我一广东人,,别乱蹭,,主创者宁愿讨好西方资本,吴京和李小龙之间差了,给这部动画洗地的,
,看到想吐,,打工那段时间真的,,也不正眼看一下国内观众,部唐氏少年,都拉黑,
,剧情并不好,,超级帅啊,,其心险恶,广东人震怒,打造,
,狗都不看,,外貌不是像厂公吗,,看封面我还以为是国外制作的动画,去电影院看的小心你祖宗半夜问候你,个,
,自来水,,恭喜亏大哦,,说他们好的不是水军就是汉奸,吴京的电影我都看过,这赞你有了,
,这就不是好不好看的问题,,收钱就收钱了,,北师大,但吴京推荐的这部不看,九连真人,
,花钱找骂,,笑拉了,,站着把钱挣了,是吊梢眼,我靠我都喜欢,
,怕不是有个大病,,评论弹幕二刷三刷,,我都不知道看哪里了,不是眯眯眼,我爱罗小黑,
,回形针式的电影,,一看票房库里狂拉,,动图太搞笑了,吴京也是拿钱人了啊,哪吒就是国产动画最大,
,不看,,白蛇起源那个画风就不是中国人,,我记得下一句是当得太监舍得割,看来资本都是一个样,呵呵收了多少钱,
,屁股不正,,电影真的好看的,,还是太容易了,贱不贱啊,我去你的这眼睛能看,
,放,,三个主角同款眼睛,,哪吒,这个,就是好看,
,根本就是屁股不正,,呵,,半佛你好半佛再见,主的说到底还是在洗地,主创自己说这电影是写实风格,
,我们广东人眼睛也不小呀,,难怪被骂,,这么说吧,没钱买奶粉了,各种毒鸡汤,
,X,,告辞了,,人家哪吒一个人都几刷了,电影在剧情方面做的也不好,这里看得下去,
,时间很多吗要浪费在这部电影上,,希望,,因为高考收分低,都不咋的,个人觉得其实哪吒不够优秀,
,你在说啥,,以后孩子长这样,,好,不,这不是纯属恶心人的,
,什么耐心,,票房还不能说明一切吗,,病猫少年跪舔的是洋大爷,电影不好看,知道为什么对韩国人比,
,剧情都是拉胯的,,这叫现实夸张加工吗,,对着国内观众就是高高在上趾高气扬的嘴脸,不是打网友的脸,这个手势,
,还了解个,,这西方人侮辱我们的形象叫加工,,可是他的剧情也是垃圾啊,是打中国人的脸,他们会跳脚吗,
,千万别入坑,,被侮辱你还爽了,,好开,这个主推就是这群人的只要目的之一了吧,因为他们自卑,
,臭水沟罢了,,好的地方就可以掩盖侮辱的事实吗,,差点忘了粤语怎么说了,还给你,现在我看到了同样的一目,
,个人疫情不想出去,,问你形象问题,,全程在看表情包,见不见呐,转,
,基本什么电影都差不多,,你扯那么多干啥,,收益,确实一绝,意识形态,
,它不是主角长相的问题,,做好事多难道就可以做坏事,,代价,动物园的猴子跑出来了,哦,
,而是迎合外国给予中国人的刻板化印象,,这里,,风险,耙,高级脸,
,三只猴吗,,就偷换概念了,,这就是我,叼拒佬姆个系,必须拿奥斯卡小金人,
,广东人,,迪士尼里中国角色照样是眯眯眼,,半佛,我想说,并不是说他不好,
,不买账的飘过,,有的人心里就感觉低人一等,,对对对对,剧本还是国漫电影的软肋,怎么说呢,
,捍卫啥,,有些小警察啊,,小鲜肉和氪金手游也是市场选择的,太尴尬了,建模多多少少恶心人,
,单纯就是太丑了,,看到个能出警的就屁颠屁颠上去骂骂咧咧,,没毛病,票房受疫情影响也很大吧,普通人都是尖嘴猴腮,
,星爷金凯瑞很帅,,我寻思主角都个顶个的好看,,但是,这时候很少人去电影院这也能黑,你可拉到吧,
,但是他们一样能扮丑,,一开始是不是也不会自卑和受欺负,,警告我,,清华美院高级脸,
,你起码给长得像人吧,,唐氏全家桶不咸不淡真是美味,,游戏策划给美工磕头,所以广东人就该长这样,前那个说中国人就是尖嘴猴腮的,
,优秀,,吃啊,,光看人物长相,什么牛马,你是越南猴子,
,好歹要长得像个人吧,,为什么不吃,,要还给电影贡献票房,你是不是包场了,吹这玩意的,
,嗯,,不看,,那就是贱,我都不敢看,祝愿你儿子女儿以后都长这样,
,,,广东人眼镜本来就不大呀,,错付,没人去啊,现实,
,舞狮动态拍得最好,,服了,,说了半天说了什么,我自己怪害怕的,中国有多少偏见,
,背景渲染好,,肠粉真的好吃,,文娱这块儿,尤其午夜它还爆满,这部真的好,
,大哪吒帅啊,,符合西方的眯眯眼价值观回归,,上面属实摆烂了,更吓人,特别后半段个人觉得迄今为止国产动画最佳,
,丑八怪呀啊呀啊呀啊啊,,我就想问,,东方人物形象典范,吴京这个傻狗玩意,超级好看,
,主角可以丑,,如果只表现内核,,自己不尊重自己,就是个戏子,眯眯眼,
,但不能这样丑,,是不是以为可以,,还指望别人会尊重你,真的以为自己是战狼,高级脸,
,你这解说个毛啊,,不用,,下架了没啊,吴京就是戏子,好真实啊,
,你自己懂了吗,,也可以,,下架了没啊,不用过誉,你连争论点都没搞清楚,
,,,剧方说的是走写实,,这电影,就是个小丑,不是大小,
,神经病,,没对好剧本吧,,人家是朝着国外大奖去的,中国片儿,是眼距和角度,
,平行宇宙的广东,,真的丑啊,,可不是不知道审美,整个小眼睛,洗白了家人们,
,主角可以不好看,,K,,这个不叫踩雷区,中国人的钱,恶心,
,但张这么刻板印象,,不是,,是在雷上面蹦迪了好吗,广东人要气死,外媒,
,我可去你的吧,,你不可以弄眯眯眼也可以弘扬文化啊,,一边蹦还一边喊有本事你炸我呀,战狼人身崩了,你看这不是偏见,
,诧,,这就这么简单怎么就不理解呢,,这哪里艺术了,你确定,中国人自己都承认了,
,水什么剧情,,狗都不看,,胖和矮都能舞啊,剧本老套不合理,在佛山读过几年书,
,电影名外国人眼中的中国人,,跪就对了,,这不是半佛吗,眯眯眼也要讲究三庭五眼吧,对这个很亲切啊,
,人家除了狂野美的藕霸,,,,复制自,意识污染的好例子,我也想买,
,还有个秀气的敖丙兜着底呢,,,,站网友,就像是你看一只,可是真的贵啊,
,大护法也不美型,,讨厌,,暴走小兰没什么别的,了狗头的猫,一个狮头不便宜,
,但人物外貌和整体画风谐啊,,建模很久了,,我和女票那天去电影院看,如果一直有事物暗示你那是正常的猫,一样,
,分析的对,,人物就是换头发换衣服,,我俩都快气炸了,你就会认为狗头猫是正常的猫,很好看,
,判断观众感受为什么如此刻板,,@,,你要说不讨论眼睛,广东人的靓仔靓女,慕洋犬你好,
,说得太扯淡了,,你咋又知道,,那就不讨论,哪是这样子的,阿娟剪了寸头后真的好帅,
,对,,你B,,那么我们讨论下剧情逻辑和传统文化,我还真没见过周围有几个眼睛长成这样的,尬,
,是的,,的,,毕竟是参考现实的,剧组人都瞎了,语气突然加强,
,同意,,国漫之光,,导演说这是宣传传统文,哈哈哈哈哈哈哈哈哈哈哈哈,九连真人的歌必须三连,
,青年傅满洲是吧,,缺里程碑,,拉眼雄狮,通古斯人了,放屁,
,块,,这样子的,,这就是你不懂了,笑死了,真是瞎吹啊,
,祝水军们以后生个唐氏综合征的儿子,,外星人看的都觉得阴间,,我算的是政治账,广东人震怒,无剧透好耶,
,祝水军们的儿子比赛第一,,清华美院点赞是吧,,他们想赚的不是我们的钱啦,,舔狗一只,
,然后去工地,,所以说是主创对不起动画制作团队啊,,有个,垃圾电影,你这狗东西收了多少,
,能达到优秀就已经很不错了,,之光,,万点赞的评论没了,口碑是刷的,,
,好看,,这词早都不新鲜了,,对对对,有人分析过了,整部剧都是尬励志,
,|,,你在教我做事,,哈哈哈哈哈哈哈哈哈哈,贱不贱,你舔够了没有,
,几千万里还有好多阴兵,,你在教我做事,,还搞得我们不快乐,不说别的,当你因为这个故事不错,
,眯眯眼恶心,,你在教我做事,,好,单从画面质感确实是国漫天花板,而忽略对中国人的丑化,
,中专毕业证明哥德巴赫猜想这剧情叫优秀是吧,,你在教我做事,,在申了思密达,广东人想问候导演,它的目的已经达到了,
,理中客,,场均,,哈哈哈哈哈哈哈哈哈,京巴就是个抓住流量密码死不松口的戏子而已,这个电影的人设恰恰是最吸引我的地方,
,就是因为大众反感眯眯眼,,人你是真的放屁,,长津姑你不喷一下,把他家里人照片拿出来拉成这种样,因为这个人设才有兴趣了解这个电影,
,没别的,,电影院没去过吧,,儒,你看他愿不愿意这种电影不骂都不吐为快,这么棒的人设好久没看到了,
,纪,,超级好看好吗,,雅,顺德人激怒,我在万达影城打工,
,不是因为主角不好看,,所以英特尔为什么道歉,,随,拉黑了,点映的时候看了几个片段,
,是因为眯眯眼,,说吹的,,和,两广双眼皮超多好吗,真的很不错,
,你到底再说什么啊,,找几个动画更好的出来,,不,谁告诉你是好电影,明天就去看全片,
,纪,,客家人狂喜,,善,你看了能评出好来,某光,
,剧情也不好,,别的都不丑,,言,不是收钱了就是眼瞎了,我听这个音乐,
,谢谢,,单单就是丑化每个人物,,辞,妖魔鬼怪,怎么这么像九连真人,
,点错了,,不是文化入侵,,倒行逆施,就那几个主角跟鬼一样,为什么不卖主角玩具,
,互联网的火热,,敌人已在内部,,不只是电影,那个老头看着挺正常的,我看了,
,水军请得多罢了,,每个都不好看,,整个娱乐行业都是这种趋势,恶心啊,我就要买师徒四人组,
,让人耳目一新,,都是说,,有人在舔在消费就会助长,一个能把生意上升到爱国的人也是有够好笑的,迪士尼,
