,我在广东就没见过这种长相的,,我一定还要再看,年度最佳动漫,虽然不会说粤语但是真的好塑料哈哈哈哈哈哈哈哈哈,配角的形象反而正常了,看完了,庆祝
,别洗了,,愎,我真觉得挺好,哈哈哈哈哈哈哈哈哈哈,刷的也算,后半程是真的震撼,庆祝
,收到不少钱吧,,并没有觉得丑化广东人,年度动漫最佳,做动画的大家都不容易,哪吒闹海,以前还叫人家小甜甜,庆祝
,这确实是关键,,反而觉得展现了广东人的传统精神,啊,没必要惯着你,大闹天宫,这个点戳到我了,哈哈哈哈
,宣发的形象已经不是丑了,,为有舞狮文化的广东感到自豪,对对对,所有人不认可那就是他的错,传统了吧,哈哈哈哈哈哈哈哈,好死
,是有些吓人,,而且剧里面的其他普通人长得也不丑,分,草,人家形象设计也不这样,主角这样反而才平凡真实,看你啥时候回本
,不是人身攻击,,阿娟也不丑,广东人表示骂得好,相当失败且愚蠢,结局看不懂,阿妮亚,滚
,是我真的有点生理不适,,他就是之前发型没收拾过,刚考完,舞狮文化都没搞懂,剧情本来就有大问题,我的女鹅,啊对对对
,蘼,,形象就邋遢了点,不完美,牛老师说你短,对呀,青蛇,多少钱上央视啊
,这就不是人,,而且一开始形体比较懦弱好欺的感觉,但也非常棒,L,他岂不是给国内的这些二鬼子们开了一个头,挺好看的呀,弘扬个屁
,,,愎,这是动漫,这叫艺术,不支持,还有山东话,垃圾
,我没觉得眯眯眼有什么问题,,好多了,本来动漫的表现手法大多都夸张现实,我广东人作证,魁拔都比这强,庆幸看了轩邈解说,狗东西
,是戳到眯眯眼的心理防线了,,不是一个档次,我同学也说很好看,是正宗发音,加两撇胡子,今天和一对母女包场了,打破偏见
,现实比电影残酷,,愎,鸡汤是个明显的问题,就是有点歪,呵呵,超爽,迎合西方
,我就觉得挺好看的,,广东人当然没觉得被内涵,但是后半段的好足以弥补不足,然而这届观众就还真的不行,二鬼子就是二鬼子,还好,臣等正欲死战
,f,,广东是大眼睛地区,中间这个是直接用的大圣归来的脸模,甲方表示不满意,这玩意毁在人物角色上,我觉得很特别耶,陛下何故先降
,确实,,脎,我第一次看完电影气的睡不着觉,不掏钱,这眼睛长得跟外国人一样,是我了,反手就举报
,不用理性,,这片要去国外拿大奖了呢,一想到铺天盖地都是在夸这个烂片的,你在教我做事,加深映像,这不就是我吗,臣等正欲死战
,骂就完了,,脎,气的我连夜写了篇专栏吐槽,对,使人不容易忘记,我只想要个正常脸,陛下何故先降
,我甚至觉得眯眯眼毫无问题啊,,我们都是眯眯眼,兄弟们有同感的可以进我主页一起吐槽,他们可不是搞艺术的,诛心之举,不觉得是国内速写画风吗,为了宣传花了不少钱啊
,没看过别在这里哔哔,,我们就是东亚眯眯眼,有一句回一句,艺术是为人民服务的,不要联想,很好啊,真
,眯眯眼毫无问题啊,,脎,作品的立意是现实与理想,哪些纯纯就是玩钱的,屁的好电影,这个是预告吗,恶心
,唐代化作不都很多是眯眯眼吗,,这个造型哪里丑了,所以主角的反复挣扎我也可以理解,说得好,小学文案而已,我真的忍不住了,眯眯眼的魅力吗
,,,明明每个人特征明显很有记忆点,另外,好开,说真的剧情很多地方其实挺离谱的,中间那个建模眯眯眼真的丑,看过的大部分都说好
,啥西方审美啊上个世纪中国审美也不长这样好吗,,剪影漂亮,主角长的也没有特别丑,,太刻意了,狮子出手办吧,不算感动
,原来广东人长这样,,线条利落,剪头之后还是有点帅的,这不是规避风险吗,大杂烩电影罢了,拜托,阿猫抖腿太好笑了特别可爱
,舞狮题材太小众,,是我画不出来的造型,敢于说真话,站着把钱挣了,对不起,惊艳到俺了,诸臣误我
,角色不好看劝退了大把的路人,,落泪,可真会吹,哈哈哈哈哈哈哈哈哈我反正听懂了,这次我想说,禁不住发出好几声啊,文臣个个可杀
,就像痰盂里装佛跳墙,,我只是觉得这个造型的风格有点像皮克斯,在我看来超越哪吒,所以这制作方属于是跪了,我上我也行,年度最佳,央视也就这样了
,我为什么不再去看一遍哪吒闹海呢,,偏美式夸张的造型风格,梯度封号只字不提,还没挣到钱,原相机还是比这建模好看多点,不接受反驳,央视
,风向就是根子里烂了,,q,而且还网爆过两位巡查员,所以恼羞成怒了,一两个也就算了,刚刚看完,哈哈
,好在还有红旗下长大的孩子很多还保持良心,,必须赞,这不是很过分吗,等到现在了,主角团全这样,比哪吒好看多了,卧槽
,才能抵制这种反人类行径,,昨天刚看了,,最后生还者二的总监尼尔,我可去,哈哈哈哈哈,哈哈
,这个脸也太怪了,,觉得真的很好看,这部动画提醒我们还有值得骄傲的文化底蕴,不懂我的都是精神变态,的,哈哈哈哈太草了,甲级战犯
,臊,,q,和反思留守儿童生活现状,芜湖,,看了,
,雄狮少年在很多个桥段的处理手法就是国内顶尖,,你到底在解释什么,也理解当娱乐消遣电影看的,确实,电影只能算能看黑国人超黑,这段都哭了,去死吧
,没得黑,,q,主的确看不懂,有争议风险的东西就应该学会回避,淙,可以卖狮头周边,收了钱
,我觉得挺顺眼的,,人家迪士尼就是漂亮啊,异类机表示真理吗,除非他这是在故意试探,放屁,我也被这段惊艳到了,当然替人家说话了
,被王者荣耀和白蛇画风霸屏已经很烦了,,都眯眯眼成一个样也是厉害,难道偏要像其他的动漫一样,导演就应该老老实实去找人生孩子,就这剧情,这么听还没有实感,弘扬
,主角就是要好看,,看过了,全都跟西方的动漫长的一模一样,站着把钱挣了,自己不懂别在那乱叫,自己去看了才真的能,的民族精神
,所以一票流量明星赚大了,,真的好看,别拿这样的电影和哪吒碰瓷,陶磊,这电影的剧情实在不敢恭维,到电影营造的氛围,现在的人都不知廉耻了吗
,和事佬,,后面的时候明显感到电影院的人都身子前倾,我就是广东人,勿,主你真的看了吗,侠,来都来了点个踩再走
,讲的很多,,很认真,我觉得很好看,叫他们赶紧滚蛋,难道所有中国人都应该要长大眼睛吗,我也是,沟罕见
,人家说的是在广东采风画风景,,真的好看,真的很好看,很喜欢一款,这种对外貌的评价真的很无语,看预告片感觉可能会俗套,动漫
,不要造谣,,虽然影院的人不多,我和老婆看得热泪盈眶的,的名字,电影是垃圾烂片毋庸置疑,雄狮,不是原创动画吗
,这导演现在敢去广东吗,,但是后面明显大家都惊艳了,清一色眯眯眼,只是名字,说好看的不会没看过电影吧,舞狮子,r
,哈哈哈确实,,他们只是想找宣泄口骂人而已,笑死了,大众点评,眯眯眼算事,岭南文化,回形针也上过央视
,哪吒有混血感造型还是很好看的,,欲加之罪何患无辞,眯眼崛起,可以当桩子,孙红雷不好看,狮头老贵了,回形针也上过
,你不看可以,,别念了,这是一种画风啊,哈哈哈哈哈哈哈,这还是瞳距的问题,我希望有个袖珍周边呜呜呜,狗都不看
,为何要暗示大家不看呢,,已经有点不喜欢哪吒了,边度有广东人生罡裂嘎,狗子好无辜,吴京这货也叛变了,人物很有特点,舞
,前面说,,怎么长得跟猴子一样,唐氏少年,的鞋子造型好看,看过之后就更恶心了,魅力,狮
,因为小鲜肉才看外贸的,,,虽然前面是有尬的地方,质量还好我们就不用看他抵制新疆棉了吗,唐氏少年,厂公,自信你妹
,你真是个活汗剑啊,,你家这是不好看,但是后半部分很精彩的好吧,说的真好,查查吧,人物只是不好看,我们中国人可不长那样的眼睛
,等全世界制作的影视里中国人形象都是丑爆的眯眯眼和离奇的眼间距是好事,,这是唐宝好吗,而且音乐画面都配合的很不错,让子弹飞,没准有几个五十万,建模酸是精致的,哈哈哈哈哈哈哈哈
,虽然我们不需要让白种人,,不是吗,不俗套啊,对对对,听说现在改口了,@,k
,认可,,咪咪眼就是咪咪眼官方加持就不是眯眯眼了,别代替我,说到我的点上了,变成东北人了,南狮,脸皮比城墙厚
,我们,,恰钱嘛不寒碜,看到几百粉我就放心了,审美什么的我无所谓,广东人表示,儿时的回忆,
,但你能不能有点骨气,,`,另外,但你一个赚消费者钱的人扯旗子骂消费者是什么离谱行为啊,你礼貌吗,真的,群众的眼睛是雪亮的
,传播点积极的人物面貌,,你这不是写实的吗,我系畲,咋的,它自己就是眯眯眼族的,把眼睛跟真人差不多大小,原来国人都不懂审美哦
,是真的丑,,还美型的吗,我吹爆这部电影,我不是来娱乐的,吐了,在这原基础上放大百分之二十都好,眼瞎心黑
,又说喜欢,,我以为得锥子精才算,型到嗨,我是来上课的呗,可是电影确实也很难看啊,动画短片角色就必须要有特色有区别啊,睁眼说瞎话
,又暗示大家不去看,,为了小眼而小眼的才是不好,燃到炸,消费者才是爸爸,一个垃圾悬浮故事,正在备考北电动画表示,滚吧
,恶心,,这个小眼睛也算是为了角色服务的没有问题,未睇过,比如陶磊花别人,G,人物千篇一律的反而不会出彩,强你妹夫呢
,又当又立,,眼睛还不够大,很推荐去睇,盖茅厕,吴京还支持过上海堡垒,哇,啥玩意啊
,跟民族没关系,,眼间距还太小,终于有说实话的了,去跳楼,所以这个可以不用理会,牛呀,清华高材生
,我代表我个人不喜欢他,,别想从我口袋里掏出一分钱,我被骂也就值了,赶紧去,G,伫,回旋起来
,不允许吗,,全员唐氏,没关系,虽然说不可能百分百被人赞美,广东人不长这样,亚洲人确实普遍吊眼啊丹凤眼不就是吗,回形针警告
,不是不好看,,来了来了,像我这样敢于说真话的异类,但是有可能百分百被喷,G,s,呸
,是看着别扭,,国漫之光,我是广东人,这家影院我经常去,广东人请你好好放低,但狮头版权可不归动画公司就算火了还不是任何人都可以将其商品化而不用给动画公司分红,我都看不出来这是男的女的
,这都不是丑不丑,,结尾真是很厉害,谢谢你,没错,G,动画电影,回型针我记得也上过
,这建模像个猴,,加油,我看到诸如,因为饿不死他们呗,我斗破不服,去年的奇幻之旅能再刷几年,别人是正儿八经的
,不是蠢就是坏,,票房肯定能过亿,国漫之光,我要点赞了,虎,客家话,唉
,政治喷子马上出现,,哈哈哈哈哈哈哈哈哈哈,崛起,刚考完这个,广东人还地域黑,哈哈哈哈哈哈,胸口闷得慌
,好电影不怕喷子,,不是不行,的词汇就,你一提有点,脸,丧气粉真以为问题出在女主,监制也不是眯眯眼呀
,动画本身就是不限年龄,,是,但就画面这一优点,要我掏腰包还骑我脸,好,傻子吧,我提一嘴
,他就是一个叙事体,,偷换概念,就可以吊打很多了,想个桃子呢,美漫崛起,也对,央视也表扬过薇娅
,没有什么小朋友大朋友之分,,大眼睛也可以有丑人,可以看出国漫真的进步很多了,是的,不行,不然也不会成丧气粉,小声
,因为好看的普通人就已经不算普通了,,而不是所有小眼睛都代表人丑,我觉得还好呀,而不是一味地指责别人的审美被阉割了,战狼和雄狮只能活下一个,为啥一定要卖玩具,打
,真的好看,,我也是自来水很好看真的,其实没那么差,总结,快打起来,画面真的一流,破
,我还是点映去看的,,你这才是偷换概念型,我觉得很好,我花了钱,吃瓜,抛开人物,偏
,故意丑化中国人的形象,,你这自我介绍呢,热血沸腾,是让你教我做事的,崛起是个持续性动作,场景以假乱真,见
,讨不讨喜难不难受是说了算喽,,土猪拱白菜,热泪盈眶,喷的好,新式水滴刑,人物很真实啊,甲级战犯
,因为之前没刷到,,正常,破放了,还敢自我炒作热度,扑街啦,真的人不都是丑的奇形怪状吗,好一个怒赞
,不知道他好看啊,,\,情节真的好,三连了已经,雇水军刷口碑,实话今天看点映,果然不愧是清华美院毕业的
,一系列,,那我也问你设计成这样是不是也不能拍,好哭又好笑,真的,全是眯眯眼,看的时候就感觉很功夫足球,恶心到我了
,意思是如果这次票房好了以后还是眯眯眼,,不要看,感谢有这么一部电影,迷惑发言了,好些都是宽眼距不是故意,最后一个功夫式的收尾,可惜小镇上人的眼睛长得都那样
,其实也不算难看,,你算老几,哪吒不鸡汤吗,太丑了,旁边那个你说是猴子我都信,人设也很接近,希望央视所有主持人都长那样
,广东人不看,,我跟着党走我自豪,男主后边还好帅,给啦给啦,奚,不过观感很好,然后最后去搬砖
,,,我注意到了舞狮文化的美,这么好看一电影,马蹄厨房教你的,就冲你这句广东人,剧情老套,真
,这男主说真的第一眼看上去就像猴子,,也注意到了全员咪咪眼,哪吒的剧情很好吗,不专业就是不专业,不把你头拧下来,人物丑,励志哦
,,,阿猫,男主没放弃过啊,甩锅消费者,老子绝对不看,可能审美不一样吧,细思极恐
,理性,,的造型就是很典型的两广人,真话,脑子是个好东西但是也得有啊,直接震怒,我很喜欢这样的建模,为眯眯眼公然背书
,垃圾,,我们广东人真的不长这样,就是好看,h,我以为战狼吴京会臭骂这电影,真的很有我们村那味,
,理性,,D,画的我觉得很不错啊,好开,可没想到,顺德人,我以为说的是中华民族原来是美利坚民族
,垃圾,,爱了爱了,兄弟,又当又立嘛,利益相关罢了,准备去看,睁着眼睛说瞎话
,,,被种草了,说的太好了,就是,算了,这叫哪门子眯眯眼,我是广东人
,K,,周末就去看,真的很好看,西海带有,这个视频我当没看到,真就没东西黑了呗,感觉我被冒犯了
,活该,,配角也长得丑,画面渲染美的我惊呆双眼,是吧,吴京只不过是爱钱而已,青蛇我给到,只听说过奉旨守城
,,,就是丑,不觉得强行煽情,打工人都知道要去迎合社会才能过的更好,他拍战狼就是爱国了,分,没听说过凤子投降
,难道不是因为水军不成功吗,,丑,刻画山村留守少年很深刻写实,这些人非要对着干,他只不过是看上爱国片这个大,是因为视觉效果,这眼神很难打破偏见
,,,丑,在我这里这部平凡人的故事超越哪吒,该,而已,剧情和逻辑不及格,V
,w,,就是丑就是丑,赞同,被卷进电子厂的,不然他也不会现在站出来发声,确实,央视翻车也不是一次两次了
,可以不好看,,反正我不会去看,前面口号鸡汤不否认,宝买家,毕竟钱给的太多了,那个说白蛇,广东人不长这样
,但不要丑,,,但生活的转折就是这么突然的,默默退出视频,都是刷的分,的,你妹的
,没有听过,,长得有特点的人物其实更难塑造,里面的角色塑造人物形象,好开,满眼的唐氏儿,你脑子没问题吧,自信你个鬼打破偏见
,那就是不优秀,,你这不是偷换概念,导演是不是喜欢唐氏综合症的患者,跟了,离谱,看完了点映,就是为了迎合西方审美是吧
,披着半张欧美丑皮的假国漫,,他这个动漫三次元长这样你就喜欢,哪吒不如这个写实,艺术孤独,卧槽,配乐真的太绝了,给清华美院道歉
,确实奇奇怪怪的,,欲盖弥彰了属于是,挺好看的啊,赚钱要从众,猴子,毛不易那首什么时候上音源,抛开眯眯眼不谈他们的设计很好
,A,,一堆外国狗收钱了来抹黑国漫而已,本广东人不想被你代表,陈星汉直呼内行,外国当然给你颁奖,毛不易那首放结尾非常点题和升华了,是美的表达
,我觉得还是大家对舞狮文化没有兴趣,,还有很多不懂事跟风的,谁规定主角就一定要很帅或者要广东大众脸,疯狂动物城,因为你把他们的定义戴在头上,哈哈哈哈我早就想说了,艺术的表达
,没看,,有粤语版么,真的博眼球,不好意思美末,狗都不看,话说双城,央视是个什么牛马
,求求了,,真看不了,我出了影院几个小时都没缓过来,市场很好,剧情垃圾,话说双城还没看吧,唐氏少年
,我们是广东人不是外星人,,怎么眼睛这么小啊,对不起说实话我觉得很好看,销量,土著广东人里七八成大眼睛,一看就是一股清流,垃圾电影抵制
,猫科不是大眼睛吗,,你稍微正常一点好吗,这部电影明明很好看,万,双眼皮,哪里俗套了,恶心
,好看,,高中学校到处是木棉花,我的眼睛很小,你不喜欢是你的问题,笑死商业电影拿什么跟宫崎骏的比,小说里都不咋这样写了哈哈,我呸
,不看,,自己要有自己的见解,我不认同,国内观众最不容易,往死里夸的不是拿钱了就是脑子有问题,哇,一眼丁真
,睁着眼说瞎话,,眯眯眼就是丑化,有一说一,看到标题我反手就是一个三件,去除滤镜化,我特别喜欢女生梳这样的发型,赢
,现在还能找到起码能看的电影吗,,那可真是被带节奏了,准备二刷,粤语阿,加上白人老爷的滤镜,老短发控了,什么回旋
,其实很多地方出现设定混乱,,我们值得更好的,不能打一分吗,虽迟但到,剧情好在哪,主角真挺好看的,央视还宣扬过柳传志
,不知道哪里写实了,,这剧就算了,前面你属实是重新定义普通外貌,好开我跟,不好看啊,个性十足,相信资本的力量
,导演屁股歪,,我觉得美国应该展示真正的东方文化,分,都在下沙啊来吃饭,那你为啥不说说张苗作为制片人的那些电影呢,昨天去看了点映,拉上央视洗地
,卷帘大将不同意自来水,,你自己看看兄弟,我发现一些无脑护子口头禅就是我觉得很好看啊巴拉巴拉的,好开,感觉不行,结尾太惊喜了,也没用
,别人还说是照着东北人做的,,美国剧里中国人都是长辫子像猴子跳着,广东人表示好看好亲切,不在乎亏,陈查理一家,想二刷,老百姓不喜欢
,哪来的自来水,,被美国人追赶着快快,在下广东仔,股票大涨,大家搜一下看看,好洗,你算老几
,这建模已经不是不好看的问题了,,眼睛还要弄成斜眼,表示场景真的令我很亲切,铺天盖地宣传,吴京盲目吗,而且明年虎年,雄狮少年真的是很棒的电影
,简直歪瓜裂枣,,我认为这是非常过时的,分,械,这是人脸,尚气的请你们来做宣传,要不是尔等
,剧情不错,,这些不是小日子过得不错的人的典型长相嘛,我刚刚看完,好开好开,还没孙悟空的脸好看,追光的编剧不行,这票房还惨
,很好看,,广东人绝对要去看啊,之所以觉得俗套感觉有一些内容没能打动人心,哈哈哈哈,男主的脸妥妥猴子脸,但是动画特效什么的做的可以,去尼玛的
,可以不好看但要耐看,,夸张加工,票房凉凉,这狗子太可爱了,一绝,眼睛小不配当中国人,臣等正欲死战陛下何故先降
,逻辑完整,,是吧,广东人表示我们不长这样,明显讨好鹰,真特么丑,眼睛不瞎都看得出来这画面有多好,希望觉得这正常的人的后代
,不说好看,,你喜欢推荐就是了,哪吒也不行,你也可以去打鼓呀,还是凡人好看,说破大天去,代
,你起码差不多吧,,干嘛,没看过这部,广东靓仔来给你三连了,谁的眼睛后角是翘上去的,这主角我看了难受,代都这样
,这建模简直鬼畜区风格,,不喜欢这电影的人,但哪咤也不怎么样剧情老套,怕不是想去国外评奖,W,哈哈哈哈哈哈哈,臣等正欲死战陛下何故先降
,不是好看难看的问题,,难道不是吗,终于有说真话的了,闪现跟了,一堆人吹国漫天花板,本来种草了,臣等正欲死战
,他这长相就让人们想起了西方对中国的嘲讽和鄙夷,,就喜欢,关键是眯眯眼自己骂自己,让子弹飞,我呸,跟那吒一样,陛下何故先降
,所以啊,,不同看法的人,关键是眯眯眼,好喷好爽,这个,不看了,收皮啦你
,只是对人文地理采风,,我真的要说,果然只有,好开,功力挺深厚了,眯眯眼咋了,中央电视台有没有看电影啊
,人物呢,,去看,关注的,老婆比居然喜欢女的,一开始都看不出屁股是歪的,你们全是迪丽热巴,中国是人民当家作主的国家
,没有考察还要设计成这样,,四个吊角眼,笑死了这个,我失恋了,居然还吹剧情好,迪丽热巴才是欧美审美,我去你大爷的
,不是更有问题,,这是国人,国漫在仰卧起坐,哈哈哈,懂了,崇洋媚外,写实风格
,这前倾到夸张的脖子,,你也知道说的是烟熏妆丑啊,这里面有一个像人的吗,`,该洗剧情了,什么诡辩,这可是你说的
,简直像个猴,,而雄狮的丑是因为造型么,国内大厂都没投钱就能做出来的能是国漫,所以颜控追鲜肉都是合理合法的,新套路是吧,不需要帅哥美女起码是个正常人,然后广东同胞就他娘的长这样
,二鬼子洗白,,是因为妆容么,全部眯眯眼,确实很宽容,吴京投钱了啊,看看左边那个跟猴子都有得一比了,呵呵
,咴,,是因为刻意造就啊,就很离谱,确实,什么样的中国人才能得到美国人这么信任,你收了多少钱啊,混进去的不少啊
,这个老板娘的眼睛不就挺正常吗,,这俩眼中间得装电梯了吧,反正看的时候,宽容的离谱,细品,不是,披着舞狮的皮全面侮辱舞狮文化和中国人
,非要搞个眯眯眼,,你说的再多国外主流还是好看的,我根本没留意这个眼睛的问题,好喷,资本无所畏惧,这几个动作镜头都来回折腾多少遍了,n
,咴,,你怎么不去抨击他们,我觉得人物设定很可爱啊,支持,没看,,自信你妈
,剧情也烂,,刚看了个天降神机,单眼皮很可爱俏皮,t,卖人情发的,不是丑,臣等正欲死战
,别洗,,人家那叫丑,看惯大眼睛已被洗脑觉得是卡通就应该大眼睛本身就是种偏见,去拧螺丝吧,我丑再也不能怪我娘了,而是第一眼我还以为是欧美制作的电影呢,陛下何故先降
,引起共鸣,,好吧这个真隔应,分,我觉得,陈漫这个都比刚才的图好看,还有椅子乐团,消费民族精神
,想迎合国外拿奖,,垃圾,分我都嫌多,蜘蛛侠,太恶心人,所以当初为什么骂耐克,恶心
,广东人有被冒犯到,,真的好看,确实半斤八两,平行世界,广东人招谁惹谁了,,这种能买到央视去吗
,眯眯眼在广东不多啊,,收钱了,还有眯眯眼,应该是,恶心人,双标得让人恶心,绝无
,而且这还一整批,,还有那个老爷爷的山东话,再发展下去就是奇行种了,天师道的白正山,这就是人情客套转发,野心之作,主持人不是眯眯眼我不是很认可
,自来水,,我一个山东人当时听了特别亲切,别别别,掐烂饭,吴京转发过的人情电影多了,剧透了剧透了,绝无回旋余地
,因为所有都很写实,,说尬吹的建议你先买张票去看看,我就是广东人,审美多元化,也没说好与不好,太双标了,钞
,显得眼睛很刻意,,不要人云亦云,我觉得很好,半夜不怕鬼敲门前提是生平不做亏心事,黑你还要较好,九连,恶心
,X,,距,我觉得好看,片方买那么多水军尬夸就知道有多亏心了,这是作践国人讨好国外审美的,哪吒的故事比较拉胯,滚
,是的,,哈哈哈哈,一两个眯眯眼可以解释成个例,看来还是白瘦幼好,作品,这三张脸在我们我的家乡潮汕地区就见过,花了多少钱买的
,我就没见过眼间距这么宽的人类,,啊对对对,三个没有血缘关系的主角全是眯眯眼实在是让人难以忍受,安全,黑自己还要去叫好,我潮汕地区乡镇也是这样子的场景,有央视背书就厉害了
,垃圾,,眼睛全是长得跟妖怪一样,但凡是粤配突兀感减半,半夜,什么网友的脸,恶心,央视又不是没被冲过
,电影,,还好看呢,普通人而已啊还要怎么惊世骇俗,元一张票爆满,那么代入,剧本太差了,
,不能让这部电影到国外上映,,安利到了,其实哪吒也一般般,票房起码,雎,除了有些小巧思在,长得跟猴子一模一样
,家长们该是你们发出影响力的时候了,,这才是正常人的脸吧,咪咪眼真的棒,以上是刷的,网友乐意,这部也是一样啊,这可不是我们中国人形象
,看到那三个人的丑样还会去看电影,,都要和日漫美漫一样都要有那么大不协调的眼睛,可真的是好看,好开,广东人不知道比你这些黑子好看多少倍,俗套的展开,绝无回旋余地
,很火热吗,,这,啊对对对,精神变态,那国漫就真的完了,最后喊出金句,什么破玩意儿
,我今天第一次听这个电影,,家危险了吗,我是俗人我觉得非常好看,叫我靓仔,爱国是门生意,昨天看哭了,咳
,这就是丑啊,,哈哈,哪吒也很多鸡汤但瑕不掩瑜,打醒这群龟孙,大伙儿给贡献个一星吧,人物建模真的很好了,U
,我还不能觉得丑了吗,,鼽,我觉得好看,食得咸鱼,广东人表示不服,真人不行,狗都不看
,想多了,,是你在偷吧,我觉得超级好看,抵得渴,豆瓣评价不了低分,动画行,什么垃圾
,我之是没时间,,扎心了我现在就长这样,个人年度最佳,有点结果论,第一反应像唐氏和阿凡达,赶紧通知老外,资本好手段
,觉得吊角眼,,谏,一般,饭圈狂喜,是大,佛山的话,
