,他设定成任何一样,,国漫之光,,,,,
,都可以问出这种,,要钱不要脸,,,,好看,
,话术型,,这钱赚的真寒颤,,,,燎,
,问题,,你这也没少收钱啊,,,,唯一觉得可惜的是没听到一句粤语,
,为啥非得这样呢,,就因为眯眯眼否定整个故事,,,,上次青蛇就是上了当了,
,你屁股歪,,真的太片面了吧,,,,快跑吧,
,放屁,,还有椅子乐团的歌,,,,拉倒吧,
,安利,,乐队的夏天恐成最大赢家,,,,技术层面完爆,
,就是因为,,唐氏综合征眼睛是用来取悦外国评审的,,,,哪吒,
,好看,,你明白了吧,,,,哇,
,剧情好是及格线,,看到票房真为主创们不值,,,,这锣鼓声,
,主角帅,,听见,,,,广东人表示,
,才是优秀的标准,,主说,,,,喜庆的感觉上来了,
,笑死,,国漫之光,,,,这舞狮,
,导演制作不得好死,,就知道肯定收钱了,,,,比我从小到大,
,广东人,,这,,,,见到的还要漂亮,
,,,主就是骂人起家的吧,,,,这就是在广东能日常看到的哦,
,剧情也不怎样,,真会骂呀,,,,阿,
,看过介绍了,,直接对线去呀,,,,呸,
,广,,发视频想带动粉丝吗,,,,你去看看日漫里有几个眯眯眼,
,城中村的土豪要去上海打工,,w,,,,就我们中国人要接受,
,野路子这么容易就赢了正规军,,哈哈哈哈哈哈哈哈哈,,,,西式审美,
,算了吧,,它不是,,,,点个踩,
,剧情不错,,写实,,,,票房真的震撼到我了,
,社会,,吗,,,,基本所有,
,是,,人家二次元可没说自己,,,,都被充值,
,是,,写实,,,,票房还是一塌糊涂,
,啥都是我的锅,,太罕见了这电影,,,,根本没人看,
,王宝强好看我们才喜欢他的,,真罕见呀,,,,别和哪吒比了,
,不不不,,这钱也给太多了吧,,,,哪吒,
,我是在捍卫我的钱包,,粉丝的号都可以不要了,,,,亿级别,
,一部片子只要有一点黑点我都不会掏钱去看,,傻不拉几,,,,这片,
,人均二十一三体综合征,,主角不认命,,,,一亿票房不知道还有没有,
,导演采风采到哪家医院去了吗,,结局你看了吗,,,,雄狮少年的鸡汤真是尬到我,
,蓝衣服的像个猴子,,后期寸头站在桩上,,,,台词也尴尬,
,按时我们没进化完全吗,,背挺得板直,,,,索尼克都能重新设计形象,
,气,,眼神坚毅肢体灵动,,,,好家伙,
,唿,,帅爆了好吧,,,,离得好近啊,
,不听,,哪吒谁骂过丑,,,,这是广东的狮子,
,滚,,偷换概念,,,,别的地方的人看得懂才怪了,
,套星爷的操作,,我觉得电影本身还挺好看的,,,,别跟我说都是中国人都能看懂,
,还说可以去你的,,偶像剧看多了,,,,故事上取悦中国人,
,活该,,主要是跟风太严重,,,,形象上取悦欧美人怪不得在法国得了个最佳东方形象奖,
,看了,,说得好,,,,毕竟你家里长这样,
,但是没完全看完,,这才是重点,,,,理解你,
,就像白蛇系列,,里面的场景我一广东人看着很有亲切感,,,,讷,
,画质提升,,E,,,,恶心,
,剧情拉垮,,里面的音乐也很棒,,,,就硬洗吧,
,屁,,i,,,,别多刷了,
,这是唐氏综合征患者的形象好吗,,佛山人路过,,,,给你的经费都不够电影票了,
,我记性不好,,目测是南海那边的村子,,,,收钱了,
,怕忘了你前面说了啥,,i,,,,分得清画丑状和长得丑嘛,
,是好不好看问题吗,,真心推荐大家去看看,,,,感谢安利,
,是里面一群唐氏综合征单表国人形象,,i,,,,真的强推,
,这是丑的问题,,长的丑就一定要咪咪眼,,,,我对动画会有特别的期待,
,广东人造孽啊,,两眼距离比我到彭于晏的距离都远,,,,二刷了,
,被这样黑,,一百个中国人里面能找出一个来,,,,呵呵,
,我选择抵制到底,,这电影三主角三个长这样,,,,狮头多帅,
,某些人认为我们支持国漫他们就可以不要脸了,,,,,,阿娟短发造型多帅,
,不是不优秀,,能不能多些民族自信,,,,请那些老爷们,
,是根本不优秀,,加油,,,,去看看吧,
,,,是的,,,,别让它被埋汰,
,我广东人眼睛小了,,可是我刚看一个广东土著,,,,静待粤语版,
,噗,,在骂它,,,,d,
,你收钱了吧,,这,,,,罕见,
,重点不谈,,我还是再等等吧,,,,没良心啊,
,他侮辱我们,,没看真的会后悔,,,,阿对对对,
,这种三流导演拍的给他主子看的烂片,,偷换概念给,,,,泪目,
,导演还是原地螺旋升天比较好,,主玩明白了,,,,在期待的时候给我迎面一击,
,屁,,广东人,,,,嘧,
,大眼睛双眼皮是广东人的长相,,你今天照镜子了吗,,,,啥时震撼所有人了,
,电影哪吒的人物造型也不好看啊,,所以他广东采风的结果是,,,,还有点惊吓,
,但没妨碍它票房大卖啊,,广东人全体唐氏儿,,,,都是原创的音乐,
,呵呵,,哈哈哈哈,,,,配乐真的很好听,
,不算烂俗,,碰到很多了,,,,这个真的值一张电影票,
,主角最后还是去工地打工这不一般,,收了多少,,,,师傅大招太猛了,
,孩子再努力也逃不开工地,,片尾字幕大力感谢渲云,,,,风言风语已经成功了,
,我觉得,,技术支持,,,,强词夺理,
,主抓不住风评差的点,,难关他们公司农场经常爆满呢,,,,恰了饭的视频,
,眯眯眼侮辱,,原来你知识自己人和自己人比啊,,,,主语调都正经了很多,
,不是丑的问题,,那没事了,,,,滚,
,不是丑的问题,,什么,,,,恶心,
,广东人表示感到极大的侮辱,,解释,,,,您是不是对追光有什么偏见哦,
,丢内老牟,,癫疯,,,,人可以丑的千篇一律,
,广东人不答应,,甲方给了不少高清素材啊,,,,但是别这么刻意,
,几十块钱,,主能发一下枪版吗,,,,开始了开始搅混水了,
,而已,,挝,,,,都给我去看太好看了,
,,,甲方给了不少高清素材啊,,,,前面那个像同学的,
,你在说什么啊,,主能发一下枪版吗,,,,这个主角巨像我男朋友哈哈哈哈哈,
,s,,支持,,,,我笑了一晚上,
,这是单纯的不好看,,主,,,,,
,不设计成这样怎么去法国拿奖啊,,真希望你以后的子女都长这样,,,,看完了,
,剧情很一般,,多给你点自信,,,,我觉得可以,
,说了好像又没说,,收钱的不少啊,,,,画面是真的,
,那你也是纯纯罕见啊,,y,,,,对,
,没看,,这眼睛在三次元还不如日漫呢,,,,那段真的能感觉到主角的成长,
,看到这个满脑子都是傅满洲的形象,,只要我站在道德高地就没人能击败我,,,,陈家祠,
,这不仅仅是好不好看的问题了,,梁宏达也上过央视,,,,荔湾湖,
,这是拿着国外侮辱你的东西定义你自己,,三刷那个,,,,对,
,纯恶心人了,,骂自己爸妈骂起劲了,,,,光影用得非常讲究,
,不是因为眼睛不好看,,闭嘴吧,,,,尤其是阿娟在佛像前一次次,
,是因为有,,都说了,,,,光影都有变化,
,的问题,,她也长这样,,,,说丑的,
,看了这个宣传就不看,,钌,,,,自己照照镜子,
,丑到炸裂,,阿娟不是女的吗,,,,你还不如这呢,
,而且急剧侮辱性,,钱没收,,,,卧槽,
,踩狮头砸饭碗,,钱还没收,,,,我要去看,
,得冠军去打工,,没收钱,,,,都是水军,
,这也太丑了中间那个,,没收钱,,,,真厉害,
,辣眼睛啊,,你在广东八年看见广东人长这样,,,,有这钱不说重新建模,
,不会看的,,你在广东八年看见广东人长这样,,,,反而请这么多水军,
,这是广东人被黑的最惨的一次,,b,,,,真不知道导演怎么想的,
,傅满洲,,好恰,,,,那么为什么要做成眯眯眼呢,
,广东人表示有被冒犯到,,,,,,就这个人设,
,不好看,,刚看过电影,,,,就把我恶心到了,
,那叫怪诞,,真的推荐,,,,这个眼距就离谱,
,滚,,大眼睛的小眼睛的,,,,是的,
,广东人是眯眯眼,,都出风头了,,,,人可以不好看,
,放屁,,正常人呢,,,,但这个眼距是真的太宽了,
,闵,,电影火到国外,,,,我买票看了电影的,
,每次都这样说感觉就是收钱了再洗,,是不是洋人,,,,共同特点,
,别这样我在广东打工,,的依据啦,,,,神话基础,
,人家不长这样,,我觉得可以丑的随意,,,,什么小学生作文,
,导演跟广东人有仇,,但不能丑的刻意,,,,直接举报了我,
,我还以为胖子是主角,,真的,,,,看到后面,
,写实,,狮头太亮眼了,,,,我觉得阿狗胖胖的好可爱,
,你现实中找个长这样的人给我看看,,开始了嗷,,,,在,
,长相已经触发了恐怖谷效应了,,粉就这么傲慢了,,,,有钱一起恰,
,潜意识就抵触,,这你说没收钱我不行你是做动漫行业的,,,,哈哈哈还真是这个调调,
,眯眯眼只是其一,,收了多少钱啊,,,,收钱了是吧,
,主要眼距让人很难受,,这也可以叫国漫之光,,,,这拿钱办事,
,我是安揪,,可能这就是老外的女友们吧,,,,哈哈哈,
,在直播连麦中高强度羞辱嘲讽不喜欢雄狮的水友,,就这德行没辙,,,,真的好看,
,我是安揪,,开始骗票房了,,,,唐,
,在直播连麦中高强度羞辱嘲讽不喜欢雄狮的水友,,开始骗票房了哈哈哈哈,,,,枰,
,谁吹这部影片我就祝谁全家都长这样,,关我,,,,唐氏少年,
,长这样,,事,,,,强行说人物形象好看符合现实的你那个唐氏儿你站住,
,绝对不会看,,国漫之光,,,,万是吧,
,最好别,,偷换概念,,,,滚,
,去掉,,哪吒这角色是独一无二的,,,,剧情能猜到,
,主流审美,,可这导演说广东人就长片里的样子,,,,就别怕剧透了,
,我觉得是不符合碳基生物的审美,,你和二鬼子也是同一群哦,,,,因为太套路,
,不会讲就别讲,,癫疯,,,,所以无所谓了,
,不是好不好看的问题,,我再说一遍,,,,z,
,你现实中见过几个人眼角吊成那个,,中国人不长这样,,,,不是缺点,
,样的,,制片方说什么让国人自己照镜子看看是不是长这样,,,,还指着这个建模去拿奖呢,
,这已经不是好不好看的问题了,,他什么牛马,,,,怎么能是缺点呢,
,这里面个别人物形象的眼睛都快要上天了,,技术好所以就可以污蔑别人,,,,也没觉得是缺点,
,形象不用太好看,,以后遇到这个,,,,缺点是电影前半部分节奏太差,
,但也不至于刻意弄成这样吧,,视频要躲开,,,,收了多少钱,
,这一个镜头,,容易被雷劈,,,,先有动漫后有狮头,
,左边的阿猫对比北京人,,g,,,,冰淇淋很好吃,
,猿人,,唐氏小姐,,,,但没必要吃一个沾着苍蝇的冰淇淋,
,形象,,隔这偷换概念呢,,,,毕竟还有其他冰淇淋,
,你会发现一模一样,,你有病,,,,不是片面的问题,
,么,,佛山和广州相距,,,,看这个封面我就不想去电影院啊,
,,,多公里走着去都行,,,,E,
,没有自来水,,经典反击,,,,刚出电影院,
,俯,,哈哈哈哈哈哈哈哈,,,,剧情真的很好,
,哪吒眼睛很大,,这人物塑造的是猴,,,,年度最佳恐怖片,
,丑萌萌,,后悔去看了,,,,如果眼镜在调一下,
,软洗,,真的不好看,,,,票房肯定不少的,
,这叫站着,,听不下去了,,,,诶,
,这片子枪版我都不看,,我之前怎么会关注你这种,,,,你可以丑的很随意,
,我感觉是人们在模型的纷争中反而忽视了这种,,视频里刷了多少弹幕,,,,但别丑的这么刻意,
,的剧情,,好说自己没收钱吗,,,,狗都不看,
,剧情烂,,屎,,,,,
,我觉得是因为难看,,我以前关注你时我以为你是个好的影评人,,,,天台这一段我喜欢惨了,
,电影故事难看,,现在我知道你是什么东西了,,,,^,
,这叫第一印象,,不是眯眯眼啊,,,,画面还不如,
,哪吒形象没说是去哪采风呀,,是眼距和角度吧,,,,年,
,代表哪哪的人的长相,,你是收了多少钱啊,,,,的水平,
,监制就是歪,,说得好,,,,洗啊,
,缝合怪,,说得好,,,,就硬洗,
,你确定剧情好,,你在说什么,,,,再洗老子也不会去看,
,自来水,,勾罕见,,,,使劲吹赚钱吗不丢人,
,符合啊,,你这种也无脑,,,,哈哈哈哈哈,
,符合老外对中国人的主流审美,,谢谢,,,,眯眯眼就是新意,
,u,,一堆无脑评判一个无脑,,,,讲这个故事的那颗心,
,不用多好看,,对,,,,怎么会被那样恶意揣测呢,
,但这已经属于故意恶心观众了,,无语了,,,,您这个视频真得给三连,
,r,,都是民间组织,,,,真的很岭南,
,你不用洗了,,官方没设立这种,,,,鸡汤剧情没事可透的,
,再洗也没人看,,都是民间组织,,,,这个塑造丑角可以塑造小眼睛的,
,日本的足球小子是这副德行吗,,不是官方,,,,不能全都是这样小眼睛的,
,吹牛逼嘞,,查查有没有外资资助,,,,不刻意吗,
,广东人眯眯眼,,芟,,,,什么烂钱都有人吹,
,我扇死你,,国漫之胱了属实是,,,,打破偏见,
,狗都不看,,你可以说他画面好看,,,,笑死我了,
,绝对是垃圾,,你可以说他音乐很赞,,,,真人造型不行,
,没看,,但是不让人说人物设计,,,,动漫可以,
,不看,,剧情漏洞,,,,懂了这就去给清美道歉,
,唐氏少年,,就是你们的问题了,,,,垃圾垃圾垃圾垃圾垃圾垃圾,
,山顶洞人,,回形针还上过央视呢,,,,整个广东的人都会觉得非常亲切,
,狗看了都成眯眯眼,,美女你素材好多喔,,,,真的很好看,
,群众的眼睛是雪亮的,,哪来的,,,,谢谢,
,屎,,回归崇洋媚外,,,,主,
,听完这个话,,那你这个放三次元长什么样呢,,,,没,
,我庆幸没投币,,你在说你吗呢,,,,烂钱,
,打死都不看,,批评总是可以吸引人,,,,但是这个画风很写实啊,
,剧情垃圾,,所以不用管太多,,,,我喜欢最后对手的鼓手都齐心击鼓的那一段,
,私活一大把,,每个好的作品都在用一点点的进步,,,,正本清源,
,写实没有,,来推进,,,,挣谁的本,
,导演就是为了现实拿几个国外奖,,真丑啊,,,,清谁的元,
,那么它的剧情好吗,,里面所有人都长这样啊,,,,本视频不含任何商业推广,
,笑死,,别啥都带农村人,,,,你这样片面的否定所有人就不是片面对吧,
,剧情也不好,,我们农村人没长这样的,,,,论,
,要现实不现实,,那你知道,,,,不蹭别人的作品就洗不了地,
,要梦想也没梦想,,最终幻想,,,,呵呵呵,
,为什么主角一定要好看呢,,圣临之子,,,,跪着说没有偏见,
,长相不好看的人不能成为自己人生的主角吗,,么,,,,为什么每个推荐的号都要强调没收钱,
,啥眼睛都行,,可是丑能不能别突出小眼睛,,,,这也叫好故事,
,你偏挑个这个眼睛,,全都小眼睛还都是斜吊眼,,,,尬的我不知道多少次低头玩手机了,
,这不说你是内鬼,,不要什么钱都恰,,,,这洗地洗的太不专业了,
,谁信啊,,够,,,,我都看笑了,
,z,,国产之光,,,,我呸,
,这是丑不丑的问题,,真的太光明了,,,,这弹幕好奇怪鸭,
,这是西方强加给中国人的阴暗形象,,建议所以角色形象都是这样的,,,,这烂钱也恰啊,
,周游世界别人都夸你眼睛大一点都不像中国人你应该高兴还是痛恨,,凸显特色呢,,,,放屁,
,剧情垃圾,,清华美术学院是吧,,,,粉转路,
,且厌世劝你要认命,,所以西方人说我丑,,,,这不是没有特色是审美长大众雷点上也能洗,
,那是唐氏综合症的长相,,我还非得跟着别人走吗,,,,这电影后劲很强,
,并没有,,他们觉得丑就一定是对的吗,,,,回来一直刷相关视频,
,经不起推敲,,为什么一定要纠结外国人赋予眯眯眼的意义上,,,,我从阿娟去打工那段就一直哭,
,你不是在洗吧,,不能当老外放,,,,丑死了,
,桴,,吗,,,,W,
,说得有道理,,不是不能丑角,,,,奇迹,
,都他妈站着说话腰不,,但你必须承认这是一种丑,,,,这宣发费真的离谱,
,剧情也烂,,别扯审美多元化,,,,大,
,多元化文化允许各种类型主角,,别扯是现实,,,,都在夸,
,并不都要帅的,,我们也不是傻子,,,,只有小,
,根本不是好看不好看的原因,,投诉走一波,,,,在说实话,
,这种蓄意扮丑真让人恶心,,我有点怀疑国漫之光的看过国漫吗,,,,我只能说,
,丑得万里挑一,,祝你以后的老公,,,,电影版回形针,
,剧情好个,,女儿,,,,给的太多了,
,一个少年脑子一热就打败了专业舞狮队,,儿子都长这样,,,,搁着拉踩就没必要了,
,剧情哪里好了,,群演不认同,,,,收了多少钱,
,是半夜包场,,我已经成功被,,,,今年就没几部动画电影好不好,
,的事情,,安利了,,,,笑死了,
,建议大家最好不要去老福特,,等网上有资源了一定下载来看,,,,这也叫好,
,那边的话真的大多数都是洗白的,,我觉得夸张也不应该是这样,,,,没必要踩别的捧这个好吧,
,还说是我们审美不够高,,v,,,,啊对对对,
,很好看,,收了多少钱,,,,笑了怪物的眼睛都比你人的眼睛好看,
,差评,,P,,,,A,
,丑还是形容正常人的这已经不是正常人了好吗,,有什么大病,,,,庸,
,估计你买了他的股票了,,广东人谢谢你了,,,,真就搁着双标,
,这就是故意,,的每一句话前面都应该加抛开事实不谈,,,,背负成见,
,跎,,专门抓有逻辑漏洞的说是吧,,,,啧啧啧,
,哪咤起码没添加私货,,太不要脸了,,,,这帽子扣的,
,跎,,这广东兄弟能忍,,,,能别碰瓷其他优秀国漫么,
,丑可以,,问题是全是丑的啊,,,,恶心,
,但不可以跪,,美与丑之前结合一下吧毕竟是给人看的,,,,关键是没给你小钱钱,
,k,,听别人说什么就是什么永远不能认识到自己真正想要的,,,,我们关注舞狮文化,
,呵呵,,也就丧失了自我,,,,但是不看这烂片,
,法国人好像给这片评了个奖,,成了别人手里的枪,,,,这片能代表舞狮文化,
,剧情缝合,,我就是因为造型丑,,,,啧啧啧,
,洗都不会洗,,不去看,,,,跟风欧美眯眯眼就不是跟风了,
,我也是自来水,,打差评,,,,你接着吹,
,因为哪吒的片子里什么样的眼睛都有吧,,怎么了,,,,拉踩,
,狗都不看,,y,,,,,
,是吊梢眼,,呵呵呵呵呵,,,,客家话,
,因为主角不好看,,我又去刷了遍哪吒,,,,扑街仔,
,就不看,,就是不买票,,,,你拿了多少钱,
,这都有些什么人,,钱在口袋里面不喜欢就不买,,,,这片这么牛笔,
,这烂剧情不错吗,,什么时候向中国市场低头再说吧,,,,放屁,
,你可拉倒吧,,哪咤也不认命,,,,电影好看,
,俗的不能在俗的剧情,,但是剧本就呵呵了,,,,我都四刷了呐,
,制作组也不懂舞狮装懂,,骗票房是吧,,,,小伙伴快去看吧,
,这不是主角好不好看的问题,,骗票房是吧,,,,啊对对对对,
,这就是辱,,骗票房是吧,,,,很简单,
,你可以接地气但请别接地府,,骗票房是吧,,,,画稍微正常一点,
,你要说剧情好看,,啊对对对,,,,票房和口碑会更好还是更差,
,那我就不想听你废话,,L,,,,如果答案是更好,
,不过是蹭流量,,当大家都是傻子,,,,片方不这么做的原因是什么,
,狗都不去看,,主角最后还是打工仔,,,,智者不饮盗泉之水,
,,,不是按颜值分配了未来,,,,自重吧,
,怎么可能怎么可能大可不必,,看你吗,,,,曾经挺喜欢你的,
,原则性的问题,,希望你以后儿子女儿都长这样,,,,这个动画制作组是为了迎合西方审美,
,为了以后我们的底线不被拉低的问题,,眯眯眼怎么啦,,,,故意这样做的,
,狗都不看,,五十万粉怎么来的,,,,而且之后的发言态度非常恶劣,
,奥斯卡提名预定,,去尼玛,,,,非常的自以为是,
,E,,所以,,,,不听取意见,
,你说话有一点逻辑吗,,看到这里我才明白,,,,但是这个男女主也长这样,
,这么多无脑喷子,,你是搞基白,,,,你普通人长得普通就不能换一种普通的方式吗,
,你们可以不看,,真的好看到爆炸,,,,阿婆主邓菜籽分析的好,
,但不要自取其辱,,感动哭了好几次,,,,因为他的五官不符合人体的合理性,
,太他妈雷人了这社会,,主全家长这样,,,,不写实,
,你在说什么自己知道吗,,我们错怪他了,,,,所以才让人不舒服,
,你可以丑的很随意,,他们全家是唐氏,,,,西方现在很聪明,
,但别丑的那么刻意,,在广东住了十几年不知道广东人长什么样,,,,不会直接丑化我们了,
,互联网上有水军,,,,,,会找我们国内行业比较优秀的人,
,|,,你又懂了,,,,做出优秀的作品内容,
,我希望你后代都长这个样,,,,,,温柔的丑化我们,
,能不能不要扭曲事实,,奂,,,,潜移默化的影响我们,
,抹黑就是抹黑了,,你是真搞笑,,,,让我们接受他们设计的我们,
,不只是因为难看,,你自己知道自己在说什么吗,,,,前段时间一个汉服走秀,
,更是因为它所代表的深层含义,,\,,,,模特儿都是小眼睛,
,明白吗,,你从垃圾桶翻票根的样子我很喜欢,,,,妆容也怪怪的,
,有特色的普通人,,老主旋律了,,,,收钱了,
,那还是普通人嘛,,经典立场优先不可撼动,,,,大家不用看了,
,你妹广东人不是这个样,,废话你投钱不夸是吧,,,,散了吧,
,难怪国产剧滤镜都开足,,回归到唐氏综合征,,,,前段时间,
,伯,,在家里也可以看动物世界,,,,一个汉服走秀,
,选错了啊,,净会偷换概念,,,,模特都是小眼睛,
,俎,,别扯淡,,,,化妆也怪怪的,
,O,,你同学这么宽的眼距,,,,就是陈漫那个柔和版的,
,抵制,,一定是小眼睛,,,,但是汉服还原的好,
,没别的,,日漫本来就不是写实风,,,,舞台设计的好,
,丑化中国人,,硬吹,,,,所有人都在传播宣传说弘扬了传统文化,
,谁洗都没用,,我要去看了,,,,没有注意到哪儿不对,
,一句话,,别拉着哪吒一块坐牢,,,,和这个电影一样,
,作为创作者应该致力打破西方的丑化而不是为了这样那样的目的而谄媚遵从,,为什么哪吒能起来这个火不起来,,,,我们就默默的接受了这,
,剧情很一般,,走尼玛可爱,,,,乐死了,
,不过舞狮是拍的不错,,一般强调没收钱的都是收钱了,,,,放屁,
,这剧情烂到家还优秀呢,,使劲吹,,,,x,
,美式剧情,,正好大家看看你是什么玩意,,,,傻,
,剧情难看死了,,光是音乐就很好,,,,笔,
,不是长得好不好看的问题,,祝愿喜欢雄狮少年的人永远与雄狮少年长的一样,,,,乐了,
,是让人联想到恶心的东西,,别人连着二鬼子忽悠你几句,,,,我还以为有什么东西呢,
,这人看着像个猴子,,你就真信了,,,,就这,
,为什么不能上升到什么高度,,祝愿喜欢雄狮少年的人永远与雄狮少年长的一样,,,,就硬洗,
,不敢上升到什么高度不是恰恰说明他本质有问题,,一定有个美国爸爸,,,,你这样不就牵强了吗,
,有一些道理,,我只想说你对不起这么多关注你的人,,,,m,
,就硬轻描淡写了呗,,住十几年,,,,洗,
,主是不是收了黑钱了,,敢情导演住了那么久,,,,呢,
,柠檬水可一点都不恶心,,身边人都长这样,,,,锎,
,我看那个眯的掉梢眼就没兴趣了,,保护,,,,一个广东人表示不接受人物造型,
,这哪是普通人,,呢,,,,而且动画起到的效果是污蔑我们广东,
,太有特点了太不普通了,,眯眯,,,,锎,
,啊这,,的小斜眼,,,,这个已经引起了生理不适了,
,听君一席话,,真好看,,,,,
,如听一席话,,后半部分好看的,,,,就这个缺点已经让人恶心了,
,剧情不错,,同意,,,,就打走大多观众,
,真的很不错,,全员眯眯眼,,,,狗都不看,
,剧情也不行啊,,没问题,,,,敏感肌也能用,
,老理中客啊,,你子子孙孙世世代代都长这样,,,,孩子吃了说很好吃,
,明晃晃的歧视,,眼睛可以小,,,,下次再买一箱,
,还能理中客,,但是不可以眯眯眼呀,,,,收钱办事,
,呵呵,,为啥全是傅满洲啊,,,,不寒碜,
,狗都不看,,投诉了,,,,哎,
,魔童哪吒有很多人出仿妆,,观众说的是造型丑吗,,,,怎么拉的下这个脸的,
,雄狮少年有多少人敢出仿妆,,是说造型太刻意,,,,我就纳闷儿,
,看见这张脸就别扭,,偷梁换柱的人不就是你吗,,,,这收了多少钱,
,这也不写实,,对长相差评有什么异议吗,,,,潜移默化的影响你的思维,
,脸看着这么不协调的普通人也少,,难道长相不差吗,,,,这不含商业推广,
,主角可以不好看,,主要说清楚是内容不差,,,,最好,
,为啥所有人都这种小眼睛,,是这意思吧,,,,白皮也这么觉得,
,不是故意的,,不买票,,,,内容形象完美,
,北京猿人,,等网络点播,,,,这电影想走黑红路线,
,第一部为票房差而高兴的国产片,,另外还有个细节,,,,就这故事,
,唔想被h笨,,咸鱼强喝的是玉冰烧,,,,看片头,
,对啊,,说的好,,,,分钟就已经知道结局了,
,很多香港明星都是粤血统,,我不看,,,,F,
,不见人家长这样,,好看个毛,,,,技术很好,
,反正我全家都是打大眼睛,,嗯,,,,艺术不行,
,近视的人没戴眼镜看东西的时候才会眯眯眼吧,,内部人员,,,,九连真人,
,文化的核心是精神,,我后悔了还我币,,,,撺,
,刻意迎合西方就谈不上是中国精神,,这么棒的电影,,,,恶心,
,我去,,票房一定破,,,,真特么恶心,
,这个跑步动作,,亿了吧,,,,别侮辱哪吒,
,凌晨场次票价都,,你觉得这是丑的,,,,哇哦,
,了现在才刷到,,陈漫,,,,给不少钱去让很多,
,亿,,清美,,,,洗,
,前排提醒,,满大人,,,,票房还是那样哈哈,
,主尬洗,,三只松鼠丑都要丑得一样,,,,活该,
,因为不好看,,全是这种斜眯眼,,,,刚看完,
,剧情不错,,你还真觉得这是单纯颜值不高,,,,确实真的很好看,
,有烂钱,,句句致命,,,,又拉黑一个,
,一起恰,,有人急了,,,,我呸,
,不会的,,现在在偷换概念,,,,垃圾,
,导演说拿出,,如果你没恰钱,,,,Q,
,个亿刷票房,,你出门未归,,,,恶心,
,所以只要总票房,,等等,,,,垃圾,
,亿就赚了,,你是不是偷换概念啦,,,,不是帅哥美女也应该是个正常人吧,
,很理性的说,,你也和那些水军是同一类人呐,,,,外星人过分了吧,
,狗都不看,,好家伙,,,,锴,
